순위,ISBN,상품번호,상품명,판매가,YES포인트,저자,출판사,설명,출고예상일,관리분류
36,9788960862876,4224792,완벽의 추구,"11,700원",650원,탈 벤-샤하르/노혜숙,위즈덤하우스,"하버드대 최고의 긍정심리학 교수인 탈 벤-샤하르는 우리가 행복하지 못한 원인을 우리 사회에 넘쳐나는 ‘완벽주의에 대한 강요’ 때문이라고 말한다. 지나친 완벽에 대한 강요가 사람들을 생의 끝, 극단의 그곳으로 밀어내고 있는 것이다. 『해피어』로 치열한 경쟁과 스트레스에 갇혀 있는 하버드대생들에게 행복학 열풍을 일으킨 탈 벤-샤하르는 이번 신작 『완벽의 추구』를 통해 현대인들이 행복하지 못한 이유가 ‘완벽을 추구하기 때문’임을 이같이 역설한다.",3,국내도서-자기계발
37,9788954611275,3848527,어디선가 나를 찾는 전화벨이 울리고,"10,350원",570원,신경숙,문학동네,"""살아 있으라, 마지막 한 모금의 숨이 남아 있는 그 순간까지 이 세계 속에서 사랑하고 투쟁하고 분노하고 슬퍼하며 살아 있으라."" 『엄마를 부탁해』 그 이후, 신경숙의 신작 장편소설 청춘은 사랑의 기쁨과 상실의 아픔, 달랠 길 없는 불안과 고독의 순간들이다. 인생의 가장 아름답고 파랗게 빛나는 이 시기에, 우리는 가장 크게 웃고, 울고, 기뻐하고, 좌절하며, 사랑하고, 헤어지고, 그러면서 성장한다. 우리가 '청춘'이라고 부르는 순간은 태어나서 살고 죽는 사이에 가장 찬란한 순간.",1,국내도서-소설/시/희곡
38,9788925540269,4236351,잠수네 아이들의 소문난 영어공부법 입문로드맵,"12,150원",680원,이신애,랜덤하우스코리아,"교육정보 일등 사이트 잠수네 10여 년, 많은 회원 아이들이 검증한 영어학습법! 1997년 제주도에 살던 저자는 제주도 해녀들이 바다에서 전복을 따내듯, 인터넷 바다에서 보물을 캐낸다는 의미로 ‘잠수’라는 대화명을 사용한 것을 시작으로 '잠수네 커가는 아이들'이 생기게 되었다. 이 책은 대표 교육정보 사이트 '잠수네 커가는 아이들'에서 10여 년간 많은 회원 아이들이 검증한 영어공부법과 방대한 교재 목록을 수록했다.",3,국내도서-가정 살림
39,9788993242317,4142378,너는 기적이야,"9,000원",500원,최숙희,책읽는곰,"아이의 마음, 엄마의 마음, 그 내면의 진실 우리나라를 대표하는 스타 그림책 작가 최숙희가 말해주는 엄마와 아이의 마음을 담은 동화책입니다. 『너는 기적이야』는 꼬박 아홉 달을 뱃속에 품어서 처음 세상에 나온 아이를 만나서 그 아이가 성장하는 순간 순간에 엄마들이 느끼는 감동과 생각들을 담고 있습니다.아이가 태어나면 엄마들의 시간은 새로운 시간대로 바뀝니다. 아이가 눈을 뜰 때 아침이 시작되고, 아이가 잠이 들 때 저녁이 시작되지요.",1,국내도서-유아
40,9788934940241,4049476,21세기 먼나라 이웃나라 13,"10,710원",600원,이원복,김영사,"당대 주요 인물, 사건들을 통해 바라보는 파란만장한 중국 근대사! 유럽 6개국, 가깝지만 먼 나라 일본, 우리도 몰랐던 스스로의 모습 우리나라, 세계 최강대국 미국까지 모두 아홉 개 나라를 소개하며 국민 교양 만화로서의 자리를 확고히 다진 「21세기 먼나라 이웃나라」 시리즈. 이원복 교수는 그 열 번째 나라로 미국과 어깨를 나란히 하며 G2로 불리기까지 급성장한 중국을 선택했습니다.",3,국내도서-어린이
41,9788947527545,3801126,스눕,"14,400원",800원,샘 고슬링/김선아,한국경제신문사(한경비피),"당신의 물건이 당신의 모든 것을 말해준다! 척 보면 아는 '통찰의 예술' 지난 10년 동안 인간이 어떻게 숨겨진 자신의 내면을 외부로 투영 또는 감추려 하는지에 관해 연구하고, 기발하고 독특한 연구 성과로 전미 심리학회의 주목을 받고 있는 저자인 샘 고슬링 박사가 쓴 개인과 관련된 장소를 통해 개인의 성향이나 이미지를 파악할 수 있는 노하우를 다양한 사례로 소개하는 책이다.",2,국내도서-자기계발
42,9788990700582,3103556,해커스 토익 Reading 리딩,"17,860원",190원,데이비드 조,해커스어학연구소,"문법 · 독해 · 어휘에서 실전까지 대비한 토익 기본서 최신 경향을 반영하여 문법, 독해, 어휘를 종합 구성한 토익 리딩의 기본서. 또한 많은 최신의 실전문제를포함하고 있는 실전서이기도 하다. Grammar 섹션의 일목요연한 포인트 문법설명과 Vocabulary/Reading 섹션의 출제유형 및 핵심 전략으로 토익의 경향을 정리한 후, 실전보다 더 실전다운 토익 문제를 풀어봄으로써, 가장 효율적이고도 확실한 방법으로 토익실전을 대비할 수 있도록 하였다.",3,국내도서-국어 외국어 사전
43,9788990794529,2299464,사랑해 사랑해 사랑해,"9,970원",100원,신형건/버나뎃 로제티 슈스탁/캐롤라인 제인 처치,보물창고,"기억나니? 네가 아기였을 적에 엄마 품에서 셀 수도 없을 만큼 듣고 또 들은 그 말. '사랑해 사랑해 사랑해...' 귀엽고 예쁜 우리 아가를 무릎에 앉혀 놓고 얼마나 사랑하는지 표현해 주세요! 숨을 쉬고, 밥을 먹고, 배설을 하는 것처럼 ‘책읽기’는 당연하게 여겨져야 하는 것 중의 하나입니다. 아기이기 때문에 어른들보다 작은 숨을 쉬고, 적게 먹을지는 모르지만 아기에게도 이 모든 것은 절대적으로 필요합니다.",1,국내도서-유아
44,9788992647861,3683508,혼창통,"12,600원",700원,이지훈,쌤앤파커스,"수많은 초일류기업의 CEO, 경제경영 석학들에 대한 심층 취재를 바탕으로 그들의 이야기에 일관되게 흐르고 있는 메시지와 키워드를 발견하여 공개한다. 『혼창통』, 이 책은 모든 성공과 성취의 비결로 3가지의 키워드, 바로 혼(魂). 창(創). 통(通)을 꼽고 이와 관련된 강력한 통찰과 실천적이면서도 종합적인 해법들을 제시하고 있다.",3,국내도서-경제 경영
45,9788937847677,4286087,내일은 실험왕 15,"10,620원",590원,곰돌이 co./홍종현,미래엔아이세움,"신나는 실험 이야기를 통해 아이들에게 어려운 과학 원리와 용어를 쉽고 재미있게 전달하는 실험 대결 만화 『내일은 실험왕』 15권입니다. 개성 만점 주인공들은 박진감 넘치는 실험 대결을 통해 초등학교 고학년과 중학 교과서에 수록된 다양한 실험 속의 과학 이론과 용어들을 쉽고 재미있게 설명합니다. 또한, ‘실험 키트’를 함께 구성하고 있어 책 속에서 다루고 있는 과학 내용을 직접 실험해 볼 수 있도록 했습니다.",2,국내도서-어린이
46,9788970636511,3728405,지성에서 영성으로,"15,300원",850원,이어령,열림원,"한국의 대표적 논객, 이어령의 신앙 고백기 우리 사회의 대표적 논객 이어령이 어떤 과정을 통해서 지적 영역에서 영적 영역으로 옮겨오게 되었는지를 서술한 책이다. '저항의 문학'을 기치로 내세우는 등, 저자는 문단의 역동성과 용기를 강조하며 지성인에게 경종을 가해 왔다. 그러던 그가 지적 영역에 아닌 영적 영역의 중요성을 역설하며 그리스도교인으로 거듭나며 예수의 길을 따르기 시작했다. 그는 어떤 내면적인 번뇌와 성찰을 거쳤을까.",3,국내도서-종교
47,9788950926267,4224521,린치핀,"13,500원",750원,세스 고딘/윤영삼,21세기북스,"공장이 원하는 직원은 기계를 효율적으로 운영할 수 있는 사람, 고분고분 말 잘 듣고 보수를 조금 줘도 되고 언제든 쉽게 바꿔 낄 수 있는 톱니바퀴 같은 사람이다. 오직 경쟁력과 효율성만이 기업과 인간의 존재 가치를 결정한다. 세스고딘은 이런 현실에 대해 현대 공장 시스템이 우리를 노예로 만들었다고 주장한다. 그의 주장처럼 우리는 이런 공장 시스템에 자신을 끼워 맞추기 위해 스펙을 쌓고 창조성을 죽이고 천재성을 억압해온 것이 사실이다.",3,국내도서-자기계발
48,9788901110806,4183486,FBI 행동의 심리학,"12,600원",700원,조 내버로/마빈 칼린스/박정길,리더스북,미국 최고의 비언어 행동전문가가 공개하는 행동의 메커니즘과 인간심리를 간파하는 법! 전직 FBI요원이자 행동전문가인 조 내버로가 전하는 상대방의 몸짓과 표정을 읽음으로써 사람의 마음을 간파해 효과적인 커뮤니케이션을 할 수 있는 기술을 담은 책. 책은 단순히 특정 행동이 아닌 인체의 메커니즘과 심리를 총체적으로 분석해 불필요한 오해를 없애고 효과적으로 의사를 전달할 수 있는 방법을 전한다. 이를테면 얼굴은 능숙하게 거짓말을 하고 있어도 변연계는 생존을 위한 다른 생체 반응을 지시한다.,1,국내도서-자기계발
49,9788984812963,3410163,친구가 되어 주실래요?,"11,700원",650원,이태석,생활성서사,"의술로, 음악으로 사랑 나누는 선교 사제 쫄리 신부의 아프리카 이야기 한 수도 사제의 아프리카 사랑 이야기이다. 물질적 가난을 풍요로 바꾸어 줄 수 없지만 그 고통과 가난을 함께하며 사는 신부의 삶이 감동적으로 그려진다. 사제라는 신분을 넘어 서서 평범한 이웃의 한 사람으로, 아픈 곳을 살피고 치료해 주는 의사로, 그리고 다양한 악기와 즐거운 노래를 가르치는 음악 선생님으로, 가난한 이들의 친구로 살아가는 저자의 체험이 담긴 따뜻하고 감동적인 휴먼 에세이이다.",3,국내도서-종교
50,9788952755988,3472567,아이의 사생활,"15,120원",840원,EBS 아이의 사생활 제작팀,지식채널,"내 아이의 과거, 현재, 미래를 잇는 이해와 감동 보고서 2008년 2월 EBS에서 방송되어 센세이션을 불러일으킨 다큐멘터리 '아이의 사생활'을 책으로 엮었다. '아이의 사생활'은 어른들이 막연히 생각해오던 우리 아이들의 성격과 지능, 남녀의 차이 등을 과학적으로 증명하고 인간 내면에 대한 탐구와 이해를 바탕으로 한 자녀양육 해법을 제시함으로써, 과학다큐는 딱딱하다는 선입견을 깨고 시청자와 언론의 찬사를 받았다.",1,국내도서-가정 살림
51,9788996478201,4083745,달 샤베트,"9,000원",500원,백희나,Storybowl(스토리보울),"똑.....똑..똑 어! 이게 무슨 소리지? 커다란 달이 똑똑 녹아내리고 있어요! 『달 샤베트』는 『구름빵』 작가 백희나의 두 번째 창작 그림책으로, 작가는 몹시도 더운 어느 여름 밤 자꾸 더워지고 있는 지구를 걱정하다가 떠오른 이야기를 아기자기한 그림으로 옮겨 놓았습니다. 더운 날씨에 하늘에 매달려 있는 달이 너무나 더워보였고, 이러다 달도 녹아버리겠네.. 하는 생각 끝에 그녀는 정말 달이 녹으면 어떻게 될까? 하고 상상해보았다고 해요.",3,국내도서-유아
52,9788992647526,4121699,공피고아,"12,600원",700원,장동인/이남훈,쌤앤파커스,"'공피고아 攻彼顧我' 이는 바둑의 기본전략으로 '상대를 돌아보기 전에 나를 돌아보라'는 뜻이다. . 회사는 '일'을 배우는 곳인 동시에 '사람'을 배우는 곳이다. 매일 수 많은 인간관계 속에서 일하는 비즈니스 맨들은 일도 일이지만 일을 제대로 하기 위해서라도 사람에게 잘하는 법은 반드시 익혀야 한다. 그렇지 않으면 일도, 비즈니스도, 사람도 알지 못하는 아마추어로 이 회사 저 회사를 덧없이 떠돌 수밖에 없게 되기 때문이다.",3,국내도서-자기계발
53,9788974254896,2547786,꿈꾸는 다락방,"12,150원",670원,이지성,국일미디어,세상에는 일평생 허리가 휘도록 일하고도 자기 집 한 채 장만하지 못하는 사람들이 있는가 하면 놀 것 다 놀면서도 어마어마한 재산을 마련하고 엄청난 유명세를 타는 사람들이 존재한다. 노력이 성공의 비결이라는 것이 이론적으로도 말이 안 되는 것은 ‘세상에는 당신과 같은 나이이지만 당신보다 열 배 스무 배 성공한 사람들이 존재한다.’는 사실만 보더라도 알 수 있다. 만일 노력이 성공의 비결이라면 그들은 당신보다 열 배 스무 배 더 많이 노력한 사람들이어야만 한다.,3,국내도서-자기계발
54,9788937483141,4179476,그녀에 대하여,"9,000원",500원,요시모토 바나나/김난주,민음사,"황망히 세상을 등진 영혼에게 바치는 따뜻한 레퀴엠 한국 독자들에게 큰 사랑을 받고 있는 작가 요시모토 바나나의 신작. 이번 작품은 부모를 여읜 사촌 유미코와 쇼이치가 읽어버린 과거를 찾아 떠난 여정에서, 과거를 대면하고 이를 통해 위안과 치유를 얻는 과정을 그리고 있다. 이 작품이 절대 밝은 내용은 아니지만, 작가는 우울한 시대에 이런 슬프고 애틋한 분위기의 소설에 잠기는 것이 오히려 치유가 되리라 믿고 저술했다고 밝혔다.",3,국내도서-소설/시/희곡
55,9788991204775,4240289,인생이 우리를 위해 준비해 놓은 것들,"11,700원",650원,대프니 로즈 킹마,비즈니스북스,"인생의 다양한 시련과 위기, 삶의 전환점을 맞고 있는 사람들에게 다시 살아갈 힘을 주는 희망과 치유의 메시지를 전하는 책. 저자는 그동안 심리상담을 통해 만난 사람들의 실제 사례와 자신의 경험을 토대로 인생의 막다른 골목에 몰린 사람들에게 꼭 필요한 심리적, 정신적 치유법 10가지로 정리했다.",3,국내도서-자기계발
56,9788937848254,4217894,스위스에서 보물찾기,"8,820원",490원,곰돌이 co./강경효,미래엔아이세움,"스위스의 건국 이념이 깃든 유물, 뤼틀리 동맹 서약서를 찾아라! 보물을 찾아 전 세계를 여행하면서 각 나라의 역사와 문화를 만화로 알아가는 「세계 탐험 만화 역사상식」 시리즈. 보물찾기 짱이 모험을 떠나는 스물다섯 번째 나라는 스위스입니다. 유럽의 중앙에 위치한 스위스는 아름다운 알프스의 자연과 평화를 사랑하는 중립국의 이미지로 우리에게 잘 알려져 있습니다. 한반도의 4분의 1정도밖에 되지 않는 작은 국토에서 사용하는 언어만 해도 네 가지나 되는 독특한 나라지요.",1,국내도서-어린이
57,9788934940067,4038245,"나는 아직, 어른이 되려면 멀었다","9,900원",550원,강세형,김영사,"라디오 작가로 활동하는 강세형이 테이의 뮤직아일랜드, 이적의 텐텐클럽, 스윗소로우의 텐텐클럽에서 쓴 원고들을 모아서 만든 라디오 에세이이다. 글들이 방송되었던 당시 코너의 제목인 '청춘, 그 길에 서서' '기억, 한 컷' '어떤 하루'를 소제목으로 정했다. 그녀는 무엇이든 보고 듣는 걸 좋아하는 사람이었고, 좋아하는 책, 영화, 그림, 만화들을 접하기 위해 아르바이트로 방송작가 일을 시작했다.",1,국내도서-에세이
58,9788990700568,3103577,해커스 토익 Listening 리스닝,"17,860원",190원,데이비드 조,해커스어학연구소,"유형별 접근을 통해 실전 공략한 토익 기본서 최신 경향을 반영하여 Part1에서 Part4까지 종합 구성한 토익 리스닝의 기본서이다. 또한 많은 최신의 실전문제를 포함하고 있는 실전서이기도 하다.각 파트별로 소개된 고득점 전략을 토대로 '기초 다지기'와 '실전 고수 되기'까지 토익 리스닝의 핵심을 단계별로 충분히 습득한 후, 풍부하게 수록된 실전 문제를 풀어봄으로써, 가장 효율적이고도 확실한 방법으로 토익실전을 대비할 수 있도록 하였다.",3,국내도서-국어 외국어 사전
59,9788996073901,2833535,존 아저씨의 꿈의 목록,"8,100원",450원,존 고다드/임경현/이종옥,글담어린이,"『존 아저씨의 꿈의 목록』은 시험성적에 쫓겨 아무 꿈도 꾸지 못하는 지금의 어린이들에게 꿈에 대한 소중함과 꿈을 이루는 방법을 알려주는 책이다. 그의 이야기를 통해 어린이들은 단지 선생님이나 연예인이 되고 싶다는 천편일률적인 꿈에서 벗어나 자유롭고 다양한 꿈을 꿀 수 있게 될 것이며, 꿈을 기록하는 것이 꿈을 이루는데 어떤 의미를 지니는 것인지 자연스럽게 배우게 될 것이다.",1,국내도서-어린이
60,9788963700342,3631444,덕혜옹주,"10,620원",590원,권비영,다산책방,"비극적 삶을 살다간 조선의 마지막 황녀가 소설을 통해 다시 살아난다 조선왕조의 마지막 핏줄이었던 덕혜옹주의 비극적 삶을 다룬 소설이다. 고종황제의 막내딸, 조선 최후의 황족, 덕수궁의 꽃이라 불렸던 덕혜옹주는 태어난 순간부터 철저히 정치적 희생자로 살아가게 된다. 어린 나이에 고종황제의 죽음을 목격한 후, 일본으로 끌려가 냉대와 감시로 점철된 십대 시절을 보낸 그녀는 일본 남자와의 강제결혼, 10년 이상의 정신병원 감금생활, 딸의 자살 등을 겪으면서 정서적으로, 신체적으로 쇠약해진다.",3,국내도서-소설/시/희곡
61,9788925269740,4290498,내 여동생이 이렇게 귀여울 리가 없어 6,"6,300원",350원,후시미 츠카사,대원씨아이(단행)(대원키즈),위험해. 키리노 위험하다. 내 동생 진짜 위험해. 우선 건방지다. 이건 오만불손 정도가 아니야. 완전 초 고자세다. “너 대체 뭐냐?” 라고 동생한테 물어보면 “쳇” 하고 혀를 차는 데서 그치지 않고 팔짱을 끼고서 “시끄러” 라며 되레 노려본다. 완전 대단해! 조심한다는 생각이 없다니까. 동생이니 오빠를 공경하고 좀 더 사이좋게 지내야 하는 거 아니냐―고 생각했던 시기가 물론 내게도 있었습니다. 하지만 키리노는 달라. 그런 건 신경도 안 쓴다고. 오히려 의기양양해할 정도다.,3,국내도서-만화/라이트노벨-라이트노벨
62,9788958072690,3585904,세계사를 움직이는 다섯 가지 힘,"11,700원",650원,사이토 다카시/홍성민,뜨인돌,"인류 역사에 대한 통찰력과 분석력은 단지 과거의 이야기를 이해하기 위해서만이 아니라 우리가 당면한 현실을 정확히 읽어내고 현재의 문제들에 대한 해결책을 찾기 위해서도 절대적으로 필요한 부분이다. 『세계사를 움직이는 다섯 가지 힘』은 세계사를 관통하는 커다란 이슈들을 중심으로 역사 전반을 날카롭게 분석하며, 인류가 지나온 자취를 꼼꼼히 살피고 사유하게 하는 다양한 시각을 제시한다.",1,국내도서-역사
63,9788964804032,4224992,베란다 채소밭,"12,420원",690원,박희란,로그인,"채소값이 나날이 오르고 있는 요즘, 주부들은 시장 보기가 두렵다. 또한, 중국산 저질 식품이나 농약과 같은 안전 문제도 채소를 사기 망설이게 하는 요소 중 하나다. 이 책은 텃밭이 없어도 집에 있는 베란다만으로도 채소와 과일을 키우는 방법을 소개한다. 우리집 베란다 사용설명서를 시작으로 채소밭 준비불, 가드닝 용품, 씨앗심기 등 채소밭에 관한 기초적인 부분부터 짚어준다.",1,국내도서-가정 살림
64,9788960971509,3677542,하나님의 대사 1,"10,800원",600원,김하중,규장,"직업외교관으로서는 최장수 기록인 6년 반 동안 주중대사를 지낸 김하중 장로(온누리교회, 전 통일부 장관)의 기도지침서. 저자는 서두에서 '이 책은 하나님나라 진척과 하나님나라 백성을 섬기는 데에 하나님께서 어떻게 내 기도를 인도하셨고, 어떻게 신묘막측하게 응답하셨고, 어떻게 하나님의 때에 하나님의 사람들을 만나게 하셨는가에 대한 나의 소박한 ‘기도행전’(祈禱行傳)이다'라고 고백하고 있다.",1,국내도서-종교
65,9788901078588,2837275,서른살이 심리학에게 묻다,"10,800원",600원,김혜남,갤리온,"『서른 살이 심리학에게 묻다』는 심리학이 서른 살의 삶과 일, 사랑, 인간관계에 대해 들려주고 싶은 이야기들을 담고 있는 책이다. 저자는 ‘내 인생, 도대체 뭐가 문제인 걸까? 진정 내가 원하는 것은 무엇일까? 내게도 다시 사랑이 올까?’ 등을 고민하며 방황하는 서른 살을 위해 35개의 테마로 나누어 삶이 외롭고 우울한 진짜 이유들을 분석한다. 그리고 왜 서른 살은 마음먹은 만큼 성공할 수 있는지, 왜 더 뜨겁고 간절하게 사랑할 수 있는지, 왜 마음껏 행복해질 수 있는지를 밝히고 있다.",1,국내도서-인문
66,9788990700346,2140120,해커스 토익 보카 Vocabulary,"12,250원",130원,데이비드 조,해커스어학연구소,"주제별 연상학습 기능을 수행하는 구성으로 30일만에 토익 기출 단어를 섭렵할 수 있도록 하고 있다. 파트별 선별 학습으로 자신의 취약파트를 전략적으로 강화할 수 있도록 하였고, 반복 학습을 위한 엄선된 퀴즈와 실전문제를 통해, 효율적으로 학습할 수 있도록 하였다. 해커스토익 사이트(www.hackers.co.kr)와 챔프스터디 사이트(www.champstudy.com)를 통해 피드백과 온라인 자료를 받을 수 있도록 하였고, 다양한 MP3 버전을 통해, 입체적인 공부를 할 수 있도록 하였다.",3,국내도서-국어 외국어 사전
67,9788925268156,4269458,바보와 시험과 소환수 7.5,"6,300원",350원,이노우에 겐지,대원씨아이(단행)(대원키즈),"사소한 계기로 시작된 게임이 소악마 두 사람에게 유린당하는데?! 「나와 다우트와 남자의 존엄」. 학원장의 달콤한 제안=참극의 복선! 「나와 본심과 소환수」. 요시이가의 식탁에 지옥의 문이 입을 벌린다! 「나와 경품 제비뽑기와 어둠의 잡탕전골」. 고등학교 1학년의 봄, 독일에서 갓 귀국해 당혹스럽기만 한 미나미였는데―. 「나와 일본과 모르는 말」.",3,국내도서-만화/라이트노벨-라이트노벨
68,9788936433765,3962367,강남몽,"10,800원",600원,황석영,창비,"한국 현대문학의 거장 황석영이 개발과 성장을 향해 멈출줄 모르고 달려온 한국사회를 말하다 무너져 내린 자본주의 사회에 깔린 수많은 사람들의 외침! 1994년, 멀쩡하다고 생각되었던 다리가 무너지는 모습을 보며 TV앞을 떠나지 못했던 아침이 있었다. 1995년, 멀쩡하게 보인 삼풍백화점이 무너져 건물 잔해에 깔린 수많은 사람들을 보며 눈물을 글썽였던 저녁이 있었다. 이 두 사건은 멈출 줄 모르고 질주해온 개발시대의 욕망과 그 치부를 적나라하게 드러낸 사건이었다.",3,국내도서-소설/시/희곡
69,9788934933151,3237211,아웃라이어,"11,700원",650원,말콤 글래드웰/노정태,김영사,"“타고난 지능, 탁월한 재능, 끊임없는 열정과 노력이 정말 성공을 보장하는가? 그동안 우리가 알고 있던 성공의 비결은 모두 틀렸다!” 빌 게이츠는 타고난 컴퓨터 천재인가? 모차르트는 위대한 클래식 신동인가? 빛나는 성공을 거둔 사람들에게는 정말 평범한 사람이 감히 근접할 수 없는 재능과 지능, 아니면 그 무언가가 있는 것인가? 『아웃라이어』는 보통 사람의 범위를 넘어서는 비범한 사람, 즉 천재들에 관한 이야기다.",3,국내도서-자기계발
70,9788984314221,4236805,거꾸로 보는 고대사,"10,800원",600원,박노자,한겨레출판,"‘군사적 위대함’이 아니라 ‘문화적 풍성함’에 주목하자 『거꾸로 보는 고대사』는 한국 사회에 대한 통렬한 비판을 해온 저자 박노자가 고조선에서 통일신라시대까지 한반도에서 벌어진 일들을 민족주의 사학에서 벗어나 균형 잡힌 시각으로 바라보고 있는 책이다. 기존의 단일민족과 순수혈통을 강조하는 고대사 서술에서 벗어나, 국제교류가 활발해지고 다문화 사회로 이동하고 있는 새로운 시대에 부합하는 고대사 교육을 위해 쓰여진 것으로 한반도의 선조들이 지니고 있었던 세계성과 다양성에 초점을 맞추고 있다.",1,국내도서-역사
