순위,ISBN,상품번호,상품명,판매가,YES포인트,저자,출판사,설명,출고예상일,관리분류
71,9788937426896,4274976,공감의 시대,"29,700원","1,650원",제레미 리프킨/이경남,민음사,"적자생존과 부의 집중을 초래한 경제 패러다임은 끝났다 이제 세계는 오픈소스와 협력이 이끄는 3차 산업혁명 시대로 접어들었다. 『유러피언 드림』, 『소유의 종말』의 저자 제러미 리프킨의 신작이다. 이 책에서 그는 인류의 공감적 특성이 진화해 온 과정을 들여다보고 지금까지 공감이 우리의 여정을 어떻게 꾸려 왔으며 앞으로 하나의 종(種)으로서 우리의 운명을 어떻게 결정할 것인지 살펴봄으로써 문명사에 새로운 해석을 제시하려는 시도를 보여준다.",1,국내도서-사회 정치
72,9788915102019,1972516,임신 출산 육아 대백과,"16,650원",920원,편집부 저,삼성출판사,"『임신 출산 육아 대백과』 2020년 개정판은 가이드 구성에 충실, 초보엄마들이 궁금해할만한 내용을 사진으로 꼼꼼하게 보여준다. 임신 중 요가, 산후조리, 육아의 기초(신생아 목욕시키기, 옷 입히기 등)의 과정을 사진으로 보여주어 슬라이드를 넘기듯 한눈에 육아의 기초를 알 수 있다. 임신, 출산, 육아의 각 단계를 시간 순서별로 나누어 Step 1부터 Step11로 구분해 필요한 부분을 쉽게 찾아볼 수 있다. 초보엄마들이 실수하기 쉬운 부분, 꼭 알아야 할 부분을 세심한 정보 박스로 정리해 놓치지 않고 볼 수 있게 했다. 귀여운 일러스트 표지를 채택하고 책에 비닐커버를 씌워 활용도를 높였다.",1,국내도서-가정 살림
73,9788992736237,4093642,NTC 영어회화 표현사전,"16,200원",900원,Richard A. Spears,잉크,"17년간 전 세계 영어사용자들에게 인정받아온 ‘표현사전의 바이블’. 책 속에 수록된 7,000여 표현들은 지금 이 순간 미국인들이 실제로 듣고 말하고 쓰는 가장 정확한 영어표현들로, 가벼운 인사부터 쇼핑, 면접, 여행, 전화, 직장생활에 이르기까지 우리가 일상에서 영어로 맞닥뜨릴 수 있는 다양한 대화 상황들을 774개 주제로 정리하고 있다. 미묘한 어감 차이와 문화적인 배경까지 짚어주고 있으며, 주제별/상황별 한글 인덱스로 정리되어, 원하는 표현을 쉽고 빠르게 찾을 수 있도록 도와준다.",3,국내도서-국어 외국어 사전
74,9788925898124,4242150,신의 물방울 25,"4,500원",250원,아기 타다시/오키모토 슈,학산문화사,세계의 시장 가격을 좌우하는 와인평론가 칸자키 유타가가 세상을 떠나면서 시가 20억이 넘는 와인 컬렉션을 남겼다! 그 정점에 선 최고의 한 병이 바로 ‘신의 물방울’-. 그가 선택한 12병의 와인 ‘사도’와 그 정접에 선 ‘신의 물방울’의 이름.생산연도를 알아맞힌 자만이 유산을 가질 수 있다. 이 ‘사도’대결에 친아들 시즈쿠와 양자 잇세가 도전한다.,3,국내도서-만화/라이트노벨
75,9788992814317,4051170,아들은 아빠가 키워라,"10,620원",590원,이충헌,글담,"아들에겐 ‘친구 같은 아빠’보다 ‘양육자로서의 아빠’가 필요하다! 걷기, 말하기부터 시작된 아들의 뒤처짐 현상은 학교에 입학하면서 더욱 뚜렷해진다. 알림장을 제대로 써오지 못하고 숙제는 빼먹기 일쑤다. 부족한 능력을 채워 주기 위해 아이를 붙잡고 공부를 시켜 보지만 5분도 안 돼 이리저리 몸을 비틀어 댄다. 도대체 우리 아들에게 무슨 일이 생긴 것일까?",3,국내도서-가정 살림
76,9788990700469,2691688,해커스 토익 스타트 Reading 리딩,"14,150원",150원,데이비드 조,해커스어학연구소,"해커스 토익 스타트 Reading은 해커스 어학연구소가 토익 입문자들을 위하여 새롭게 선보이는 ‘토익입문서'로, 수년간 축적된 토익 Know-how 중 초보학습자들에게 꼭 필요한 핵심 내용만을 선별하여 한 권으로 압축하였다. 또한 교재 학습효과를 높이기 위하여 무료로 동영상 강의, 온라인 모의고사, 단어 암기 MP3를 제공한다.",3,국내도서-국어 외국어 사전
77,9788936433673,3105115,엄마를 부탁해,"11,700원",650원,신경숙,창비,"섬세하고 깊은 성찰, 따뜻한 시선의 작가 신경숙이 절정의 기량으로 풀어낸 엄마 이야기, 엄마를 통해서 생각하는 가족 이야기, 가장 큰 사랑 이야기. 세상 모든 사람은 엄마의 자식, 우리 모두에겐 나만의 엄마가 있다. 때로 좋기도 밉기도 고맙기도 원망스럽기도 한, 그러나 굳건한 땅처럼 분명하고 단단한 엄마. 어느날, 그 엄마를 잃어버린다. 나이 들고 몸도 성치 않은 엄마를. 서울 사는 자식들 편하라고 아버지 생신을 치르러 시골집에서 올라오던 길, 지하철 서울역에서 아버지 손을 놓친 찰나, 엄마는 꿈처럼 사라진다.",1,국내도서-소설/시/희곡
78,9788952206503,2599166,The Secret 시크릿,"12,420원",690원,론다 번/김우열,살림Biz,"인생을 성공으로 이끄는 ‘위대한 비밀’의 단편들은 오래 전부터 구전과 문학과 종교와 철학에서 발견되었다. 이제 최초로 ‘비밀’의 모든 조각이 하나로 묶여 세계에 소개되었다. 이 책에서 독자는 돈, 건강, 인간관계, 행복 등 삶의 모든 면에서 ‘비밀’을 활용하는 법을 배울 것이다. 내면에 잠재되어 숨겨진 힘을 이해하기 시작할 터이고, 그리하여 모든 측면에서 기쁨을 발견하게 되리라. 『영혼을 위한 닭고기 수프』의 잭 캔필드, 『화성에서 온 남자 금성에서 온 여자』의 존 그레이 등 24명의 대가들이 비밀을 활용해 건강과...",1,국내도서-자기계발
79,9788926390283,4217775,수학도둑 18,"8,100원",450원,송도수/서정은,서울문화사,"사고력과 이해력을 향상시켜 주는 국내 최초 수학논술만화로, 최근 대학 입시에서 제일 중요한 능력으로 요구되는 ‘사고력’ 향상을 도와줍니다. 사고력은 표현력, 창의력, 논증력 등으로 나눌 수 있는데 이러한 능력을 키울 수 있는 과목이 바로 ‘논술’입니다. 『수학도둑』은 흥미진진한 스토리 안에 수학적 개념을 논술과 접목시키므로 수학의 원리와 개념을 자연스럽게 이해하고, 수학을 풀어내는 능력을 키울 수 있도록 구성하였습니다.",1,국내도서-어린이
80,9788976772435,2311313,바보처럼 공부하고 천재처럼 꿈꿔라,"9,000원",500원,신웅진,명진출판,'외교관'이라는 꿈의 씨앗을 가슴속에 품었던 한 시골 소년이 많은 역경을 이겨내고 마침내 유엔 사무총장이 되기까지 과정을 담은 우리 시대의 희망 이야기. 이 책은 반기문 유엔 사무총장의 어린 시절부터 외교관 시절에 걸쳐 그가 꿈을 이뤄가는 이야기를 담고 있다. 저자는 이 책을 취재하고 집필하면서 “그래! 이렇게 꿈을 품고 정직하고 열심히 하면 되는 거구나”라는 가슴이 두근거리는 깨달음을 얻었다고 한다.,3,국내도서-청소년
