순위,ISBN,상품번호,상품명,판매가,YES포인트,저자,출판사,설명,출고예상일,관리분류
53,9788901150628,7486299,"광해, 왕이 된 남자","11,700원",650원,이주호/황조윤,걷는나무,"승정원 일기에서 사라져버린 광해군 8년, 15일간의 행적 “왕이 잠든 사이, 진짜 왕이 깨어났다.” 왕위를 둘러싼 권력 다툼과 당쟁으로 혼란이 극에 달한 광해군 8년. 자신을 노리는 자들에 대한 분노와 두려움으로 점점 난폭해져 가던 광해군은 도승지 ‘허균’에게 자신을 대신하여 위험에 노출시킬 인물을 찾을 것을 지시한다. 이에 허균은 기방의 취객들 사이에 걸쭉한 만담으로 인기를 끌던 하선을 발견한다. 왕과 똑같은 외모는 물론 타고난 재주와 말솜씨로 왕의 흉내도 완벽하게 내는 하선. 영문도 모른 채 궁에 끌려간 하선은 광해군이 자리를 비운 하룻밤 가슴 조이는 가짜 왕노릇을 하게 된다. 그러던 어느 날 광해군이 독이 든 음식을 먹고 쓰러지는 사건이 발생하고, 임금의 빈 자리가 가져올 국정의 혼란을 막기 위해 허균은 하선에게 열흘 간 광해군을 대신하여 진짜 왕이 될 것을 명한다. 저잣거리의 한낱 만담꾼에서 하루아침에 조선의 왕이 되어버린 천민 하선.",3,국내도서-소설/시/희곡
54,9788967254759,7571192,원피스 ONE PIECE 67,"4,500원",250원,오다 에이이치로,대원,"하반신뿐인 사내에다, 추위와 더위가 동거하는 섬.",1,국내도서-만화/라이트노벨
55,9788917945942,7759704,New English 900 Vol.2 뉴잉글리시900,"11,700원",650원,Edwin T. Cornelius/이보영,YBM(와이비엠),"3개월의 기적! - 전국민 영어회화 프로젝트 “누구나 3개월이면 영어로 말할 수 있습니다” 언어학자 Cornelius가 미국 정부의 의뢰를 받아 만든 미국 표준영어 교재이다. New English 900은 전 세계에 미국 표준영어를 보급하고자 미국 국무부가 미시건 대학에 의뢰하여 ELS 학원의 창립자이자 저명한 언어학자인 Edwin T. Cornelius가 오랜 시간 연구하고 구성한 영어교재 English 900의 최신 개정판이다. 1970년대에 대한민국 최초 오디오 교재로 출간되어 최다 판매를 기록했고 전세계적으로 1,600만 부가 팔린 초대형 베스트셀러이다. New English 900의 900개 문장은 낯설지 않다. 초중고 시절 영어를 배운 대한민국 국민이라면 누구나 낯익은 단어로 이루어진 문장들이다. 과장되거나 과도하게 세련된 스타일의 영어가 아닌 실생활에서 실제로 쓰이는 실용적이고 매운 쉬운 문장들이 담겨 있다.",4,국내도서-국어 외국어 사전
56,9788950940768,7860663,언니의 독설,"14,400원",800원,김미경,21세기북스,"""강한 언니 김미경이 독한 애정으로 서른을 코칭한다 “이곳저곳 기웃거리다 ‘직업 객사’ 하고 싶니? 멈추거나 포기하지 말고 더 버텨!” “남자는 주식, 헐값에 사서 금값으로 키워라!” 지난 20여 년간 200만 명의 청중을 만나면서 국민 강사로 자리 잡은 김미경 원장은 29세 때 여성 리더십 강의를 시작해 20여 년 가까이 여성을 리더로 키워온 대표적인 여성 멘토다. 김미경 원장은 이 책을 통해 그동안 현장에서 만난 수많은 워킹우먼들의 고민에 명쾌한 해답을 제시한다. 여성의 30대는 커리어의 갈림길에 서는 중대한 시기다. 직장생활 7~8년 차에 들어선 미혼 여성들은 매너리즘과 막연한 불안감으로 제2의 방황을 시작한다. 30대 중반 정도 되면 안정적인 커리어, 집, 남자 등이 모두 갖춰져야 한다는 압박감을 느끼지만 현실과의 좁혀지지 않는 간극 때문에 힘겨워진다. 결국 이들의 상당수가 도피성 어학연수나 계획에도 없던 대학원을 선택한다.",3,국내도서-자기계발
57,9788996347200,3676308,아기가 잘 먹는 이유식은 따로 있다,"11,520원",640원,김정미,레시피팩토리(단행),"전문가들이 이야기하는 이유식에 대한 정보는 너무나 많다. 하지만 당장 엄마들에게 필요한 것은 오늘 바로 이 순간 우리 아기에게 해줄, 아기가 잘 먹을 이유식 레시피다. 육아 분야의 파워 블로거이자 네이버 대표 육아카페 마더스의 시삽이기도 한 김정미의 『아기가 잘 먹는 이유식은 따로 있다』는 바로 그 레시피가 주인공인 이유식 실전서다.",3,국내도서-가정 살림
58,9788952766458,7370174,그레이의 50가지 그림자 2,"10,800원",600원,E L 제임스/박은서,시공사,"2012년 7월 미국 순문학 출판사인 랜덤하우스 빈티지는 《그레이의 50가지 그림자》가 출간 석 달 만에 시리즈 포함 총 2천1백만 부가 판매되었다고 발표했다. 이는 미국 독서 인구의 25%에 해당하는 숫자로, 스티그 라르손의 ‘밀레니엄 시리즈’가 미국에서 2천만 부 이상 팔리기까지 3년이 걸린 것을 떠올리면 실로 어마어마한 대기록이라 하지 않을 수 없다. 그렇지만 많은 사람들이 《그레이의 50가지 그림자》를 소비하고 좋아하는 가장 큰 이유는 이 책이 사랑 이야기를 다루고 있다는 데에 있다. 어린 시절의 트라우마에 시달리는 한 남자를 사랑이 구원한다. 세상을 모르던 여자가 사랑으로 인해 새로운 세상으로 나아간다. 사랑을 통해 결점을 받아들이고 상대방을 위해 변화하는 이야기는 보편적인 울림이 있다. 수없이 반복되어도 여전히 읽히는 강력한 서사이고 누구나 그런 이야기를 원한다. ‘회색’에도 50가지 다른 톤의 색이 존재할 수 있듯이 똑같은 사랑 이야기에도 여러 가지 빛깔이 있다.",2,국내도서-소설/시/희곡
59,9788990794529,2299464,사랑해 사랑해 사랑해,"9,970원",100원,신형건/버나뎃 로제티 슈스탁/캐롤라인 제인 처치,보물창고,"기억나니? 네가 아기였을 적에 엄마 품에서 셀 수도 없을 만큼 듣고 또 들은 그 말. '사랑해 사랑해 사랑해...' 귀엽고 예쁜 우리 아가를 무릎에 앉혀 놓고 얼마나 사랑하는지 표현해 주세요! 숨을 쉬고, 밥을 먹고, 배설을 하는 것처럼 ‘책읽기’는 당연하게 여겨져야 하는 것 중의 하나입니다. 아기이기 때문에 어른들보다 작은 숨을 쉬고, 적게 먹을지는 모르지만 아기에게도 이 모든 것은 절대적으로 필요합니다.",1,국내도서-유아
60,9788990700582,3103556,해커스 토익 Reading 리딩,"17,860원",190원,데이비드 조,해커스어학연구소,"문법 · 독해 · 어휘에서 실전까지 대비한 토익 기본서 최신 경향을 반영하여 문법, 독해, 어휘를 종합 구성한 토익 리딩의 기본서. 또한 많은 최신의 실전문제를포함하고 있는 실전서이기도 하다. Grammar 섹션의 일목요연한 포인트 문법설명과 Vocabulary/Reading 섹션의 출제유형 및 핵심 전략으로 토익의 경향을 정리한 후, 실전보다 더 실전다운 토익 문제를 풀어봄으로써, 가장 효율적이고도 확실한 방법으로 토익실전을 대비할 수 있도록 하였다.",3,국내도서-국어 외국어 사전
61,9788970650340,1477636,논어,"13,500원",750원,공자,홍익출판사,"『논어(論語)』는 공자와 그 제자들이 세상사는 이치나 교육ㆍ문화ㆍ정치 등에 관해 논의한 이야기들을 모은 책이다. 그 안에는, 공자의 혼잣말을 기록해 놓은 것과 제자의 물음에 공자가 대답한 것, 제자들끼리 나눈 이야기, 당대의 정치가들이나 평범한 마을사람들과 나눈 이야기 등 다양한 내용이 포함되어 있다. 그래서 책의 제목이 『논어』가 되었다고 한다. 공자와 그 제자들이 토론한 이야기라는 의미이다....",3,국내도서-인문
62,9788926332214,7840489,액셀 월드 (ACCEL WORLD) 11,"6,300원",350원,카와하라 레키/김완,서울미디어코믹스(서울문화사),"브레인 버스트에 암약하는 수수께끼의 조직 ＜가속연구회＞. 그들의 총본산인 ＜도쿄 미드타운 타워＞꼭대기에 자리 잡는 ＜대천사 메타트론＞. 완전무식 신수급 에너미의 수호를 받는 ＜가속연구회＞를 타도하기 위해 칠왕회의가 열렸다. 그곳에서 나온 비책이란, 실버 크로우의 새 어빌리티 ＜이론경면＞획득 작전. 메타트론이 뿜어내는 절대 즉사 초구경 레이저에도 견뎌 낼 수 있는 어빌리티를 얻으라는 명령을 받은 크로우. 그러나 ＜심의기＞는 이매지네이션으로 만들어 낸다지만, ＜어빌리티＞는 행동을 트리거로 발현한다. 따라서 이제까지 했던 것처럼 하루유키의 강한 이미지만으로는 ＜이론경면＞ 어빌리티를 얻을 수 없었다. 전혀 실마리가 보이지 않는 하루유키에게, ＜아더 메이든＞ 시노미야 우타이는 슬픈 과거의 이야기를 시작하는데-.",1,국내도서-만화/라이트노벨-라이트노벨
63,9788925896069,7837034,나는 친구가 적다! 유니버스,"6,120원",340원,히라사카 요미,학산문화사(단행본),"『나는 친구가 적다』의 세계를, 지금 주목받고 있는 인기 작가들이 그려 낸다! ● 유우지 유우지 (GA문고 『내 여자친구와 소꿉친구가 완전 수라장』 외) ● 와타리 와타루 (가가가 문고 『역시 내 청춘 러브코미디는 잘못되어 있어』 외) ● 시미즈 유우 (MF문고J 『정령사의 검무』 외) ● 사가라 소우 (MF문고J 『변태왕자와 웃지 않는 고양이』 외) 그에 더해 원작 콤비인 히라사카 요미 & 브리키도 참가한 초호화판! 신선하지만 역시 안쓰러운, 『는가적다』 첫 공식 앤솔로지가 등장!",3,국내도서-만화/라이트노벨-라이트노벨
64,9788956606187,7196969,별을 스치는 바람 1,"10,800원",600원,이정명,은행나무,『뿌리 깊은 나무』『바람의 화원』으로 한국형 팩션의 새로운 장을 열었던 작가 이정명이 이번엔 일제강점기를 배경으로 전쟁과 문학을 이야기한다. 일본 후쿠오카 수용소의 살인사건을 파헤치는 미스터리한 구성 속에 잔인한 전쟁도 결코 죽이지 못한 아름다운 문장과 가슴 뭉클한 휴머니티를 특유의 감성적인 필체로 그려냈다.,3,국내도서-소설/시/희곡
65,9788972217305,5994072,똑똑한 그리기 놀이책,"10,800원",600원,김충원,진선아이,"자신감 UP! 표현력 UP! 학습 효과 UP! 성취감 UP! 빵빵 터지는 창의력을 위한 첫 단추! ‘똑똑한 그리기 놀이책’으로 시작하자! 점과 점을 잇기만 하면 무슨 그림이든 쉽고 간단하게 완성할 수 있어 그리기를 처음 시작하는 아이에게 안성맞춤인 책이랍니다. 주제와 난이도에 따라 점과 점 이어 그리기, 직선으로 이어 그리기, 곡선으로 이어 그리기 총 3개의 장으로 내용을 구분하고, 각 장마다 동물과 자동차, 비행기 등 아이가 좋아하는 재미있는 보기 그림들이 가득하지요.",1,국내도서-유아
66,9788956606194,7196973,별을 스치는 바람 2,"10,800원",600원,이정명,은행나무,『뿌리 깊은 나무』『바람의 화원』으로 한국형 팩션의 새로운 장을 열었던 작가 이정명이 이번엔 일제강점기를 배경으로 전쟁과 문학을 이야기한다. 일본 후쿠오카 수용소의 살인사건을 파헤치는 미스터리한 구성 속에 잔인한 전쟁도 결코 죽이지 못한 아름다운 문장과 가슴 뭉클한 휴머니티를 특유의 감성적인 필체로 그려냈다. 작가는 후쿠오카 형무소를 배경으로 순결한 청년 윤동주와 그의 시를 불태운 냉혹한 검열관 스기야마 도잔의 문장을 통한 대결을 그리는 동시에 태평양전쟁 당시 일본 군국주의자들의 비인간적이고도 잔혹...,3,국내도서-소설/시/희곡
67,9788947528504,7150718,멀티플라이어,"14,400원",800원,리즈 와이즈먼/그렉 맥커운/최정인/고영건,한국경제신문사(한경비피),팀과 조직의 지혜와 창의성을 고갈시키는 사람이 있는가 하면 팀과 조직의 역량을 최고로 이끌어내고 사람들을 더 똑똑하게 만드는 사람이 있다. 상대를 더 탁월하게 만드는 이들을 저자는‘멀티플라이어(multiplier)’라 부른다. 멀티플라이어란 상대의 능력을 최대로 끌어올려 팀과 조직의 생산성을 높이는 리더를 뜻한다. 이들은 함께하는 사람들의 능력을 2배로 끌어올려 자원의 추가 투입 없이도 생산성을 2배 이상 높일 수 있다고 한다.,3,국내도서-경제 경영
68,9788990700469,2691688,해커스 토익 스타트 Reading 리딩,"14,150원",150원,데이비드 조,해커스어학연구소,"해커스 토익 스타트 Reading은 해커스 어학연구소가 토익 입문자들을 위하여 새롭게 선보이는 ‘토익입문서'로, 수년간 축적된 토익 Know-how 중 초보학습자들에게 꼭 필요한 핵심 내용만을 선별하여 한 권으로 압축하였다. 또한 교재 학습효과를 높이기 위하여 무료로 동영상 강의, 온라인 모의고사, 단어 암기 MP3를 제공한다.",3,국내도서-국어 외국어 사전
69,9788950937911,7217944,마법천자문 22,"8,820원",490원,올댓스토리/홍거북,아울북,"손오공의 모험 이야기를 따라가면서 쓰기보다 뜻과 소리를 먼저 읽고 그림으로 한자를 보면서 학습할 수 있도록 한 한자 학습만화입니다. 마법의 주문으로 음과 훈을 읽기 때문에 재미있게 한자를 배울 수 있습니다. 각 권마다 새로 배우는 한자 20자와 복습 한자가 50회 가량 반복되며 8급에서 3급 한자가 함께 구성되어 있다. 쉬운 한자 속에서 어려운 한자까지 자연스럽게 배울 수 있게 했습니다. 반의어, 동의어 등 한자와의 관계를 함께 알려줌으로써 단어를 쉽게 조합하고 해석할 수 있도록 했습니다.",3,국내도서-어린이
70,9788990700902,3718300,해커스 토익 실전 1000제 Reading 1 문제집,"11,300원",120원,해커스어학연구소 저,해커스어학연구소,"토익 최신 출제 경향과 난이도를 반영한 실전 문제집 토익 문제를 완전히 분석한 결과를 토대로 실제 시험의 출제 경향과 난이도를 그대로 반영한 문제와 지문으로 구성하였다. 학습자들은 이 교재 한 권으로 최신 경향의 토익 문제들을 풀어보면서 실력을 향상시킬 수 있다. 토익 최신 출제 경향을 철저히 분석한 결과를 토대로 실제 시험과 가장 유사한 문제와 지문을 수록하였다. 실전보다 더 실전다운 문제를 풀어봄으로써, 학습자들은 실전에 대한 감각을 자연스럽고 확실하게 터득할 수 있다.",3,국내도서-국어 외국어 사전
71,9788974254896,2547786,꿈꾸는 다락방,"12,150원",670원,이지성,국일미디어,세상에는 일평생 허리가 휘도록 일하고도 자기 집 한 채 장만하지 못하는 사람들이 있는가 하면 놀 것 다 놀면서도 어마어마한 재산을 마련하고 엄청난 유명세를 타는 사람들이 존재한다. 노력이 성공의 비결이라는 것이 이론적으로도 말이 안 되는 것은 ‘세상에는 당신과 같은 나이이지만 당신보다 열 배 스무 배 성공한 사람들이 존재한다.’는 사실만 보더라도 알 수 있다. 만일 노력이 성공의 비결이라면 그들은 당신보다 열 배 스무 배 더 많이 노력한 사람들이어야만 한다.,3,국내도서-자기계발
72,9788960865563,7437073,미생 - 아직 살아있지 못한 자 1,"9,900원",550원,윤태호,위즈덤하우스,"인생은 거대한 바둑판 그 위에 던지는 오늘의 한 수! 새벽같이 일어나 기보책을 보며 혼자 바둑돌을 놓아보던 아이였다. 열한 살에 한국기원 연구생으로 들어갔고, 7년간 오직 바둑판 위의 세계에서만 살았다. 그리고… 입단에 실패했다. 아무런 준비도 없이, 도피하듯 사회에 나왔다. 바둑밖에 모르던 삶에서 철저히 바둑을 지운 삶으로… 차갑고 냉정하지만 혼자가 아닌 일터로… 그렇게, 전혀 새로운 삶이 시작되었다. 베스트셀러 『이끼』의 작가 윤태호. 그가 연결하는 바둑과 인생은 어떤 그림일까? 『미생』은 열한 살에 한국기원 연구생으로 들어가 프로기사만을 목표로 살아가던 청년 장그래가 입단에 실패하고 ‘회사’라는 전혀 새로운 세계에 들어서면서 시작된다. 다양한 업무가 숨 돌릴 틈 없이 바쁘게 돌아가는 종합상사의 인턴사원으로 장그래를 밀어 넣었다.",3,국내도서-만화/라이트노벨
73,9788975279218,7829031,로도스도 전기 세트,"81,900원","4,550원",미즈노 료,들녘,"일본 판타지 소설의 시초, 『로도스도 전기 세트』 전권 재출간! 일본 발행부수 1000만부 돌파, 비디오게임과 애니메이션 제작 등 장르문학 최초로 미디머 믹스 전개를 이룬 일본판타지 소설의 시초, 『로도스도 전기 세트』가 원작의 맛을 그대로 살려 출간된다. 국내에서는 90년대 『마계마인전』으로 출간된 이 판타지 소설은 발행부수 40만부에 이르는 공전의 히트를 쳤지만, 일부 편집된 부분이 있어 애독자들의 재출간 요구가 매우 높았다. 재출간 되는 『로도스 전기 세트』는 원저작자 미즈노 료와 원작 일러스트레이터인 이즈부치 유카타 화백의 감수를 받았으며, 고급 양장본으로 전권 동시 출간하여 지금까지 기다려준 독자들을 흡족하게 한다. 『로도스도 전기』는 이후 일본과 한국 판타지 문학에 많은 영향을 준 작품이다. 작중의 세계가 시원始原의 거인에 기원하듯, 한국과 일본의 판타지 문학은 『로도스도 전기』의 영향을 부정하기 어렵다. 미즈노 료는 J.R.",3,국내도서-소설/시/희곡
74,9788993357837,7392481,광수생각,"13,500원",750원,박광수,북클라우드,"그 누구도 대신해 줄 수 없을 때, 오늘, 나에게 감사해 250만 독자의 사랑을 받은 『광수생각』의 박광수가 15년 만에 내놓은 카툰에세이『광수생각: 오늘, 나에게 감사해』. 그동안 지나온 인생의 고비고비에서 스스로에게 위로가 되었던 말을 따뜻한 그림과 함께 써내려간 에세이다. 마흔이 넘도록 살아오면서 어느 것 하나 이룬 게 없다고 생각했기에 스스로에게 칭찬 한 번 안 했다고 말하는 저자가 자신처럼 '스스로를 칭찬하는 데 인색한 사람들'에게 오늘만큼은 나를 인정하고, 감사하고, 안아주자는 메시지를 전한다. 너무 너무 외로운 날, 그 누구에게 감사를 전하기에도 메말라버린 그런 날에 우리는 멈추어 선다. 살다보면 친구의 위로도 소용없는, 누구도 대신 해줄 수 없는 날이 있다. 저자는 그럴 때 우리에게 필요한 건 무엇보다 그동안 애써온 나를 잘 아는, 열심히 달려온 나를 가장 잘 이해하는 사람, 바로 나 자신의 토닥임이라고 말한다.",2,국내도서-에세이
75,9788926393826,7571231,수학도둑 30,"8,100원",450원,송도수/서정은,서울문화사,두 번째 결투자로 나타난 지옥의 바주카맨 세자르가 대결 직전 햇빛을 마주보는 자리에 서는 바람에 눈이 부셔 공격에 어려움을 겪자 두목은 긴급히 자리를 바꾸라고 명령한합니다.,2,국내도서-어린이
76,9788996746416,6262207,나는 까칠하게 살기로 했다,"13,500원",750원,양창순,센추리원,"자존감을 지키며 건강한 인간관계를 유지하는 법 상처받지 않고 사람을 움직이는 관계의 심리학 자신의 자존감을 지키면서도 사람의 마음을 움직이는 심리적 방법을 다양한 임상 사례와 심리학 이론을 통해 쉽고 재미있게 풀어, 우리 일상에 바로바로 적용할 수 있도록 소개한 책이다.",3,국내도서-자기계발
77,9788993734232,7848408,흔들리지 않고 피어나는 마흔은 없다,"12,600원",700원,김병수,프롬북스,"중년의 길목에 들어선 사람들은 온갖 고생을 다해왔지만 아무도 자기 마음을 몰라준다며 ‘인생 헛살았다’고 가슴을 친다. 또한 중년이 되면 몸과 마음이 예전과 다르다는 것을 느끼게 된다. 출근해서 커피 한 잔이라도 마시지 않으면 정신을 차리기 힘들고, 다음 날 아침을 생각하면 술 마시는 것도 겁난다고 한다. 중년엔 강철 같던 마음이 실바람에도 흔들리며 마음의 감기에 걸리곤 한다. 이렇게 중년의 사춘기를 혹독하게 겪는 이들을 위해 이 책은 따뜻한 위로와 함께 스스로 치유할 수 있는 심리 처방전을 제시해준다. 이 책의 저자는 아무런 흔들림 없이, 고함 한 번 지르지 않고 중년의 사춘기를 평탄하게 보내는 것이 꼭 바람직한 건 아니라고 말한다. 깊은 고민에도 빠져보고, 어디로 나가야 할지 몰라 두려움과 혼란을 느껴보는 것이 더 자연스러우며 진정한 어른으로 성숙할 수 있다는 것이다.",2,국내도서-자기계발
78,9788989863786,3428856,100층짜리 집,"8,550원",470원,이와이 도시오/김숙,북뱅크,"각기 다른 동물들이 살고 있는 10층, 20층, 30층… 이렇게 10층씩을 오르는 사이 저절로 1에서 100까지 쉽게 익힐 수 있는 그림책. 등장하는 10종류의 동물-생쥐, 다람쥐, 개구리, 무당벌레, 뱀, 꿀벌, 딱따구리. 박쥐, 달팽이, 거미-의 특징을 기발한 상상력으로 오밀조밀하게 그려놓아 읽는 재미를 한층 더 느끼게 해 줍니다. 또 그림을 통해 각 동물들의 생태까지 상세하게 알 수 있어 이 한 권으로 일석삼조의 효과를 기대할 수 있습니다.",1,국내도서-유아
79,9788996047636,2875607,네가 어떤 삶을 살든 나는 너를 응원할 것이다,"12,960원",720원,공지영,오픈하우스,"『즐거운 나의 집』의 주인공 위녕과 그녀의 엄마를 다시 만난다. 이번에는 소설 속 등장인물이 아닌 진짜 가족의 모습으로. 공지영 작가가 하나뿐인 딸에게 보내는 편지. 아니, 험난한 세월을 살아가는 이 땅의 모든 아들, 딸들에게 보내는 응원의 메시지를 담은 책이다.",3,국내도서-에세이
80,9788993285673,3282781,영어 천재가 된 홍대리,"11,700원",650원,박정원,다산라이프,소설로 읽는 자기계발서로 수익률이 가장 확실한 자기투자인 영어 학습법에 관한 내용을 다루고 있는 책이다. 이 책은 영어는 공부가 아니라 훈련이며 영어는 책상에 앉아 단순 암기를 하거나 이론적 전개를 하는 시험과목이 아니라 일종의 운동과 같이 ‘트레이닝’해야 변화할 수 있는 언어라고 말하면서 우리 주변에서 흔히 볼 수 있는 직장인인 홍대리를 모습을 통해 영어학습에 성공하는 방법을 소개하고 있다.,2,국내도서-자기계발
