순위,ISBN,상품번호,상품명,판매가,YES포인트,저자,출판사,설명,출고예상일,관리분류
68,9788974797683,7019229,받아들임,"17,820원",990원,타라 브랙,불광출판사,"어떻게 해야 자책과 후회 없이 나를 사랑할 수 있을까? 틱낫한 스님과 혜민 스님이 추천한 ‘나를 사랑하는 법’ “나는 정말 쓸모없는 인간이야!” “나는 정말 사랑받고 있을까?” 일이 실패로 돌아갔거나 외로움이 밀려들 때 우리는 흔히 이런 생각에 빠져든다. 이런 자책과 의심을 붓다는 “두 번째 화살”이라 부르며, 이 화살을 맞지 않는 것이 행복하게 사는 길이라 했다. 임상심리와 명상 두 분야의 전문가인 저자는, 두 번째 화살을 맞지 않는 방법으로 ‘근본적 수용(radical acceptance)’ 훈련을 제시한다.",1,국내도서-인문
69,9788925877235,7177808,나는 친구가 적다! 7,"6,120원",340원,히라사카 요미,학산문화사(단행본),"유감스럽기 짝이 없는 인기 만점 러브코미디 제7탄!! 리얼충들의 제전을 앞에 두고 이야기는 드디어 가경으로 돌입…할지도?! 하세가와 코바토의 생일 파티도 무사히(?) 끝나고, 다시 학원제를 대비한 활동을 개시하는 이웃사촌부 멤버들. 우여곡절 끝에 문화제 기획의 내용은 영화 제작으로 결정되고, 각본은 요조라가 담당하게 되었다. 하지만 코다카와의 옛 관계를 지나치게 강조하는 요조라와 다른 여자부원들 사이에 불온한 공기가 흐르기 시작하는데.",3,국내도서-만화/라이트노벨-라이트노벨
70,9788901130460,5696349,시골의사 박경철의 자기혁명,"14,400원",800원,박경철,리더스북,"대한민국의 지성, 실천하는 비판가, 열정적 독서광, 청춘의 멘토 시골의사 박경철이 이 시대 청춘에게 던지는 통렬한 자기혁명의 메시지! ‘알지만 실천하지 못하는 후회를 담은 시행착오의 기록’이라는 박경철의 말처럼 그의 치열했던 고뇌의 기록인 동시에, 청년들과 나눈 소통의 흔적이며, 함께 노력하겠다는 의지를 보여준다.",1,국내도서-자기계발
71,9788937848292,7149604,필리핀에서 보물찾기,"8,820원",490원,곰돌이 co./강경효,미래엔아이세움,온화한 날씨처럼 따뜻한 사람들의 나라 필리핀에서 마젤란이 남긴 신비로운 보물을 찾아라! 보물을 찾아 전 세계를 여행하면서 각 나라의 역사와 문화를 알아 가는 세계 탐험 만화 역사상식 시리즈. 보물찾기 짱이 모험을 떠나는 나라는 바로 필리핀입니다. 필리핀은 동남아시아 국가 중에서 우리나라와 가장 가까운 나라로 오랜 우방국이기도 합니다. 또 우리나라 사람들이 즐겨 찾는 관광지와 어학 연수지로도 유명하지요.,1,국내도서-어린이
72,9788996746416,6262207,나는 까칠하게 살기로 했다,"13,500원",750원,양창순,센추리원,"자존감을 지키며 건강한 인간관계를 유지하는 법 상처받지 않고 사람을 움직이는 관계의 심리학 자신의 자존감을 지키면서도 사람의 마음을 움직이는 심리적 방법을 다양한 임상 사례와 심리학 이론을 통해 쉽고 재미있게 풀어, 우리 일상에 바로바로 적용할 수 있도록 소개한 책이다.",3,국내도서-자기계발
73,9788990700933,3718285,해커스 토익 실전 1000제 Listening 1 문제집,"10,350원",110원,해커스어학연구소 저,해커스어학연구소,"토익 최신 출제 경향과 난이도를 반영한 실전 문제집 토익 문제를 완전히 분석한 결과를 토대로 실제 시험의 출제 경향과 난이도를 그대로 반영한 문제와 지문으로 구성한 교재. 실전보다 더 실전다운 문제를 풀어봄으로써, 학습자들은 실전에 대한 감각을 자연스럽고 확실하게 터득할 수 있다. 모든 지문 및 문제에 대해 정확한 스크립트를 수록하여, 학습자가 정확하게 지문을 이해할 수 있도록 하였으며, 리스닝 지문과 문제를 보다 정확하게 이해하는 데 도움이 되는 정확한 해석을 해커스영어 사이트(www.Hackers.",3,국내도서-국어 외국어 사전
74,9788971994863,7091654,변방을 찾아서,"8,100원",450원,신영복,돌베개,"새로운 창조 공간 ‘변방’을 찾아 떠나는 여행 독자의 탄생을 기다리며 신영복 선생이 직접 자신의 글씨가 있는 곳을 답사하고, 그 글씨가 쓰여진 유래와 글씨의 의미, 그리고 글씨와 관련된 여러 이야기를 풀어낸 글을 묶었다.",1,국내도서-에세이
75,9788917214390,7156824,ETS TOEIC Starter Listening 이티에스 토익 스타터 리스닝,"13,320원",740원,ETS,YBM(와이비엠),"TOEIC 출제기관 ETS에서 개발한 입문자용 맞춤 문항에서부터 정기시험과 동일한 유형과 난이도의 실전형 문항을 경험해 볼 수 있는 『ETS TOEIC Starter Listening 이티에스 토익 스타터 리스닝』출간! 이 책에 실린 문제의 원어민 음성은 정기시험과 동일한 성우의 음성으로, 발음과 속도 또한 정기시험과 동일하게 녹음되어 있어 정기시험의 리스닝을 보다 완벽하게 대비할 수 있다. 또한 느린 속도와 정상 속도를 함께 제공하여 보다 쉽고 완벽하게 학습할 수 있다. 이 책에는 각 chapter에 수록된 실전 문제를 포함하여 1회분의 파트별 모의고사, 최종 모의고사 1회분을 포함하여 총 8세트 분량의 실전 문제가 수록되어 있어 입문자들도 실전 감각을 키우기에 충분하다. 파트별 실전모의고사 1회분과 최종 모의고사 1회분을 풀고 난 후 맞은 개수에 따라 본인의 점수를 환산해 볼 수 있는 점수환산표가 제공된다.",4,국내도서-국어 외국어 사전
76,9788935652792,201210,마법의 설탕 두 조각,"8,100원",450원,미하엘 엔데/진드라 케펙,소년한길,"자기가 해달라는 것마다 안된다고 말하는 엄마 아빠에게 화가 난 렝켄은 요정을 찾아가 ""안돼!""라고 말할 때마다 키가 반으로 줄어드는 마법의 설탕 두 조각을 얻는다. 엄마 아빠의 키가 손톱 크기만큼 줄어들자 두려움을 느낀 렝켄은 요정에게 “엄마 아빠를 되돌려 달라”고 호소하고, 지혜로운 요정은 렝켄과 부모를 화해시킬 절묘한 마법을 선물한다. 부모와 자녀...",1,국내도서-어린이
77,9788954611275,3848527,어디선가 나를 찾는 전화벨이 울리고,"10,350원",570원,신경숙,문학동네,"""살아 있으라, 마지막 한 모금의 숨이 남아 있는 그 순간까지 이 세계 속에서 사랑하고 투쟁하고 분노하고 슬퍼하며 살아 있으라."" 『엄마를 부탁해』 그 이후, 신경숙의 신작 장편소설 청춘은 사랑의 기쁨과 상실의 아픔, 달랠 길 없는 불안과 고독의 순간들이다. 인생의 가장 아름답고 파랗게 빛나는 이 시기에, 우리는 가장 크게 웃고, 울고, 기뻐하고, 좌절하며, 사랑하고, 헤어지고, 그러면서 성장한다. 우리가 '청춘'이라고 부르는 순간은 태어나서 살고 죽는 사이에 가장 찬란한 순간.",1,국내도서-소설/시/희곡
78,9788917214406,7156821,ETS TOEIC Starter Reading 이티에스 토익 스타터 리딩,"13,320원",740원,ETS,YBM(와이비엠),TOEIC 출제기관 ETS에서 개발한 입문자용 맞춤 문항에서부터 정기시험과 동일한 유형과 난이도의 실전형 문항을 경험해 볼 수 있는 『ETS TOEIC Starter Reding 이티에스 토익 스타터 리딩』출간! 이 책에는 각 unit에 수록된 실전 문제와 최종 모의고사 1회분을 포함하여 총 4세트 분량의 실전 문제가 수록되어 있어 초급자들도 실전 감각을 키우기에 충분하다. 토익 시험에 나오는 문법을 삽화를 이용하여 쉽고 친절하게 설명했으며 또한 시험에 꼭 나오는 토익 필수 어휘와 관련 어구를 체계적으로 정리하였다.,4,국내도서-국어 외국어 사전
79,9788963708386,6669883,예감은 틀리지 않는다,"11,520원",640원,줄리언 반스/최세희,다산책방,"2011 영연방 최고의 문학상 맨부커상 수상작으로 영국 문학의 제왕 줄리언 반스의 새로운 소설이다. 책은 1960년대, 고등학교에서 만난 네 소년의 이야기로부터 시작된다. 1인칭 화자인 주인공 토니 웹스터와 그의 패거리 친구 앨릭스, 콜린, 그리고 총명하며 지적인 전학생 에이드리언 핀. 세 소년은 그를 선망하고, 학교의 모든 교사들은 낭중지추와도 같은 에이드리언의 탁월한 지적 능력과 독특한 시각을 눈여겨보고 그를 아끼는데.. 각종 매체는 이 책에 대해 기억과 윤리의 ‘심리 스릴러’라는 말을 썼다.",1,국내도서-소설/시/희곡
80,9788937847721,6793324,내일은 실험왕 20,"10,620원",590원,곰돌이 co./홍종현/이창덕,미래엔아이세움,"드디어 시작된 본선 대결 1차전. 그런데 가설 선생님의 부재로 새벽초에게 위기의 그림자가 드리워집니다. 광활한 바다에 좌초된 배처럼 나아갈 바를 모르던 새벽초는 원소가 무심코 뱉은 이야기를 아이디어 삼아 실험에 도전하지만, 지금껏 발표된 적이 없는 무모한 실험! 한편 새벽초와 태양초의 실험을 지켜보던 에릭은 가설 선생님의 빈자리를 보고 평정심을 잃고, 그때 에릭에게 전해진 수상한 우편물! 과연 그 안에는 어떤 내용이 적혀 있을까요?",1,국내도서-어린이
