순위,ISBN,상품번호,상품명,판매가,YES포인트,저자,출판사,설명,출고예상일,관리분류
1,9788965700609,6190758,"멈추면, 비로소 보이는 것들","12,600원",700원,혜민/이영철,쌤앤파커스,"사람들에게 치여 상처받고 눈물 날 때, 그토록 원했던 일이 이루어지지 않았을 때, 사랑하던 이가 떠나갈 때… 우리는 끊임없이 좌절의 순간을 맞으며 매일을 살아간다. 하지만 경쟁이 미덕이고, 일등만이 기억되는 이 사회에서 나의 ‘힘듦’을 내보이기란 쉬운 일이 아니다. 남들이 그러는 것처럼 세상 탓을 조금 하다가, ‘녹록치 않은 세상 살이, 나만 힘든게 아니지’ 라고 스스로를 다독이고 분주한 일상으로 돌아와 또 다시 ‘열심히’ 살고 있지는 않은지. 하지만 『멈추면, 비로소 보이는 것들』이 있다. 하버드 재학 중 출가하여 한국인 승려 최초로 미국 대학교수가 된 혜민 스님은, 이 바쁜 세상에서 잠시 멈추고 나를 사랑하는 시간을 가질 것을 권한다. 관계에 대해, 사랑에 대해, 마음과 인생에 대해, 머리로는 알지만 마음으론 잘 안 되는 문제들을 차근차근 해결해 나갈 수 있도록 돕는 그의 조언은 마음을 튼튼하게 하는 한 첩의 보약과도 같다.",3,국내도서-에세이
2,9788995501443,1403766,꾸뻬 씨의 행복 여행,"12,150원",670원,프랑수아 를로르,오래된미래,"마음의 병을 앓고 있는 사람들을 치료하던 정신과 의사가 행복의 참된 의미를 찾아 여행을 떠난다는 소설이다. 이 소설의 주인공처럼 저자는 정신과 의사이다. 늘 불안한 심리 상태로 살아가는 사람들을 지켜보면서 어떤 심리학적 설명보다 한 편의 이야기가 더 사람의 마음을 움직일 수 있다고 생각했고, 자신의 환자들을 진료하며 얻은 경험과 생각들을 바탕으로 소설을 썼다. 현재 12개국의 언어로 번역되어 현대인의 복잡한 심리의 핵심을 짚어내면서 누구나 공감할 수 있는 이야기로 사람들의 마음을 움직이고 있다....",1,국내도서-소설/시/희곡
3,9788965701200,8130753,김미경의 드림 온 Dream on,"6,750원",370원,김미경,쌤앤파커스,"“꿈은 어쩌다가 우리에게 ‘밀린 숙제’가 되었을까?” 1만 명의 드림워커를 위한 꿈 지원 프로젝트, [드림온]이 당신의 꿈을 응원한다! MBC ‘희망특강 파랑새’와 tvN ‘스타특강쇼’ 등에서 국민 강사의 저력을 유감없이 보여준 김미경 원장은 지난 3년간 ‘꿈’에 대해 집중적으로 연구했다. 수백 명의 사람들을 만나 인터뷰하고, 유명 CEO들과 각계각층의 ‘생각을 파는 사람들’, 패션, 광고, PR, 디자인, IT, 엔터테인먼트 등 다양한 분야에서 일가를 이룬 젊은 대가들을 만나 분석했다. 거기서 발견한 공통점이 있다. 그들은 결핍+실행력+역량+가치관이라는 4가지 재료를 활용해 꿈을 만들었다는 것이다. 그리고 무명시절, 테크닉을 연마하는 15년의 법칙, 돈이라는 스승, 부모 울리기, 꿈의 지분 등 7가지 법칙으로 꿈을 키워나갔다는 것이다. 김미경 원장은 그들을 ‘드림워커’라 부른다.",1,국내도서-자기계발
4,9788901150598,7950702,습관의 힘,"14,400원",800원,찰스 두히그/강주헌,갤리온,"하버드 MBA 출신 뉴욕타임스 심층보도 전문 기자가 자신의 나쁜 습관을 고치기 위해 발로 뛰어 밝혀 낸 스마트한 습관 사용법. 습관은 변화하면 좋고 안 해도 상관없는 것이 아니라 성공과 실패, 삶과 죽음의 열쇠를 쥐고 있는 요소라는 것, 그리고 습관을 원하는 대로 바꾸는 게 생각보다 훨씬 쉽다는 것을 알려준다.",1,국내도서-자기계발
5,9788972756194,8157957,나미야 잡화점의 기적,"13,320원",740원,히가시노 게이고/양윤옥,현대문학,"지난 10년간 한국에서 가장 많이 팔린 소설이자 히가시노 게이고의 대표작. 30여 년째 비어 있는 폐가, ‘나미야 잡화점’에 숨어든 삼인조 좀도둑이 뜻밖에도 과거로부터 도착한 고민 상담 편지에 답장을 하면서 겪게 되는 기묘한 하룻밤의 이야기를 그린다. 작가는 시공간을 넘나드는 편지라는 설정을 단순한 판타지가 아닌 추리적인 향기와 깊이가 담긴 소재로 승화시킨다.",1,국내도서-소설/시/희곡
6,9788965701255,8262373,"나는 다만, 조금 느릴 뿐이다","12,600원",700원,강세형,쌤앤파커스,"30만 독자를 사로잡은 『나는 아직, 어른이 되려면 멀었다』 강세형 작가의 두 번째 내면 탐색! ‘김동률의 뮤직아일랜드’, ‘테이의 뮤직아일랜드’, ‘이적의 텐텐클럽’, ‘스윗소로우의 텐텐클럽’ 등 마니아 청취자를 보유한 라디오 프로그램의 메인작가로 활동했던 강세형 작가의 두 번째 책이 출간되었다. 탁월한 공감 능력을 지닌 그녀의 글은 라디오 작가 활동 당시에도 많은 사랑을 받았고, 그녀의 글을 책으로 소장하고 싶다는 청취자들의 염원을 바탕으로 출간한 첫 번째 책 『나는 아직, 어른이 되려면 멀었다』는 무명작가의 에세이로는 놀라운 반응인 30만 부가 판매되며, 에세이 분야 스테디셀러 도서로 자리매김했다. “내 이야기인 줄 알았어요.”라는 독자들의 서평으로 가득할 만큼 ‘공감의 작가’로 불리는 강세형 작가.",3,국내도서-에세이
7,9788950940768,7860663,언니의 독설,"14,400원",800원,김미경,21세기북스,"""강한 언니 김미경이 독한 애정으로 서른을 코칭한다 “이곳저곳 기웃거리다 ‘직업 객사’ 하고 싶니? 멈추거나 포기하지 말고 더 버텨!” “남자는 주식, 헐값에 사서 금값으로 키워라!” 지난 20여 년간 200만 명의 청중을 만나면서 국민 강사로 자리 잡은 김미경 원장은 29세 때 여성 리더십 강의를 시작해 20여 년 가까이 여성을 리더로 키워온 대표적인 여성 멘토다. 김미경 원장은 이 책을 통해 그동안 현장에서 만난 수많은 워킹우먼들의 고민에 명쾌한 해답을 제시한다. 여성의 30대는 커리어의 갈림길에 서는 중대한 시기다. 직장생활 7~8년 차에 들어선 미혼 여성들은 매너리즘과 막연한 불안감으로 제2의 방황을 시작한다. 30대 중반 정도 되면 안정적인 커리어, 집, 남자 등이 모두 갖춰져야 한다는 압박감을 느끼지만 현실과의 좁혀지지 않는 간극 때문에 힘겨워진다. 결국 이들의 상당수가 도피성 어학연수나 계획에도 없던 대학원을 선택한다.",3,국내도서-자기계발
8,9788995932582,3087151,적을 만들지 않는 대화법,"10,800원",600원,샘 혼/이상원,갈매나무,샘 혼은 “16년 전에 쓴 책 《적을 만들지 않는 대화법Tongue Fu!》이 한국에서 베스트셀러에 올랐다기에 놀랐다”면서 “한국처럼 빠르게 발전하는 사회일수록 ‘텅후Tongue Fu’로 방어해야 할 일이 많기 때문이 아니겠나”라고 말했다. “사회가 빠르게 발전할수록 대인 관계 스트레스는 커지게 마련입니다. 한국은 특히 인터넷이 매우 발달했고 거의 모든 사람이 스마트폰을 쓰잖아요. 그것은 곧 더 많은 사람과 더 많은 커뮤니케이션을 하는 사회라는 뜻이죠. 자연히 사람과 소통하며 스트레스 또한 늘어날 수밖에 없어요. 옛날 같으면 그냥 고개를 돌려버리면 그만이었을 문제가 이제는 컴퓨터를 켜거나 스마트폰만 열어도 재발하고 있는 것이죠.” -조선일보 Weekly BIZ 샘 혼 인터뷰 중에서 커뮤니케이션 분야의 스테디셀러 《적을 만들지 않는 대화법》이 2015년 좀 더 새로운 모습으로 독자를 찾아왔다.,4,국내도서-자기계발
9,9788901153834,8287719,"문명의 배꼽, 그리스","18,000원","1,000원",박경철,리더스북,인간이 쌓아 올린 문명의 모든 것! 우리가 인식하건 못하건 공간은 중요하다. 구체적인 삶의 자취가 어느 것 하나 빠지지 않고 고스란히 묻어 있기 때문이다. 하지만 그 중요성에 비해 공간은 지금까지 덜 주목받았던 게 사실이다. 하여 지금 우리가 서 있는 공간을 제대로 이해하기란 만만한 일이 아니다. 하물며 수천 년의 역사를 거슬러 문명의 격랑이 파도쳤던 그리스의 경우라면 더더욱 쉽지 않은 일이 아니겠는가. 사정이 이러한데도 연대기의 틀을 고수한다면 왕조나 지배 계급을 중심으로 한 주류의 이야기에 머물기 십상이다. 뿐만 아니라 역사에 명멸했던 그 모든 문명이 그들 주류의 몫이라 잘못 전해질 수도 있다. 하지만 문명이란 지배 계급만이 아니라 허리 휘도록 무거운 돌덩이를 등짐지어 나르며 그 위대한 문명의 탑을 쌓아 올린 이름 모를 민초를 빼놓고서는 온전히 이해할 수 없을 터. 문명의 정통성이 바로 민초들에게 있기 때문이다. 저자는 그 공간 여행의 출발지를 펠로폰네소스로 정했다.,1,국내도서-인문
10,9788984371026,3906597,빅 픽처,"10,800원",600원,더글라스 케네디/조동섭,밝은세상,"진정 '나'를 위한 삶을 살고 싶었던 한 남자 이야기 영미작가이지만 프랑스를 비롯한 유럽에서 폭발적인 인기를 누리며 프랑스문화원으로부터 기사 작위까지 받은 작가 더글라스 케네디의 대표작. 눈을 뗄 수 없는 탄탄한 스토리, 긴장감 넘치는 전개가 돋보이는 이 작품은 진정 '나'를 위한 삶을 살고 싶었던 한 남자 이야기다. 벤과 갈수록 사이가 멀어지던 베스는 이웃집에 사는 사진가 게리와 혼외정사에 탐닉하고, 벤은 우연히 베스가 이웃집 남자 게리의 집에서 불륜행각을 벌이고 나오는 장면을 목격한다.",1,국내도서-소설/시/희곡
11,9788954618984,7420669,천 번을 흔들려야 어른이 된다,"12,600원",700원,김난도,오우아,"200만 부 돌파를 앞둔 멘토링 에세이의 신화 『아프니까 청춘이다』 그후, 대한민국이 열광한 경청과 공감의 멘토 ‘란도샘’이 돌아왔다! 『아프니까 청춘이다』 그후, ‘이제 흔들리며 세상에 첫발을 내딛은 청춘’에게 주는 김난도의 인생 멘토링. 청춘의 불안을 지나 세상 속에서 뜨거운 볕을 맨몸으로 견디며 흔들리고 있는 어른아이들을 위한 ‘란도샘’의 가슴 벅찬 인생 멘토링이 시작된다. '아픈 청춘'을 지나 사회에 발을 내딛은 이들, 생물학적 나이로 25세에서 35세 사이의 '어른아이'들이 겪는 아픔은 학창 시절에 비할 바가 아니다. 이제는 아픈데도 아프다는 말조차 하지 못하며 일과 사랑, 가족, 인간관계, 자아실현 사이에서 힘겨운 저글링을 해야 하는 만만찮은 ‘어른의 삶’이 기다리는 것이다.",1,국내도서-에세이
12,9788901153728,8287120,"안녕, 친구야","11,700원",650원,강풀,웅진주니어,"세상 모든 은총이에게 들려주는 강풀 아빠의 첫 그림책 함박눈이 내리는 밤, 혼자 잠이 깬 아이는 집을 잃은 아기 고양이를 만났어요. 고양이 집을 찾아 떠나는 둘만의 비밀스런 모험은 이렇게 시작됩니다. 둘은 길에서 커다란 개, 작은 생쥐, 검은 고양이를 만나 이야기를 나눕니다. 세상으로부터 닫혀 있던 이들이 마음의 문을 열고 세상을 향해 손짓하는 따뜻한 이야기입니다.",1,국내도서-유아
13,9788901152219,7997481,DEATH 죽음이란 무엇인가,"15,120원",840원,셸리 케이건/박세연,엘도라도,나는 ‘반드시’ 죽을 것이다 그렇다면 나는 ‘어떻게’ 살아야 하는가? 17년 연속 예일대 최고의 명강의 ‘DEATH’가 책으로 나왔다. 하버드대 ‘정의(JUSTICE)’및 ‘행복(HAPPINESS)’과 함께 ‘아이비리그(Ivy League) 3대 명강’으로 불리는 강의다. 그동안 우리가 생각해왔던 심리적 믿음과 종교적 해석을 완전히 배제하고 오직 논리와 이성으로 죽음의 본질과 삶의 의미를 고찰한다. 하버드대 마이클 샌델(Michael Sandel)과 더불어 미국을 대표하는 현대 철학자로 불리는 셸리 케이건(Shelly Kagan) 교수는 이 책에서 다소 무겁고 어둡게 흘러갈 수 있는 주제를 토크쇼 사회자에 비견되는 특유의 유머감각과 입담으로 흥미롭게 풀어간다. 고대에서 현대까지 방대한 철학사를 다루면서도 난해한 철학용어를 거의 사용하지 않는 그만의 교수법은 “대중철학 강의의 새로운 지평을 열었다”고 평가받고 있다.,1,국내도서-인문
14,9788956056203,8182274,내가 보고 싶었던 세계,"12,600원",700원,석지영/송연수,북하우스,"하버드법대 최초 아시아여성 종신교수 석지영의 첫 에세이, 『내가 보고 싶었던 세계』! 발레, 피아노를 전공한 청소년기를 거쳐 예일대에서 프랑스문학을 전공하고, 옥스퍼드에서 문학박사 학위를 땄다. 이후 진로를 확 바꾸어 하버드법대에 진학하여 법률서기직, 검사직을 통해 진짜 현실의 법 세계를 경험하고, 2006년 한국계 최초로 하버드대 법대 교수에 임용되었다. 이후 4년 만인 2010년, 교수단 심사를 만장일치로 통과, 아시아여성 최초로 하버드법대 종신교수로 선출되었다. 『내가 보고 싶었던 세계』의 저자 석지영, 그녀를 소개하는 수식어는 이토록 길다. 석지영 교수가 한국 독자들을 위해 처음으로 쓴 에세이집인 이 책에는, 인문학ㆍ예술ㆍ 법 등 석지영을 만든 지식과 교양의 커리큘럼이 가득 담겨있다.",1,국내도서-에세이
15,9788994343921,8298696,내 인생에 용기가 되어준 한마디,"11,700원",650원,정호승,비채,"“인생의 사막에서 그래도 살아갈 힘을 얻는 것은 ‘한마디’라는 우물이 있기 때문입니다.” 시인 정호승, 7년 만에 내놓은 신작 산문집으로 용기를 전하다! 30만 독자의 사랑을 받은 베스트셀러 『내 인생에 힘이 되어준 한마디』이후 7년간의 기다림과 산고 끝에 정호승 시인이 신작 산문집 『내 인생에 용기가 되어준 한마디』로 우리 곁에 돌아왔다. 저자가 사무치도록 마음에 담아둔 한마디를 매 꼭지마다 던지고 그에 얽힌 이야기를 서술하는 형식으로, 신문이나 잡지에 실리지 않았던 작품만을 모은 신작 산문집이다. 시인 정호승은 ‘펴내는 글’에서 자신만의 한마디를 인생의 고비에 선 많은 사람들과 나누고 싶어 이 책을 쓰게 되었다고 고백한다. 고통의 가치와 일상의 행복에 대해, 그 깨달음의 순간들에 대해 이야기하는 시인의 어조는 전작과 크게 다르지 않지만, 좀 더 섬세하고 깊어졌다.",1,국내도서-에세이
16,9788972882435,1428195,파이 이야기,"12,600원",700원,얀 마텔/공경희,작가정신,"2013년 1월 3일 세계적인 감독 이안의 3D영화 국내 전격 개봉! 스크린에서 요동치는 황홀한 상상력을 만나다 행복한 유년시절을 보내온 인도 소년 파이. 그러나 지금 그는 태평양 한가운데 홀로 떠 있다. 앞에는 커다란 호랑이, 밑에는 상어가 다니고, 폭풍우가 쏟아진다. 파이는 호랑이에게 잡아 먹히지 않기 위해, 호랑이가 죽고 혼자 남지 않기 위해 필사적으로 물과 먹이를 준비한다. 낯선 곳에서 펼쳐질 새로운 삶에 대한 기대로 한껏 부풀었다가 사랑하는 가족을 한순간에 몽땅 잃어버리고, 겨우 살아남았나 했더니 언제 자기를 잡아먹을지 모를 벵골 호랑이와 공존 아닌 공존을 해야 하는 상황에 놓인 인도 소년 파이. 절망의 순간에 이르러 희망을 찾은 이 소년의 이야기는 세대를 뛰어넘어 모든 이들에게 많은 의미를 던져준다. 『파이 이야기』는 흥미진진함과 재미를 듬뿍 담은 동시에, 궁극적인 신념과 희망을 이야기하며 많은 것을 생각하게 하는 소설이다.",1,국내도서-소설/시/희곡
17,9788950946210,8283157,"불혹, 세상에 혹하지 아니하리라","13,500원",750원,신정근,21세기북스,"40대를 지나면서 혹하지 말아야 할 ‘나이 듦’, ‘욕심’, ‘편견’ 등의 주제와, 마음껏 혹해야 할 ‘초발심’, ‘용기 있는 삶’, ‘나누며 사는 삶’ 등 우리가 살면서 한번쯤 생각해봤을 법한 주제에 질문을 던진다. 그리고 이에 대한 답을 『논어』『장자』『중용』『시경』부터 『한비자』『세설신어』『성학집요』까지 40여 권이 넘는 동양고전에서 찾았다. 1부 ‘불혹, 혹하지 아니하리라’에서는 나이 듦, 술, 탐욕, 쾌락, 무리, 편견, 권위와 같이 40대가 경계해야 할 7가지 키워드를 제시하고, 2부 ‘유혹, 혹해도 좋지 아니한가’에서는 초발심, 용기, 진정성, 공감, 의미 있는 삶, 아름다움, 나누며 사는 삶과 같이 40대라면 혹해야 할 7가지 주제에 대해 풀어나간다. 예를 들어 ‘노화’ 즉 ‘나이 듦’에 대해 고민해보지 않은 사람이 없을 것이다.",1,국내도서-자기계발
18,9788901154091,8389451,나는 죽을 때까지 재미있게 살고 싶다,"12,600원",700원,이근후/김선경,갤리온,"죽음의 위기를 몇 차례 넘기고 일곱 가지 병과 더불어 살아가면서도 늘 유쾌한 노(老)학자와 베스트셀러 『서른 살엔 미처 몰랐던 것들』의 저자 김선경이 만나 함께 쓴 나이 듦의 지혜 50년간 정신과 전문의로 환자를 돌보고 학생들을 가르쳐 온 이근후 이화여대 명예교수가 ‘어떻게 살 것인가’를 고민하는 후배들에게 전하는 나이 듦의 지혜. 왼쪽 눈의 시력을 완전히 잃고 일곱 가지 병과 함께 살아가면서도 76세의 나이에 최고령이자 수석으로 사이버 대학을 졸업하고, 삼 대 열세 가족과 한집에서 대가족을 이루어 사는 등 누구보다 즐겁고 재미있는 노년을 보내고 있는 노학자가 80년 인생을 살아오며 배운 인생의 통찰을 전달한다. 이 책을 엮은이는 20만 명 독자의 마음을 사로잡은 『서른 살엔 미처 몰랐던 것들』의 저자 김선경으로, 본격적으로 40대에 접어들어 “나는 어떻게 나이 들어 갈 것인가”를 고민한 끝에 이근후 명예교수와 함께 이 책을 펴냈다.",1,국내도서-에세이
19,9788965132288,8491738,어떻게 살 것인가,"13,500원",750원,유시민,생각의길,"대중적 글쓰기로 많은 독자들의 사랑을 받았던 유시민이 스스로 가장 자기답다고 생각하는 모습으로 돌아왔다. 정치인 유시민에 가려져 있었던 자연인 유시민, 지식인 유시민의 사람과 자연, 사회와 역사에 대한 생각을 온전하게 보여준다. 이 책을 쓰는 작업은 그에게 자신의 미래를 새롭게 고민하고 설계하는 과정이었으며, 그는 책의 결론에 부합하는 결정을 내렸다. 자기다운 삶, 자신이 원하는 인생을 살기로 한 것이다.",1,국내도서-인문
20,9788996991304,8276479,나는 내일을 기다리지 않는다,"12,600원",700원,강수진,인플루엔셜,"20대 여성이 가장 존경하는 여성 1위! CEO가 뽑은, 13시간 미국행 비행기 옆자리에 앉고 싶은 여성 1위! 아주 작은 운도 없었다 열정까지 통제하는 강수진의 열정수업 ! 강수진의 삶을 살펴보면, 동양인 최초 스위스 로잔 발레 콩코르 우승, 동양인 최고 독일 슈투트가르트 발레단 입단 등 삶 안에 최초가 가득하다. 하지만 온갖 최초를 거머쥔 그녀가 최고로 많이들은 말은 '넌 안 돼', '네가 할 수 있을까?'라는 부정적인 말들이었다. 그녀는 매일 혼자 빈 무대에서 연습을 했고, 그게 쌓여 20만 시간이 되었다. 사람들은 20만 시간 동안 그녀에게 부정적인 이야기를 했지만, 그녀는 20만 시간 동안 연습했다. 이제 부정적인 말을 했던 사람들은 무대 위에서 아름답게 날아오르는 그녀의 공연을 지켜보며 박수를 치고 있다. 그녀는 지금 이 순간 아름다운 모습을 보여주기 위해 지난 20만 시간을 준비한 것이다.",3,국내도서-자기계발
21,9788965420217,5273111,해커스 토익 보카 Vocabulary,"12,250원",130원,데이비드 조,해커스어학연구소,"주제별 연상학습 기능을 수행하는 구성으로 30일만에 토익 기출 단어를 섭렵할 수 있도록 하고 있다. 파트별 선별 학습으로 자신의 취약파트를 전략적으로 강화할 수 있도록 하였고, 반복 학습을 위한 엄선된 퀴즈와 실전문제를 통해, 효율적으로 학습할 수 있도록 하였다. 해커스토익 사이트(www.hackers.co.kr)와 챔프스터디 사이트(www.champstudy.com)를 통해 피드백과 온라인 자료를 받을 수 있도록 하였고, 다양한 MP3 버전을 통해, 입체적인 공부를 할 수 있도록 하였다....",3,국내도서-국어 외국어 사전
22,9788954428453,8313689,특별한 배달,"10,350원",570원,김선영,자음과모음,"“Why I am Here?” 나는 왜 여기에 있지? 지금 이 자리는 나의 욕망과 선택에 의해 다다른 것. 그 누구보다 나의 책임이 가장 크다. 『특별한 배달』은 제1회 자음과모음 청소년문학상을 수상한 김선영 작가의 『시간을 파는 상점』의 후속작이다. 지난 12월 말부터 EBS 라디오 연재소설에서 탤런트 이민우 씨의 낭독으로 연재되며 재미있다는 호평을 얻었고, 출간일을 기다리는 많은 독자들의 기대 속에 태어나는 작품이다. “선택하지 않은 것도 선택이다”라는 말이 있다. 청소년들은 지금 자신의 처한 현실이 자신의 의지가 아닌, 오롯이 어른들에 의해 주어졌다고 생각하며, 절망하기도 한다. 그것은 진실이기도 하지만 한편으로는 책임 전가를 할 수 있는 좋은 구실이 되기도 한다. 지금의 내가 처한 현실은 나와 타인, 사회가 복합적으로 만들었다고 볼 때 그중 나의 책임은 전혀 없는 것일까.",2,국내도서-청소년
23,9788950945220,8241595,마법천자문 24,"8,820원",490원,올댓스토리/홍거북,아울북,"광명계에서의 모험, 그 1막! 태극철권 쟁탈전이 시작된다! 우연히 보리도사를 만나 수제자가 되기로 한 후 대마왕에게 '마법천자문'이 넘어가지 않도록 승부를 벌이는 손오공의 옥황계를 넘어 광명계까지 신나는 모험을 통해 재미있게 한자를 배워나가도록 구성한 한자학습만화입니다다. 특히 '이미지'를 통해 한자의 소리와 뜻과 모양을 한꺼번에 익히는 이미지 학습의 원리를 구현했습니다. 한자를 스스로 공부할 수 있는 바탕을 마련해줄 것입니다.",3,국내도서-어린이
24,9788954620437,8297953,롤리타,"11,700원",650원,블라디미르 나보코프/김진준,문학동네,"언어의 마술사, 나보코프의 최고 걸작을 새로운 번역으로 만난다 세계문학의 최고 걸작이자 언어의 마술사로 불리는 나보코프가 자신의 작품 중 가장 좋아한 『롤리타』는 열두 살 소녀를 향한 중년 남자의 사랑과 욕망을 담고 있다. 열세 살 때 자신이 처음 사랑한 여자친구가 병에 걸려 세상을 떠나자 이십 년 넘게 그 연인을 가슴에 품고 살아가는 험버트 험버트(H.H). 이루어지지 못한 첫사랑의 후유증으로 그는 사춘기 이전이나 사춘기에 접어든 9세에서 14세에 이르는, 그가 님펫이라고 부르는 여자아이들의 매력에 이끌리고, 그들에게 사랑의 욕망을 느끼게 된다. 그러던 어느 여름날, 서른일곱 살의 험버트가 치명적인 매력과 마력을 가진 열두 살 소녀 롤리타를 만나 그녀에게 완전히 매혹당하면서 그들 앞에 잔혹한 운명이 예고된다. ‘롤리타’란 이름의 호명에서 시작된 소설 『롤리타』는 ‘나의 롤리타’를 다시 호명하는 것으로 끝이 난다.",1,국내도서-소설/시/희곡
25,9788976820532,830,삐뽀삐뽀 119 소아과,"26,820원","1,490원",하정훈,그린비라이프,"육아상식에 관한 모든것을 담았다. 이 책은 아이가 아플때 가정에서 할 수 있는 응급처지법, 육아 상식을 총망라했다. 아기의 질환을 엄마 눈으로 확인 할 수 있는 원색 슬라이드를 실어 세세한 부분까지 체크해 볼 수 있다.",3,국내도서-가정 살림
