순위,ISBN,상품번호,상품명,판매가,YES포인트,저자,출판사,설명,출고예상일,관리분류
26,9788956592015,8371805,글로벌 트렌드 2030,"13,500원",750원,미국 국가정보위원회/이미숙/박지니/이현정,예문,"CIA, FBI, NSA 등 16개 美 최고 정보기관이 참여하고 미국 국가정보위원회가 4년에 걸쳐 준비한 미래전망 보고서 미국 16개 정보기관의 수장 격이자 사실상의 국내 및 대외정책 컨트롤타워인 국가정보위원회(NIC)가 향후 20년의 세계 정치, 경제, 외교, 안보, 자원 등의 거시적 동향과 전망을 미루어본 책이다. 인구 문제, 정보 통신, 과학기술, 국제 분쟁, 테러리즘, 자연재해 등의 문제도 망라했고, 한중일 그리고 북한을 중심으로 한 동아시아 정세, 유럽연합의 미래, 이슬람권과 관련한 문제 등 여러 민감한 쟁점들도 빠뜨리지 않았다.",3,국내도서-경제 경영
27,9788952787590,176008,샬롯의 거미줄,"9,900원",550원,엘윈 브룩스 화이트 /김화곤/가스 윌리엄즈,시공주니어,너무 작게 태어났다는 이유 하나로 죽임을 당할 뻔한 꼬마 돼지 윌버가 너무 불공평하다며 항의하는 여자아이에 의해 목숨을 건지고 샬롯이라는 이름의 거미의 도움으로 '대단한 돼지' '근사한 돼지' '눈부신 돼지' 그리고 마침내 '겸허한 돼지' 가 되는 이 이야기는 무엇보다도 샬롯과 윌버가 서로의 삶을 '승격' 시켜주는 굉장한 우정의 이야기이다.,1,국내도서-어린이
28,9788960652859,8097839,그래도 사랑하라,"12,600원",700원,전대식 편,공감,"아름다운 죽음, 아름다운 마무리가 남긴 영원한 가르침 『그래도 사랑하라』 선종하기 전 김수환 추기경은 죽음을 준비하는 한 인간의 가장 아름다운 마무리가 무엇인지를 보여주었다. 추기경의 마지막 모습은 죽음을 통해 삶을 가르치는 메시지가 담겨 있다. 어떻게 죽을 것인가는 곧 어떻게 살 것인가와 다르지 않다는 것을 알게 한다. 『그래도 사랑하라』는 아직 김수환 추기경을 잊지 못하는 이들을 위해 엮어낸 사진에세이집이다. 평화방송, 평화신문 사진 기자로 20여 년 재직하며 올 3월, '김수환 추기경 선종 3주기 추모사진전시회'를 열었던 저자는, 전시회장을 찾는 수많은 이들의 뜨거운 마음을 담아 이번 사진에세이집을 펴냈다. 에세이집에 생생하게 살아있는 추기경의 메세지는 단순하다. 수많은 좌절과 고뇌, 상처가 따르는 험난한 세상 속에서, 외로운 존재로 남지 말고 '서로 사랑하라'는 것이다.",3,국내도서-에세이
29,9788965700036,4447549,아프니까 청춘이다,"12,600원",700원,김난도,쌤앤파커스,"아프고 어렵기 때문에 좋은 것, 청.춘. 수많은 청춘의 마음을 울린 김난도 교수의 인생 강의실 서울대학교 학생들이 뽑은 최고의 명강의의 주인공 김난도 교수가 들려주는 영혼을 울리는 따뜻한 위로의 이야기, 머리를 내리치는 따끔한 죽비 같은 이야기를 들려준다. 부단히 스펙을 쌓고 취업관문을 두드리고 사회초년생으로서 적응해가고 있지만, 미래는 여전히 한 치 앞을 내다볼 수 없는 한국의 청춘들에게 전하는 위로와 격려의 메시지다.",3,국내도서-에세이
30,9788990700582,3103556,해커스 토익 Reading 리딩,"17,860원",190원,데이비드 조,해커스어학연구소,"문법 · 독해 · 어휘에서 실전까지 대비한 토익 기본서 최신 경향을 반영하여 문법, 독해, 어휘를 종합 구성한 토익 리딩의 기본서. 또한 많은 최신의 실전문제를포함하고 있는 실전서이기도 하다. Grammar 섹션의 일목요연한 포인트 문법설명과 Vocabulary/Reading 섹션의 출제유형 및 핵심 전략으로 토익의 경향을 정리한 후, 실전보다 더 실전다운 토익 문제를 풀어봄으로써, 가장 효율적이고도 확실한 방법으로 토익실전을 대비할 수 있도록 하였다.",3,국내도서-국어 외국어 사전
31,9788954428361,7967643,여울물 소리,"13,500원",750원,황석영,자음과모음,"“이야기는 무엇인가, 무엇 때문에 생겨나나, 무엇을 위해서 존재하나, 어떤 것이 남고 어떤 것이 사라지나?” 1962년 『사상계』에 「입석부근」을 발표하며 작품 활동을 시작한 황석영이 올해로 등단 50주년을 맞았다. 대한민국의 근현대사와 함께 해온 그의 문학 인생 50년을 되돌아보면 단 한 순간도 평범했던 적은 없었다. 격동의 역사 속에서 단 한 번도 직면한 현실을 피하지 않고 맞서며 주옥같은 작품을 탄생시켰던 그가 등단 50주년을 맞아 신작 장편소설 『여울물 소리』를 발표한다. 황석영이 우리 식의 '이야기'에 대해 본격적으로 고심해온 것은 그의 후반기 문학이라고 할 수 있는 출옥 이후부터이다. 이전 산문의 습관들을 해체한 『오래된 정원』을 시작으로 그 뒤 연이어 발표한 『손님』, 『심청』, 『바리데기』 등에은 우리 ‘이야기’를 어떻게 하면 형식과 내용 모두 지금의 현실 속에서 자연스럽게 녹여낼 수 있을 것인가에 대한 작가의 고심이 녹아있다.",3,국내도서-소설/시/희곡
32,9788970128849,8308838,침묵의 미래,"12,420원",690원,김애란/김이설/손홍규/염승숙/이장욱/이평재/천운영/편혜영/함정임,문학사상,"한국문학을 사랑하는 모든 독자들이 매년 손꼽아 기다리는 『이상문학상 작품집』, 2013년 이상문학상 대상작은 심사위원 5인의 심사숙고 끝에 김애란의 「침묵의 미래」로 선정되었다. 이 작품은 언어 자체가 스스로 그 존재와 가치를 되묻고 운명에 대해 질문하게 함으로써, 언어의 사멸이라는 현상이 현대문명을 살아가고 있는 인간에게 본질적인 문제가 되고 있음을 우화의 형식으로 말해주고 있는 작품이다. 이번 작품집에는 대상 수상작인 김애란의 「침묵의 미래」와 자선 대표작 「누가 해변에서 함부로 불꽃놀이를 하는가」 외에도 우수상 수상작으로 함정임의 「기억의 고고학」, 이평재의 「당신이 모르는 이야기」, 천운영의 「엄마도 아시다시피」, 편혜영의 「밤의 마침」, 손홍규의 「배우가 된 노인」, 이장욱의 「절반 이상의 하루오」, 염승숙의 「습濕」, 김이설의 「흉몽」 등 기발한 상상력과 실험성이 돋보이는 작품들이 고루 포진해 읽는 재미와 맛을 더해주고 있다.",2,국내도서-소설/시/희곡
33,9788915102019,1972516,임신 출산 육아 대백과,"16,650원",920원,편집부 저,삼성출판사,"『임신 출산 육아 대백과』 2020년 개정판은 가이드 구성에 충실, 초보엄마들이 궁금해할만한 내용을 사진으로 꼼꼼하게 보여준다. 임신 중 요가, 산후조리, 육아의 기초(신생아 목욕시키기, 옷 입히기 등)의 과정을 사진으로 보여주어 슬라이드를 넘기듯 한눈에 육아의 기초를 알 수 있다. 임신, 출산, 육아의 각 단계를 시간 순서별로 나누어 Step 1부터 Step11로 구분해 필요한 부분을 쉽게 찾아볼 수 있다. 초보엄마들이 실수하기 쉬운 부분, 꼭 알아야 할 부분을 세심한 정보 박스로 정리해 놓치지 않고 볼 수 있게 했다. 귀여운 일러스트 표지를 채택하고 책에 비닐커버를 씌워 활용도를 높였다.",1,국내도서-가정 살림
34,9788956013046,7359650,지랄발랄 하은맘의 불량육아,"11,250원",620원,김선미,무한,"대한민국 100만 어뭉들의 뒷목을 후려쳤던 HOT한 블로그 [지랄발랄 하은맘의 개똥육아] 를 책으로 엮었다. 아무것도 안 가르쳐 준채 낳게만 해놓고 방패도 없이 맨몸으로 총알받이 하느라 엄마들 가슴 속 심장이 너덜거린다. 낳자마자 사기당한 느낌, 사교육 시장에 삥 뜯기는 느낌. 그런데 안 그러면 내 새끼만 낙오될 것 같아서 울면서 지갑을 연다. ‘행복한 육아? 웃기고 있다. 행복할 겨를이 있어야 행복할 거 아냐!’라고 외치는 하은맘이 일냈다. 보면 한숨 나오고 욕 나오고 찢어버리고 싶은 육아서 말고, 위로만 하다 끝나는 육아서 말고 가장 현실적인 육아서가 나왔다. ‘언니한테 독설 한방 맞자!’ 정도를 향한 지랄 맞지만 발랄한 외침이 시작된다.",3,국내도서-가정 살림
35,9788954613026,4346834,리딩으로 리드하라,"13,500원",750원,이지성,문학동네,"개인, 가족, 기업, 국가의 운명을 변화시키는 인문고전 독서의 가공할 위력! 아인슈타인, 뉴턴, 처칠, 에디슨이 사고뭉치에서 위대한 천재로 탈바꿈한 비결, 둔재들만 가던 소문난 삼류학교 ‘시카고 대학’이 노벨상 왕국이 된 사연, 카네기, 워런 버핏, 이병철, 정주영이 황금 손이 될 수 있었던 밑바탕, 알렉산더, 세종과 정조, 당 태종과 도쿠가와 이에야스 등 희대의 국가 경영자들의 공통점, 그 비밀은 모두 인문고전 독서에 있었다.",3,국내도서-자기계발
36,9788917218336,8397748,ETS TOEIC Test RC 공식실전서 1000,"14,850원",820원,ETS,YBM(와이비엠),"출제기관의 공식실전서로 TOEIC R/C 마무리 TOEIC R/C 10회 분량의 모의고사가 담긴 실전서. TOEIC 주관 단체인 ETS가 개발한 문제들로만 구성되어 실제 시험과 동일한 유형과 난이도를 체험할 수 있다. 해설 역시 ETS가 직접 검수하여 체계적인 유형 분석과 간략하고 쉬운 풀이를 제공해 이해를 돕는다. 또, 어휘 및 paraphrasing 표현도 함께 정리했다. ETS 공인 점수환산표가 포함되어 모의고사를 풀고 난 후, 맞은 개수에 따라 예상 점수를 확인할 수 있다. 학습 계획에 따라 10회 분량의 문제를 탄력적으로 활용하며 TOEIC의 실전 감각을 익히게 될 것이다.",4,국내도서-국어 외국어 사전
37,9788947527897,4589760,내 아이를 위한 감정코칭,"14,220원",790원,존 가트맨/최성애/조벽,한국경제신문사(한경비피),"“나는 아이를 제대로 사랑하고 있을까?” 감정코칭의 세계적인 권위자 존 가트맨 박사와 EBS '60분 부모'의 최성애 박사, 교수를 가르치는 교수 조벽 박사가 만나 전 세계 엄마들의 양육 방식을 바꾼 감정코칭 5단계를 들려준다.가족치료의 세계적인 권위자 존 가트맨 박사가 30년간 3천 가정을 연구 조사하여 만들어낸 ‘감정코칭’이란 육아법은 이미 수많은 가정 및 학교에서 이루어지며 그 효과를 인정받고 있다.",3,국내도서-가정 살림
38,9788990700469,2691688,해커스 토익 스타트 Reading 리딩,"14,150원",150원,데이비드 조,해커스어학연구소,"해커스 토익 스타트 Reading은 해커스 어학연구소가 토익 입문자들을 위하여 새롭게 선보이는 ‘토익입문서'로, 수년간 축적된 토익 Know-how 중 초보학습자들에게 꼭 필요한 핵심 내용만을 선별하여 한 권으로 압축하였다. 또한 교재 학습효과를 높이기 위하여 무료로 동영상 강의, 온라인 모의고사, 단어 암기 MP3를 제공한다.",3,국내도서-국어 외국어 사전
39,9788993928488,7202720,바람이 분다 당신이 좋다,"12,420원",690원,이병률,달,"7년 만에 나온 『끌림』의 두 번째 이야기. 세월이 흐르는 동안 작가는 그동안 여전히 여러 번 짐을 쌌고, 여러 번 떠났으며, 어김없이 돌아왔다. 변하지 않은 건 ‘사람’. 혼자 떠난 여행에서도 늘 ‘사람’ 속에 있었으며, ‘사람’에 대한 따뜻한 호기심과 ‘사람’을 기다리는 쓸쓸하거나 저릿한 마음을 거두지 않는다. 사람이 여행하는 곳이 결국 사람의 마음이라는 말은 그래서 맞다. 이번에도 역시나, 『끌림』과 마찬가지로 목차도 페이지도 없다. 그러니, 순서도 없다.",1,국내도서-에세이
40,9788917218343,8397719,ETS TOEIC Test LC 공식실전서 1000,"14,850원",820원,ETS,YBM(와이비엠),"출제기관의 공식실전서로 TOEIC L/C 마무리 TOEIC L/C 10회 분량의 모의고사가 담긴 실전서. TOEIC 주관 단체인 ETS가 개발한 문제들로만 구성되어 실제 시험과 동일한 유형과 난이도를 체험할 수 있다. 홈페이지에서 받을 수 있는 무료 MP3 파일 역시 정기시험과 동일한 성우가 녹음하였다. ETS 공인 점수환산표가 포함되어 모의고사를 풀고 난 후, 맞은 개수에 따라 예상 점수를 확인할 수 있다. 학습자들은 학습 계획에 따라 10회 분량의 문제를 탄력적으로 활용하며 TOEIC의 실전 감각을 익히게 될 것이다.",4,국내도서-국어 외국어 사전
41,9788926395219,8382006,수학도둑 32,"8,550원",470원,송도수/서정은,서울문화사,"수십만 명의 학생들의 끊임없는 사랑을 받으며 사고력과 이해력을 향상시켜주는 ‘국내 최초 수학논술만화’로서 인정받고 있는 책입니다. 기존에 익혀왔던 ‘개념이해력’, ‘수리계산력’, ‘원리응용력’, '창의사고력', ‘의사소통력’, ‘시스템적 사고력’을 넘어 우리 생활 주변의 여러 가지 현상을 수학적으로 관찰하고 해석하는 능력을 기를 수 있는 방법과 수리/논리적 사고를 통하여 문제를 합리적으로 해결하는 태도를 키우는 학습까지 할 수 있게끔 구성하였습니다.",1,국내도서-어린이
42,9788990700902,3718300,해커스 토익 실전 1000제 Reading 1 문제집,"11,300원",120원,해커스어학연구소 저,해커스어학연구소,"토익 최신 출제 경향과 난이도를 반영한 실전 문제집 토익 문제를 완전히 분석한 결과를 토대로 실제 시험의 출제 경향과 난이도를 그대로 반영한 문제와 지문으로 구성하였다. 학습자들은 이 교재 한 권으로 최신 경향의 토익 문제들을 풀어보면서 실력을 향상시킬 수 있다. 토익 최신 출제 경향을 철저히 분석한 결과를 토대로 실제 시험과 가장 유사한 문제와 지문을 수록하였다. 실전보다 더 실전다운 문제를 풀어봄으로써, 학습자들은 실전에 대한 감각을 자연스럽고 확실하게 터득할 수 있다.",3,국내도서-국어 외국어 사전
43,9788934961109,8336855,하루 3시간 엄마 냄새,"10,800원",600원,이현수,김영사,"세상의 모든 엄마가 가진 놀라운 능력 ‘엄마 냄새’가 아이의 인생에 기적을 만든다. 엄마 몸속에서 100%의 한 몸으로 살던 아이는 낯선 세상에서 엄마 냄새로 안정을 찾는다. 가장 원시적 감각으로 찾아가는 안전의 신호이자 생명의 필요조건, 엄마 냄새의 본질은 무엇일까? 수많은 아이들에게 제2의 탄생을 선물한 임상심리전문가 이현수 박사가 고려대학병원에서의 20년 연구와 경험으로 완성한 양육의 333법칙을 공개한다.",3,국내도서-가정 살림
44,9791196045500,5982086,어떻게 원하는 것을 얻는가 밀리언 특별판,"14,400원",800원,스튜어트 다이아몬드/김태훈,8.0(에이트 포인트),"수없이 많은 찬사와 사례로 검증된 전설적 강의록, 20년 연속 와튼스쿨 최고 인기강의 선정 기념! 밀리언 특별판 출간! 2011년 11월 말 국내 출간되어 전국 서점가에 ‘협상’ 바람을 불러일으키고 이듬해인 2012년 ‘올해의 책’으로 선정된 뒤 지금까지도 스테디셀러로 무수한 독자들을 만나온 책, 연간 5만 달러가 넘는 MBA 학비를 내고도 쉽게 들을 수 없는 수업을 단 한 권으로 정리해 놀라움을 산 책, 매년 그 기록을 갱신하며 ‘20년 연속 와튼스쿨 최고 인기강의’라는 명예의 전당에 선 책! 『어떻게 원하는 것을 얻는가』를 꼭 6년 만에 밀리언 특별판으로 다시 선보입니다.",1,국내도서-자기계발
45,9788996347200,3676308,아기가 잘 먹는 이유식은 따로 있다,"11,520원",640원,김정미,레시피팩토리(단행),"전문가들이 이야기하는 이유식에 대한 정보는 너무나 많다. 하지만 당장 엄마들에게 필요한 것은 오늘 바로 이 순간 우리 아기에게 해줄, 아기가 잘 먹을 이유식 레시피다. 육아 분야의 파워 블로거이자 네이버 대표 육아카페 마더스의 시삽이기도 한 김정미의 『아기가 잘 먹는 이유식은 따로 있다』는 바로 그 레시피가 주인공인 이유식 실전서다.",3,국내도서-가정 살림
46,9788984315112,5764559,엄마 수업,"10,800원",600원,법륜/이순형,휴(休),"자녀 문제로 괴로워하는 부모에게 법륜 스님이 주는 다정한 조언이자 지혜로 가득 찬 양육 지침서. 저자는 부모와 아이의 관계 특성, 상황별·시기별로 아이를 올바르게 키우는 방법, 좋은 부모의 역할과 자격 등을 소개하며 이것을 바탕으로 우리 아이를 올바르게 사랑하는 지혜를 보여 주고 있다. 오늘날 많은 부모가 자식을 남 보기에 좋은 물건처럼 취급한다. 얼굴 예쁘고, 신체 건강하고, 공부 잘하고, 말 잘 듣고 그런 아이를 원한다.",1,국내도서-가정 살림
47,9788932916088,8297870,프라하의 묘지 1,"12,420원",690원,움베르토 에코/이세욱,열린책들,"6년 만에 찾아온 움베르토 에코의 신작 장편! 거짓말은 어떻게 만들어지는가, 어떻게 살아남는가! 우리 시대의 가장 영향력 있는 사상가. 가장 권위 있는 기호학자이자 뛰어난 철학자, 역사학자, 미학자, 그리고 전 세계적인 인기를 누리는 베스트셀러 소설가. 한마디로 정의할 수 없는 이 시대 최고의 지식인 움베르토 에코의 새 장편소설 『프라하의 묘지』가 이세욱의 번역으로 열린책들에서 출간되었다. 에코는 신작에서 「나는 증오한다, 고로 존재한다」고 선언하는 주인공 시모니니를 통해 거짓의 메커니즘에 대해 끊임없이 천착해온 지난날의 연구와 실천을 집약해서 보여준다. 자신의 이익을 위해서라면 다른 이를 모함하는 것도, 문서를 날조하는 것도, 사람을 죽이는 것도 서슴지 않는 시모니니는 19세기 유럽의 정치적 소용돌이 속에서 음모론이 어떻게 생산되고 퍼져 나가는지 독자들에게 보여준다.",1,국내도서-소설/시/희곡
48,9788965743460,7255346,안 된다고 하지 말고 아니라고 하지 말고,"12,420원",690원,임윤택,해냄,"15년의 방황과 고민, 안타까운 투병의 드라마틱한 인생 끝에 마침내 가수의 꿈을 이룬 ‘만능 엔터테이너’ 울랄라세션 임윤택 내일의 걱정보다 오늘에 푹 빠지는 임윤택의 꿈과 희망에 관한 이야기 만능 엔터테이너 울랄라세션 임윤택의 꿈과 희망에 관한 이야기 『안 된다고 하지 말고 아니라고 하지 말고』. 오디션 프로그램인 슈퍼스타K 시즌3의 우승팀인 울랄라세션의 리더 임윤택이 지칠 틈 없이 긍정적인 자세로 꿈을 향해 달려온 이야기를 담은 에세이다. 화려한 퍼포먼스로 우승하기까지 세상 무서운 줄 모르고 돌진해 온 인간 임윤택의 거침없는 이야기가 그의 삶을 지배하는 지침들과 함께 소개된다. 초등학생 때부터 써온 십수 권의 일기에 담긴 에피소드를 중심으로 했으며 춤, 노래, 패션, 인연, 노력, 생각 등 총 6장으로 구성되어 있다.",2,국내도서-에세이
49,9788974254896,2547786,꿈꾸는 다락방,"12,150원",670원,이지성,국일미디어,세상에는 일평생 허리가 휘도록 일하고도 자기 집 한 채 장만하지 못하는 사람들이 있는가 하면 놀 것 다 놀면서도 어마어마한 재산을 마련하고 엄청난 유명세를 타는 사람들이 존재한다. 노력이 성공의 비결이라는 것이 이론적으로도 말이 안 되는 것은 ‘세상에는 당신과 같은 나이이지만 당신보다 열 배 스무 배 성공한 사람들이 존재한다.’는 사실만 보더라도 알 수 있다. 만일 노력이 성공의 비결이라면 그들은 당신보다 열 배 스무 배 더 많이 노력한 사람들이어야만 한다.,3,국내도서-자기계발
50,9788984371200,8018946,7년 후,"12,150원",670원,기욤 뮈소/임호경,밝은세상,"전작 『천사의 부름』으로 로맨스와 스릴러의 매끄러운 결합을 보여준 기욤 뮈소가 이번에는 로맨틱 코미디로 돌아왔다! 2012년 작인 『7년 후』는 프랑스에서 단숨에 아마존 프랑스 베스트셀러 1위에 오르며 기욤 뮈소의 밀리언셀러 퍼레이드에 가세한 작품이다. 『7년 후』는 아들의 실종사건을 직접 해결하기 위해 갈라선 지 7년 만에 만난 부부 이야기를 다루고 있다. 이 소설의 두 주인공 세바스찬과 니키는 아들을 구하기 위해 긴박한 사건에 뛰어들 수밖에 없다. 이 작품은 긴박한 사건이 주는 긴장감과 로맨틱 코미디를 적절하게 결합시켜 독자들을 새로운 세계로 이끈다. 기욤 뮈소는 특유의 감성코드를 살리며 주인공들의 사랑스러운 매력을 새로운 배경에 적절히 녹여내는 특기를 유감없이 발휘한다. 독자들은 기욤 뮈소의 소설을 통해 언제나 가슴 뭉클한 감동과 생에 대한 열정을 만나게 된다. 이 소설의 주요 소재 역시 사랑, 용서, 화해이다.",1,국내도서-소설/시/희곡
51,9788990700568,3103577,해커스 토익 Listening 리스닝,"17,860원",190원,데이비드 조,해커스어학연구소,"유형별 접근을 통해 실전 공략한 토익 기본서 최신 경향을 반영하여 Part1에서 Part4까지 종합 구성한 토익 리스닝의 기본서이다. 또한 많은 최신의 실전문제를 포함하고 있는 실전서이기도 하다.각 파트별로 소개된 고득점 전략을 토대로 '기초 다지기'와 '실전 고수 되기'까지 토익 리스닝의 핵심을 단계별로 충분히 습득한 후, 풍부하게 수록된 실전 문제를 풀어봄으로써, 가장 효율적이고도 확실한 방법으로 토익실전을 대비할 수 있도록 하였다.",3,국내도서-국어 외국어 사전
52,9788998015015,7760495,지금 시작하는 인문학,"16,200원",900원,주현성,더좋은책,"인문학을 이루는 가장 기본 개념 - 심리학, 회화, 신화, 역사, 철학, 글로벌 이슈 여섯 개의 인문 핵심 분야를 한 권으로 꿰뚫는다 취업을 준비하는 20대 사회 초년생뿐만 아니라, 직장인을 대상으로 한 인문학 강의도 열리기만 하면 만석이 되는 등 대한민국은 지금 인문학 열풍으로 가득하다. 인문학은 오래전부터 사회 전반의 기초 지식과 다양한 안목을 제공해왔으며, 문화 콘텐츠가 산업 내에서 중요한 위치를 차지하는 현대사회에서는 그 영향력이 더욱 강화되어왔다. 인문학이 문화 트렌드와 콘텐츠들을 더욱 잘 이해하고 재생산해내는 기초 해석 코드들을 제공해주기 때문이다. 더불어 몇 해 전부터 크리에이터들을 중심으로 광고나 홍보 전략에서 상품 개발, 마케팅 전략에 이르기까지 인문학을 접목시키거나 인문학에서 힌트를 얻으려는 노력들이 소개되면서, 많은 사람들이 인문학의 실용성에 큰 관심을 갖기 시작했다.",3,국내도서-인문
53,9788926395158,8474964,코믹 메이플스토리 오프라인 RPG 57,"8,010원",440원,송도수/서정은,서울문화사,"MMORPG 게임 《메이플 스토리》를 만화로 재구성했습니다. 번뜩이는 상상력으로 가득한 이야기에다가 3D그래픽을 사용한 입체적이고 풍부한 색감의 그림이 어우러져 있습니다. 특히 개성적 캐릭터들과 함께 모험을 떠나며 우정, 도전, 배려, 정의를 배우면서 상상력과 창의력을 높입니다. 아울러 이야기 속 필수어휘를 재미있는 예문으로 익히며 언어 능력을 향상할 수 있습니다.",1,국내도서-어린이
54,9788937486364,8226072,엄마와 딸,"10,800원",600원,신달자,민음사,"세상에서 가장 가깝고도 먼 사이, ‘엄마와 딸’. 세상 모든 엄마는 누군가의 딸이었고, 세상 모든 딸들은 언젠가 누군가의 엄마가 된다. 그러므로 이 책은 엄마와 딸, 엄마이자 딸, 결국 세상 모든 여자들의 이야기이다. “엄마처럼 살진 않을 거야!” “딱 너 같은 딸 하나만 낳아 봐라!” 살면서 한번쯤 이런 말을 주고받지 않는 엄마와 딸이 있을까. 서로 도저히 이해할 수 없다고 말하지만, 기실 누구보다 서로의 마음을 가장 잘 이해하고 있는 관계, 엄마와 딸. 부모 자식 관계를 넘어, 같은 여자로서 모녀는 갈등과 동질감을 거듭하는 미묘한 관계다. 신달자 시인은 기쁨이면서 슬픔이고, 아픔인 동시에 희망인 엄마와 딸의 복잡하고 미묘한 관계를 섬세하고 감동적으로, 유쾌하고 진솔하게 그려 낸다. ‘엄마에게 보내는 편지’로 시작해서 ‘딸에게 보내는 편지’로 맺음을 한다.",1,국내도서-에세이
