순위,ISBN,상품번호,상품명,판매가,YES포인트,저자,출판사,설명,출고예상일,관리분류
55,9788990794529,2299464,사랑해 사랑해 사랑해,"9,970원",100원,신형건/버나뎃 로제티 슈스탁/캐롤라인 제인 처치,보물창고,"기억나니? 네가 아기였을 적에 엄마 품에서 셀 수도 없을 만큼 듣고 또 들은 그 말. '사랑해 사랑해 사랑해...' 귀엽고 예쁜 우리 아가를 무릎에 앉혀 놓고 얼마나 사랑하는지 표현해 주세요! 숨을 쉬고, 밥을 먹고, 배설을 하는 것처럼 ‘책읽기’는 당연하게 여겨져야 하는 것 중의 하나입니다. 아기이기 때문에 어른들보다 작은 숨을 쉬고, 적게 먹을지는 모르지만 아기에게도 이 모든 것은 절대적으로 필요합니다.",1,국내도서-유아
56,9788970650340,1477636,논어,"13,500원",750원,공자,홍익출판사,"『논어(論語)』는 공자와 그 제자들이 세상사는 이치나 교육ㆍ문화ㆍ정치 등에 관해 논의한 이야기들을 모은 책이다. 그 안에는, 공자의 혼잣말을 기록해 놓은 것과 제자의 물음에 공자가 대답한 것, 제자들끼리 나눈 이야기, 당대의 정치가들이나 평범한 마을사람들과 나눈 이야기 등 다양한 내용이 포함되어 있다. 그래서 책의 제목이 『논어』가 되었다고 한다. 공자와 그 제자들이 토론한 이야기라는 의미이다....",3,국내도서-인문
57,9788901153773,8410493,당신은 전략가입니까,"15,120원",840원,신시아 A. 몽고메리/이현주,리더스북,"리더를 관리자가 아닌 ＇전략가＇로 변모시키는, 신시아 몽고메리 교수의 혁명적 프로그램 하버드 최고의 전략 강의를 한 권의 책으로 만난다! 전세계 0.1% 글로벌 리더에게만 허락된 하버드 최고의 전략 강의를 한권의 책으로 엮었다. “당신은 전략가입니까?”라는 다소 충격적이고 당황스런 질문으로 시작되는 이 수업은, 100년의 경영역사 속에 살아숨쉬는 케이스 스터디, 당신을 최고의 전략가로 이끄는 8개의 결정적 질문, 꼬리처럼 물고 늘어지는 질의응답식 압박을 통해 서서히 전략의 실체를 드러냄으로써 강의 종반부에는 짜릿한 지적 사고의 전환을 경험하게 만든다.",3,국내도서-경제 경영
58,9788928615810,8380832,나는 왜 이 일을 하는가?,"13,500원",750원,사이먼 사이넥/이영민,타임비즈,"Start with why! 마이크로소프트, MARS, SAP, 인텔, 미 의회 등 ‘왜’의 가치를 믿는 다양한 기업과 정부기관, 기업가들의 워크숍에 교육과정을 개설하고 자주 강의를 하고 있는 저자 사이먼 사이넥. 그가 세상과 일터, 자기 삶을 적극적으로 리드하는 사람들은 이미 알고 있는 우리를 춤추게 하는 근원의 힘, 자신만의 ‘왜?’를 찾아가는 소중한 경험을 담은 책이다.",1,국내도서-자기계발
59,9788984314207,4179691,스님의 주례사,"10,800원",600원,법륜/김점선,휴(休),행복한 결혼을 꿈꾸는 남녀에게 쏟아지는 축복 같은 조언 이 책은 '스님의 주례사'라는 제목으로 오랫동안 인터넷을 통해 회자되며 결혼 전 반드시 읽어야 할 대표적인 글로 화제가 된 법륜 스님의 남녀 마음 이야기들을 모은 것이다.,3,국내도서-종교
60,9788970636795,4771740,꾸뻬 씨의 인생 여행,"14,400원",800원,프랑수아 를로르/발레리 해밀,열림원,"꾸뻬씨와 떠나는 또 한번의 특별한 여행. 꼬마 꾸뻬를 통해서 잊지 말아야 할 삶의 가치와 의미를 재발견한다. 행복, 우정과 같이 우리 삶의 근본이 되는 가치들에 대해 평범하지만 소중한 가르침을 전해온 프랑스의 정신과 의사이자 작가 프랑수아 를로르가 '꼬마 꾸뻬'의 눈을 통해 바라본 세상의 이야기를 들려준다. 『꾸뻬 씨의 행복 여행』을 통해 행복과 사랑, 시간에 대한 질문의 답을 찾으려 했던 꾸뻬씨가 이번에는 우리의 가정으로 관심을 돌려 어린시절로 돌아가 그동안 잊고 살았던 삶의 원칙들을 되새긴다.",1,국내도서-소설/시/희곡
61,9788994013503,6994115,내가 알고 있는 걸 당신도 알게 된다면,"12,600원",700원,칼 필레머/박여진,토네이도,"우리가 알고 있는‘행복’의 프레임을 깨는 책! 우리는 매일 버거운 삶을 살아간다. 그 버거운 삶을 조금이라도 덜어내고자 우리는 유명작가의 책을 읽고, 전문가들의 강연에 참석하고, SNS를 통해 수많은 사람들의 목소리에 귀를 기울인다. 그럼에도 인생의 지혜에 대한 갈증은 좀처럼 해소되지 않는다.",1,국내도서-자기계발
62,9788970127248,1940233,"총, 균, 쇠","25,200원","1,400원",재레드 다이아몬드/김진준,문학사상,"왜 어떤 민족들은 다른 민족들의 정복과 지배의 대상으로 전락하고 말았는가. 왜 원주민들은 유라시아인들에 의해 도태되고 말았는가. 왜 각 대륙들마다 문명의 발달 속도에 차이가 생겨났는가. '인간 사회의 다양한 문명은 어디서 비롯되는가?'라는 의문을 명쾌하게 분석하여 1998년 퓰리처 상을 수상한 책. 2005년 12월 새롭게 개정신판이 출간되었다. 진화생물학자인 재레드 다이아몬드는 총기와 병균과 금속이 역사에 미친 엄청난 영향에 대해 분석한다. 일단 수렵 채집 단계를 넘어서 농경을 하게 된 사회들은 문자와 기술, 정부,...",1,국내도서-사회 정치
63,9788925548777,8011152,잠수네 아이들의 소문난 교육로드맵,"16,200원",900원,이신애,알에이치코리아(RHK),"엄마표 공부의 진수를 보여주마! 대한민국 엄마들이 모두 원하는 가장 확실한 교육로드맵! 이 세상 모든 엄마들은 아이가 태어나면 숨은 잘 쉬는지부터 시작해서 걷기 시작하면 넘어지지 않는지 등 아이들이 자라면서 아이를 향한 고민과 걱정의 색깔이 변화함을 느낀다. 어느덧 아이가 학교에 입학하게 될 나이가 되면 엄마들은 본격적으로 '공부'에 관한 걱정을 하기 마련이다. 아이들이 어디서 어떻게 공부를 해야 '영재'가 될 수 있고, 뒤떨어지지 않는지에 대한 고민들이 한가득이다. 아무도 답을 속시원하게 가르쳐주지 않고, 정보도 유용하기보다는 단편적이고 단기적이다. 그렇다면 이 고민의 근본적인 해결책은 어디서 찾을 수 있을까? 저자는 사교육에 의존하지 않고도 자녀의 실력을 탄탄하게 키워주려는 소신을 가지고 14년간 검증되고 진화해온 국영수사과 필승의 공부법을 연구하였다.",1,국내도서-가정 살림
64,9788926395080,8308844,코믹 메이플스토리 오프라인 RPG 56,"8,010원",440원,송도수/서정은,서울문화사,"시그너스 여제와 새로운 연합의 대격돌! 용사들이여, 일어나라! 시그너스 여제의 부활 소식으로 혼란에 빠진 메이플월드. 특히 스우의 무모한 행동에 큰 충격을 받은 블랙윙은 5인의 기사단장이 귀환하기 전에 여제를 공격하기 위해 3인의 선발대를 조직하여 에레브로 향합니다. 에레브 하늘나루에 모이게 된 세계수 형제단과 루미델 제국, 블랙윙 멤버들은 여제라는 공통의 적을 두고 미묘한 견제를 벌이다 함께 여제를 치러 가기로 결정합니다.",2,국내도서-어린이
65,9788954620550,8410782,적의 칼로 싸워라,"13,500원",750원,이명우,문학동네,"창조와 창의란 ‘기존’과는 다른 것, 차별화란 ‘남’과 다른 것, 혁신은 ‘지금까지’와 다른 것이다! 저자, 한양대 이명우 교수는 삼성전자 미국 가전부문 대표, 소니코리아 사장, 한국코카콜라보틀링 회장, 레인콤 대표이사 등을 거치며 33년간 비즈니스 현장에서 다양한 경험을 쌓았다. 그의 탁월한 마케팅 감각과 경영능력은 해외에서도 인정받아, 1999년 ADL이 미국 가전업계 발전에 공헌한 사람에게 수여하는 ‘국제휴머니테리언상(S . David Feir International Humanitarian Award)’을 수상했고, 2001년에는 아시아인으로는 처음으로 미국 전자공업협회(EIA) 산하 관리자이사회 멤버로 지명되기도 했다. 2001년 말, 삼성전자의 경쟁사인 일본 소니로 스카우트됐을 때는, 당시 아시아/태평양 지역 최초의 현지인 출신 소니 최고경영자로 화제에 올랐다.",1,국내도서-경제 경영
66,9788950923846,3843078,김미경의 아트 스피치,"13,500원",750원,김미경,21세기북스,"영혼을 감동시키는 마법의 스피치 MBC 희망특강 「파랑새」의 국민 강사 김미경이 전하는 소통, 설득, 공감의 기술 한국인들은 어릴 때부터 말하는 문화와 토론하는 문화에 익숙하지 않은 환경에서 성장한 탓에 스피치 기술의 중요성을 간과해왔다. 그러나 사회에 첫 발을 내딛기 시작할 때부터 이야기는 달라진다. 해외 바이어 앞에서 프레젠테이션을 할 때도, 예산을 따기 위해 상사를 설득할 때도, 팀별 토론을 할 때도 스피치가 관건이다.",3,국내도서-자기계발
67,9788990700605,3083447,해커스 토익 스타트 Listening 리스닝,"12,250원",130원,데이비드 조,해커스어학연구소,"4주 완성의 초보를 위한 토익 입문서 『해커스 토익 스타트 Reading』에 이어 토익 리스닝 기초에 꼭 필요한 내용만을 엄선하여 체계화한 ""토익 리스닝 입문서""이다. 왕초보를 위한 기초다지기, 삽화를 통한 어휘 학습을 포함한 다양한 기초 학습 장치를 교재에 수록하여 영어에 두려움을 가진 학습자들도 즐겁게 학습을 시작할 수 있도록 하였다. 뿐만 아니라, 각 파트별로 스텝별 문제 풀이 전략을 적용하여 실제 토익 시험에서 자연스럽게 활용할 수 있다.",3,국내도서-국어 외국어 사전
68,9788997132287,8319543,유대인 이야기,"25,200원","1,400원",홍익희,행성B잎새,"세계 경제를 좌우하는 유대인의 내밀한 저력을 역사의 흐름 속에서 밝혀낸다 이스라엘의 경제적 성과는 눈부시다. 세계 경제위기 가운데서도 최저의 실업률과 호황을 맞은 부동산 시장, GDP 대비 R&D 투자비율 세계 1위와 같은 지표를 보여주고 있다. 자원이 풍부한 것도 아니고, 연일 이슬람 국가들과의 전쟁 공포에 휩싸인 나라에서 경제대국 미국의 경제를 주무르는 유대인들의 부의 지배력이 어떻게 나오는 것일까? 22년간 KORTA에서 근무하며 세계 곳곳의 다양한 경제 환경을 경험한 저자는, 이 책에서 경제의 역사를 주도한 유대인들이 어떻게 지금의 성공을 이룰 수 있었는지를 파노라마처럼 들여다본다. 이 책은 쉽고 간결한 문체로 그려낸 한편의 대하 다큐멘터리이다.",1,국내도서-인문
69,9788932916095,8297871,프라하의 묘지 2,"12,420원",690원,움베르토 에코/이세욱,열린책들,"6년 만에 찾아온 움베르토 에코의 신작 장편! 거짓말은 어떻게 만들어지는가, 어떻게 살아남는가! 우리 시대의 가장 영향력 있는 사상가. 가장 권위 있는 기호학자이자 뛰어난 철학자, 역사학자, 미학자, 그리고 전 세계적인 인기를 누리는 베스트셀러 소설가. 한마디로 정의할 수 없는 이 시대 최고의 지식인 움베르토 에코의 새 장편소설 『프라하의 묘지』가 이세욱의 번역으로 열린책들에서 출간되었다. 에코는 신작에서 「나는 증오한다, 고로 존재한다」고 선언하는 주인공 시모니니를 통해 거짓의 메커니즘에 대해 끊임없이 천착해온 지난날의 연구와 실천을 집약해서 보여준다. 자신의 이익을 위해서라면 다른 이를 모함하는 것도, 문서를 날조하는 것도, 사람을 죽이는 것도 서슴지 않는 시모니니는 19세기 유럽의 정치적 소용돌이 속에서 음모론이 어떻게 생산되고 퍼져 나가는지 독자들에게 보여준다.",1,국내도서-소설/시/희곡
70,9788963702933,8144191,길 위에서 하버드까지,"14,220원",790원,리즈 머리/정해영,다산책방,"뉴욕 타임스 베스트 셀러! 백악관 프로젝트 롤모델상, 크리스토퍼상 수상작! 15살부터 거리에서 생활하다 하버드에 입학한 한 소녀의 감동 실화! 『길 위에서 하버드까지』는 15살부터 거리에서 생활하다가 마침내 하버드에 입학하게 된 리즈 머리의 놀랍고도 생생한 삶이 기록되어 있다. 이 이야기는 2003년 라이프타임 텔레비전에 의해 〈노숙자에서 하버드까지 : 리즈 머리의 이야기〉로 영화화되면서 많은 사람들의 주목을 받기도 했다. 지독한 마약중독자인 부모 밑에서 자랐던 어린 시절, 에이즈에 걸린 엄마로 인해 보호소와 길거리를 전전하던 청소년기, 그리고 운명을 스스로 개척하기 위해 낯선 세상을 향해 문을 두드리기까지의 과정이 생생하고도 감동적으로 펼쳐진다. 그녀에게 세상이란 ‘나를 거부하는 사람들로 가득 찬’ 거대한 벽과 같았다. 하지만 어느 날 우연히 목격한 한 여자의 죽음은 ‘세상에서 이대로 사라져버릴 수 없다’는 절박함으로 바뀌고, 그녀를 변화시키기 시작했다.",1,국내도서-에세이
71,9788915080515,5902811,루브르 박물관보다 재미있는 세계 100대 명화,"10,800원",600원,박현철,삼성출판사,"명화, 예술적 감성과 폭 넓은 관점의 지성을 키우는 밑거름입니다. 명화는 잘 그려진, 많은 사람들에게 사랑을 받는 그림을 말합니다. 전 세계의 수많은 화가들이 자신의 느낌, 생각, 이야기를 그림으로 표현하며 많은 이들에게 감동을 주지요. 레오나르도 다빈치부터 피카소까지 시대와 나라를 넘나들며 사람들에게 사랑을 받은 70여명의 화가와 100점의 작품을 선정하여 우리 어린이들의 상상력을 키워주고 더 넓은 세상을 바라볼 수 있도록 구상하였습니다.",3,국내도서-어린이
72,9791185473437,8286501,진짜 기본 요리책,"16,920원",940원,요리잡지 수퍼레시피,레시피팩토리(단행),"엄마 밥상에서 막 독립해 오늘 처음 요리를 시작하는 진짜 왕초보들을 위한 진짜 기본 요리책. 월간 [수퍼레시피] 카카오톡 친구 중 왕초보 패널 100명을 뽑아 그들과 함께 나물, 조림, 밑반찬, 구이, 장아찌, 김치, 국물요리, 한그릇 밥과 면, 간식 등 다양한 분야에 걸쳐 꼭 알고 싶은 메뉴 306가지를 선정하였다. 선정된 메뉴에 대해서는 [수퍼레시피] 테스트키친팀 소속 테스트쿡들이 여러 차례의 테스트를 거쳐 누구든 따라하면 실패하지 않는 레시피를 만들었다. 또한 왕초보 패널들이 가장 궁금하다고 했던 재료 및 기본 양념 고르는 법, 남는 재료 냉장법과 냉동법, 실패한 요리 되살리는 법 등의 정보들도 꼼꼼히 다루고 있다. 집중공략이란 코너에서는 봄나물, 겨울뿌리채소, 말린나물 등 손질법을 잘 몰라 해먹고 싶어도 해먹지 못했던 재료들도 자세히 소개했다. 기본 국물 맛있게 내는 법, 배달음식 보관법 및 다시 데우는 법 등도 패널들의 요청에 따라 소개하고 있다.",1,국내도서-가정 살림
73,9788990700933,3718285,해커스 토익 실전 1000제 Listening 1 문제집,"10,350원",110원,해커스어학연구소 저,해커스어학연구소,"토익 최신 출제 경향과 난이도를 반영한 실전 문제집 토익 문제를 완전히 분석한 결과를 토대로 실제 시험의 출제 경향과 난이도를 그대로 반영한 문제와 지문으로 구성한 교재. 실전보다 더 실전다운 문제를 풀어봄으로써, 학습자들은 실전에 대한 감각을 자연스럽고 확실하게 터득할 수 있다. 모든 지문 및 문제에 대해 정확한 스크립트를 수록하여, 학습자가 정확하게 지문을 이해할 수 있도록 하였으며, 리스닝 지문과 문제를 보다 정확하게 이해하는 데 도움이 되는 정확한 해석을 해커스영어 사이트(www.Hackers.",3,국내도서-국어 외국어 사전
74,9788965700890,7745591,장사의 신,"12,600원",700원,우노 다카시/김문정,쌤앤파커스,"일본 요식업계의 전설, 술장사의 신(神), ‘우노 다카시’가 들려주는 장사에 대한 모든 것! 장사에도 왕도가 있다!. 죽을 각오로 열심히 하는 것도, 실패를 각오하고 이 방법 저 방법을 시도하는 것도 중요하지만 정답은 ‘제대로’ 할 줄 알아야 한다는 것. 이 책의 저자 우노 다카시는 일본에서는 요식업계의 전설이자 ‘장사의 신’으로 불리는 사람이다. 커피숍의 매니저로 시작해, 200명이 넘는 자신의 직원들을 성공한 이자카야의 사장으로 만든 주인공. 그가 이 책에 쏟아놓은 장사의 비법은 남다르다. 부동산에서 가게 입지를 선정하는 방법, 백발백중 성공하는 메뉴를 만드는 비법, 접객을 통해 매출을 올리는 비법과 가게를 효율적으로 늘려가는 방법까지… 바로 곁에서 1:1로 코치하듯 들려주는 날카로운 지적과 빈틈없는 가이드는 독자들을 완전히 몰입하게 만든다 모든 사람들이 그를 ‘장사의 신’이라고 부르는 이유는 간단하다.",1,국내도서-경제 경영
75,9788976820754,1821219,삐뽀삐뽀 119 이유식,"10,710원",120원,하정훈,그린비라이프,"『처음 만나는 우리아기 이유식』의 개정판. 사랑스런 아가의 평생 건강을 지켜주는 이유식 조리법을 소개한다. 이유식 초기와 중기, 후기, 완료기 네 단계에 따라 안전한 식품과 조리법에 따른 메뉴를 선보이며, 알레르기 아가와 아픈 아가들도 안전하게 먹을 수 있는 이유식 조리법을 정리해 놓았다. 시기별로 반드시 알아야할 주의사항 들을 정리해 주고, 아가에게 맞는 이유식 조리법을 소개한다. 초보 엄마들도 쉽게 따라 할 수 있도록 계량에서 재료 고르기, 만들기와 보관까지 모든 것을 다루고 있다....",1,국내도서-가정 살림
76,9788932909349,3647046,그리스인 조르바,"11,520원",640원,니코스 카잔차키스/이윤기,열린책들,"20세기 문학의 구도자, 니코스 카잔차키스의 대표작 『그리스인 조르바』는 카잔차키스에게 세계적인 명성을 안겨 준 작품으로, 호쾌하고 농탕한 자유인 조르바가 펼치는 영혼의 투쟁을 풍부한 상상력으로 그려 내고 있다. 이 책의 주인공 조르바는 실존 인물로서, 카잔차키스는 『영혼의 자서전』에서 다음과 같이 이야기 한다. 「……힌두교도들은 '구루(사부)'라고 부르고 수도승들은 '아버지'라고 부르는 삶의 길잡이를 한 사람 선택해야 했다면 나는 틀림없이 조르바를 택했을 것이다…….",1,국내도서-소설/시/희곡
77,9788956251073,3766565,광고천재 이제석,"13,500원",750원,이제석,학고재,"최고 권위의 뉴욕 원쇼 페스티벌 최우수상, 광고계의 오스카상이라 불리는 클리오 어워드 동상, 미국광고협회가 수여하는 애디 어워드 금상 등 세계 유수의 국제 광고제에서 무려 29개의 메달을 휩쓴 자랑스러운 한국인, 그리고 과 수석으로 졸업하고도 오라는 광고대행사가 없어 동네 간판쟁이 일을 하다 '찌라시 아저씨'에게 수모를 당한 대구 청년. 이 둘은 동일 인물이다.",3,국내도서-에세이
78,9788960865815,8155936,미생 - 아직 살아있지 못한 자 4,"9,900원",550원,윤태호,위즈덤하우스,"나 하나쯤 어찌 살아도 사회는, 회사는 아무렇지도 않겠지만, 그래도 이 일이 지금의 나야. 첫 월급을 받자 뭔가 본격적이란 느낌에 상기된 신입사원 4인방. 하지만 ‘당연히 배려해주던’ 시기를 지나 ‘마땅히 한 명의 몫을 해내야 하는’ 상황이 되자 그동안 가려졌던 부족함들이 삐죽삐죽 고개를 내민다. 돌격대 영업 3팀은 새 사업 아이템으로 동분서주하고, 월급과 승진보다는 아직 현장과 성취를 더 사랑하는 ‘청년’ 오 과장은 그 과정에서 깊은 상처를 입는다. 그리고… 자신이 매우 훌륭한 팀에 속해 있음을 실감하던 장그래 앞에 마치 그 생각을 비웃기라도 하듯 만만치 않은 인물이 등장한다. 베스트셀러 『이끼』의 작가 윤태호. 그가 연결하는 바둑과 인생은 어떤 그림일까? 『미생』은 열한 살에 한국기원 연구생으로 들어가 프로기사만을 목표로 살아가던 청년 장그래가 입단에 실패하고 ‘회사’라는 전혀 새로운 세계에 들어서면서 시작된다.",3,국내도서-만화/라이트노벨
79,9788901121390,5382110,기분을 말해 봐!,"9,900원",550원,홍연미/앤서니 브라운,웅진주니어,"의사소통이 수월하지 않은 우리 아이에게 꼭 필요한 질문 ""너의 감정을 말해 봐"" 앤서니 브라운의 단순하면서도 명료한 그림체와 함께 아이의 기분 표현하기를 도와주세요! 유아기에는 ‘성장의 폭발기’라고 할 정도로 다양한 방면의 성장이 이뤄집니다. 신체인지 발달뿐만 아니라 다양한 감정을 느끼고 표현하기 시작하며 정서 발달도 활발해집니다.",1,국내도서-유아
80,9788965701095,8172922,인생학교 섹스,"10,800원",600원,알랭 드 보통/정미나,쌤앤파커스,"알랭 드 보통, 드디어 ‘섹스’에 대해 입을 열다! 유쾌한 현자 알랭 드 보통이 작정하고 파헤친 모던 섹스의 리얼리티! 살아가면서 중요한 순간에 부딪히는 여러 가지 문제들, 이를테면 섹스, 돈, 일, 정신, 세상, 시간 등에 관한 고민이 생길 때 우리는 어떻게 행동하는가? '지혜'가 필요한 순간, 너무 얄팍한 '지식'을 근거로 쉽게 문제를 해결했다고 생각하거나 회피하지는 않았는가? 2008년 영국에서 처음 문을 연 '인생학교 The School of Life'는 ""배움을 다시 삶의 한가운데로!""라는 캐치프레이즈 하에 삶의 의미와 살아가는 기술에 대해 강연과 토론, 멘토링, 커뮤니티 서비스 등을 제공하는 글로벌 프로젝트이다. 인생학교는 인생의 모든 순간을 지배하는 6가지 핵심주제에서 뽑아낸 통찰과 지혜로 일상적 사유의 깊이를 더해 우리 삶의 질을 높이는 것을 목적으로 한다. 그 중심에는 우리에게도 친숙한 작가 '알랭 드 보통'이 있어 시리즈의 출간이 더욱 반갑다.",1,국내도서-에세이
