순위,ISBN,상품번호,상품명,판매가,YES포인트,저자,출판사,설명,출고예상일,관리분류
26,9788995501443,1403766,꾸뻬 씨의 행복 여행,"12,150원",670원,프랑수아 를로르,오래된미래,"마음의 병을 앓고 있는 사람들을 치료하던 정신과 의사가 행복의 참된 의미를 찾아 여행을 떠난다는 소설이다. 이 소설의 주인공처럼 저자는 정신과 의사이다. 늘 불안한 심리 상태로 살아가는 사람들을 지켜보면서 어떤 심리학적 설명보다 한 편의 이야기가 더 사람의 마음을 움직일 수 있다고 생각했고, 자신의 환자들을 진료하며 얻은 경험과 생각들을 바탕으로 소설을 썼다. 현재 12개국의 언어로 번역되어 현대인의 복잡한 심리의 핵심을 짚어내면서 누구나 공감할 수 있는 이야기로 사람들의 마음을 움직이고 있다....",1,국내도서-소설/시/희곡
27,9788993964844,14049338,싸드 THAAD,"12,780원",710원,김진명,새움,"왜 지금 저들은 한반도에 싸드를 논하는가? “받으면 중국의 적, 받지 않으면 미국의 적. 그렇다면 우리의 선택은?” 세계은행 연구원으로 능력을 인정받으며 승승장구하던 리처드 김의 갑작스러운 죽음. 원인을 쫓던 변호사 최어민은 그의 죽음에 싸드(Terminal High Altitude Area Defense, 고고도 미사일 방어체계)가 관련되어 있다는 걸 알게 된다. 그러나 너무도 분명하게 눈에 보이는 건 오히려 의심해야 하는 법. 리처드 김이 쫓았던 것은 더 큰 어떤 것, 단순한 미사일 방어체계가 아닌 거대한 어떤 그림이었다. 리처드 김이 본 것은 과연 무엇이란 말인가? 미국도 한국 국방부도 표면적으로는 북한을 방어하기 위한 것이라고 말하는 싸드. 그러나 사실은 다르다. 남한에 싸드를 배치하면 중국의 모든 대륙간탄도탄은 무용지물이 된다. 중국의 공격적 미사일 시스템을 완전히 봉쇄할 수 있는 것이다.",1,국내도서-소설/시/희곡
28,9788934969006,14636381,구글은 어떻게 일하는가,"14,220원",790원,에릭 슈미트/조너선 로젠버그/앨런 이글/박병화,김영사,"출간 즉시 아마존 베스트셀러! 한국·미국 동시 출간! 영국, 중국, 일본 등 전 세계 17개국 판권계약! 올해 절대 놓쳐서는 안 될 단 한 권의 비즈니스 명저! 10년 만에 인류의 삶을 바꾼 기업. 직장인이 꼽은 가장 일하기 좋은 회사. [포춘] 선정 기업 브랜드 가치 세계 1위. 10억 명의 구글 맵 사용자. 구글 안드로이드 스마트폰 80% 점유. [타임] 선정 최고 발명품 구글 글라스. “상상할 수 없는 것을 상상하라!” 최고의 비즈니스 리더 에릭 슈미트가 최초로 공개하는 세상에서 가장 혁신적이고 미래 지향적인 기업 구글의 혁신전략과 성공법칙 그리고 미래기업의 조건. 전 세계 리더들의 눈과 귀를 사로잡은 경영전략 바이블! “지금 구글이 실행하는 방식, 추구하는 전략, 꿈꾸는 비전은 기업뿐만 아니라 우리 자신이 찾고 있는 바로 그 대안이다.",1,국내도서-경제 경영
29,9788954633994,15457498,마왕 신해철,"15,120원",840원,신해철,문학동네,"영원한 마왕, 우리 시대 불멸의 뮤지션 신해철 그가 우리 곁에 남기고 간 글들 이 책은 너무나 안타깝고 슬프게도 우리 곁을 갑작스레 떠난 뮤지션 신해철이 오랫동안 틈틈이 써온 글을 모은 유고집이다. 유족의 뜻에 따라 펴내게 된 이 유고집에는 어린 시절부터 청년 시절 이야기, 그리고 그의 음악관과 세계관을 엿볼 수 있는 내밀한 고백들이 담겨 있어, 우리 대중음악사에 거대한 족적을 남긴 한 인물의 자전적 기록으로서도 그 가치가 소중하고 특별하다. 그만의 독보적인 음악 세계, 거침없는 언변, 세상을 보는 정의롭고 따뜻한 눈과 마음을 지녔던 뮤지션 신해철. 그가 대중의 마음을 사로잡을 수 있었던 것은 삶과 사회의 가식을 걷어내고 그 진면목을 보고자 했던 예술가의 비타협적 정신이 형형하게 숨쉬고 있었기 때문임을 그의 글들을 통해 확인하게 될 것이다.",1,국내도서-에세이
30,9788965420194,9008595,해커스 토익 Listening,"16,920원",940원,데이비드 조,해커스어학연구소,토익 리스닝의 기본서. 최신 토익 출제 경향의 철저한 분석을 바탕으로 문제 해결 전략을 제시하고 문제를 풍부하게 수록했다. 진단고사로 취약점을 파악하고 자신에게 맞는 학습법을 계획해 기본기를 다지고 실적 감각과 점수를 높이도록 안내한다. 받아쓰기&쉐도잉(듣고 따라하기) CD가 수록되어 교재의 내용을 완전히 체득하도록 했다. 상세한 해설집에는 문제 해설과 함께 모든 문장 속의 어휘와 표현을 함께 정리했다. 무료 온라인 실전모의고사(www.Hackers.co.kr)와 무료 단어암기 MP3 & 진단고사 해설 강의(www.ChampStudy.com)를 제공해 다양한 콘텐츠를 활용하며 효과적으로 학습할 수 있다.,3,국내도서-국어 외국어 사전
31,9788958075486,15117765,태어나서 처음 하는 진짜 영어공부,"13,500원",750원,이혜영,DSL(뜨인돌),"영어의 기본기를 완성하기 위해서는 대략 6개월 정도가 필요하다. 이 책은 6개월 동안 뭘 해야 하는지, 어떤 내용을 공부해야 하는지, 어떤 마음가짐으로 공부해야 하는지 저자가 친근하게 자신의 경험을 토대로 이야기해 주는 에세이 형식의 본책과 사전 공부법, 문법 사항, 부사와 숙어 목록, 원서를 읽기 위해 필요한 단어 목록까지 실전 공부에 꼭 필요한 구체적인 과제가 담긴 트레이닝북으로 구성되어 있다. *트레이닝북은 분권이 아닌, 본책 안에 포함된 형태로 제공됩니다.",1,국내도서-국어 외국어 사전
32,9788993928792,15350150,혼자의 발견,"12,150원",680원,곽정은,달,복잡미묘한 사랑과 그런 사랑을 하는 사람들에 관하여 수많은 많은 명언들을 쏟아낸 칼럼니스트 곽정은이 이번에는 ‘혼자’를 이야기한다. 자신이 어린 시절부터 느꼈던 상실감에서부터 시작해 근원적인 외로움과 짧지 않은 시간 동안 사회생활을 해오면서 부닥쳤던 여러 가지 문제들을 정면으로 마주한다. 이 미로 같은 복잡한 세상에서 방황하고 헤맬 때도 해답은 온전히 자신의 마음속에 분명히 존재함을 이야기한다.,1,국내도서-에세이
33,9788926397787,15178021,쿠키런 어드벤처 6 아테네 편,"8,820원",441원,송도수/서정은,서울문화사,"순간이동마법으로 콜드와 그리스 〈아테네〉로 간 위즈덤 대마법사는 콜드에게 비밀 주문과 함께 두 명의 배신자를 조심하라는 경고를 남긴 채 안식의 땅으로 떠난다. 자신을 따라다니던 사악한 기운을 느낀 콜드는 배신자 중 한 명의 정체를 확신하고, 이블과 매드의 공격에서 간신히 도망나온 브브로부터 나머지 한 명의 배신자의 정체도 듣게 되는데..!! 온 국민의 인기 모바일 게임 〈쿠키런〉과 〈코믹 메이플스토리〉, 〈수학도둑〉의 서울문화사가 만났다! 〈쿠키런 어드벤처〉는 세계 각 나라 명소에 대한 상식과 정보를 생생하고 실감 나는 그림과 OX 퀴즈, 다양한 사진 자료와 흥미로운 설명을 통해 자연스럽게 학습할 수 있도록 구성한 코믹학습북입니다.",1,국내도서-어린이
34,9788952230287,15259549,원 플러스 원,"13,500원",750원,조조 모예스,살림출판사,"전 세계가 주목하는 『미 비포 유』 작가 조조 모예스의 신작! 미국 아마존 2014 올해의 책 독일 아마존 베스트셀러 「선데이 타임스」 베스트셀러 영국, 미국, 독일, 러시아 베스트셀러 뉴라인 시네마 영화 제작 확정 23개국 번역 출간 확정 ‘진정한 사랑을 탐구하는 작가’ 조조 모예스, 그녀가 따뜻한 시선으로 그려낸 우리 시대의 가족, 그리고 사랑 이야기!! 조조 모예스의 신작 『원 플러스 원: 가족이라는 기적』은 그녀의 필력이 『미 비포 유』 이후로 얼마나 더 완숙해졌는지를 여실히 보여주는 장편소설이다. ‘이 책은 조조 모예스의 걸작’이라는 퍼블리셔스 위클리의 평가가 결코 빈말이 아니라는 것을 입증하기라도 하듯, 이 소설은 영국, 독일, 미국, 러시아 등에서 출간되자마자 베스트셀러로 급부상하며 23개국에서 번역 출간이 확정됐다.",2,국내도서-소설/시/희곡
35,9788960514065,13710401,장하준의 경제학 강의,"15,120원",840원,장하준/김희정,부키,"금융 위기 이후, 우리가 기다리던 경제학 입문서 가볍게, 재미있게, 가장 ‘사용자 친화적’인 가이드북 세계적인 경제학자이자 영국 케임브리지대 경제학과 교수인 장하준이 쓴 ‘지금 우리를 위한’ 새로운 경제학 교과서. 30여 년간 유일한 경제학적 진리로 군림하면서도 금융 위기에 아무 해법도 내놓지 못하는 신고전주의 경제학에서 벗어나, 다양한 경제학적 접근법을 소개하여 경제와 경제학을 새롭게 보게 해 준다. 먼저 1부 ‘경제학에 익숙해지기’에서는 경제란 무엇이고, 경제학을 왜 알아야 하는지를 이야기한 뒤 자본주의 경제가 어떤 과정을 통해 얼마나 달라져 현재에 이르게 되었는지 간략한 경제사를 훑어본다. 이어 신고전주의를 비롯해 고전주의, 마르크스학파, 오스트리아학파, 케인스학파, 슘페터 학파, 개발주의, 제도학파, 행동주의 등 9가지 주요 경제학파를 소개하고 장단점을 조목조목 설명해 준다.",1,국내도서-경제 경영
36,9791195275250,15442670,2016 윤승현 중등 심층면접,"22,500원","1,250원",윤승현 저,위드북,,3,국내도서-수험서 자격증
37,9788901166421,15207582,머나먼 여행,"10,800원",600원,에런 베커,웅진주니어,"2014년 가장 주목 받은 화제의 그림책! 미국에서 가장 많은 꼬마 작가를 탄생시킨 글 없는 그림책으로 한 소녀가 우연히 떠나게 된 위대하고 화려한 판타지 여행이 펼쳐집니다. 회색빛으로 물든 고요한 도시, 외롭고 심심했던 소녀는 가족들에게 함께 놀자고 조르지만 모두들 바쁘기만 합니다. 자신의 방에 혼자 있던 소녀는 방 한구석에서 마법의 펜을 발견합니다. 소녀는 이 펜으로 벽에 문을 그리고, 망설임 없이 그 문을 열어 환상의 세계로 여행을 떠나게 되지요. 이렇게 소녀는 환상의 세계에서 놀랍고도 신기한, 그리고 조금은 위험한 여행을 시작합니다. 깊은 숲에서 강을 만나거나, 갑자기 폭포수 아래로 떨어지게 되는 순간, 소녀는 마법의 펜을 이용해서 위기의 상황을 극복해 더 멋지고 흥미진진한 여행을 이어나갑니다. 그런데 위험에 처한 신비의 새를 구하다가 그만, 마법의 펜을 잃어버리고 맙니다.",1,국내도서-유아
38,9788996746416,6262207,나는 까칠하게 살기로 했다,"13,500원",750원,양창순,센추리원,"자존감을 지키며 건강한 인간관계를 유지하는 법 상처받지 않고 사람을 움직이는 관계의 심리학 자신의 자존감을 지키면서도 사람의 마음을 움직이는 심리적 방법을 다양한 임상 사례와 심리학 이론을 통해 쉽고 재미있게 풀어, 우리 일상에 바로바로 적용할 수 있도록 소개한 책이다.",3,국내도서-자기계발
39,9788970127248,1940233,"총, 균, 쇠","25,200원","1,400원",재레드 다이아몬드/김진준,문학사상,"왜 어떤 민족들은 다른 민족들의 정복과 지배의 대상으로 전락하고 말았는가. 왜 원주민들은 유라시아인들에 의해 도태되고 말았는가. 왜 각 대륙들마다 문명의 발달 속도에 차이가 생겨났는가. '인간 사회의 다양한 문명은 어디서 비롯되는가?'라는 의문을 명쾌하게 분석하여 1998년 퓰리처 상을 수상한 책. 2005년 12월 새롭게 개정신판이 출간되었다. 진화생물학자인 재레드 다이아몬드는 총기와 병균과 금속이 역사에 미친 엄청난 영향에 대해 분석한다. 일단 수렵 채집 단계를 넘어서 농경을 하게 된 사회들은 문자와 기술, 정부,...",1,국내도서-사회 정치
40,9788993734348,12344424,어떤 하루,"12,420원",690원,신준모,프롬북스,"페이스북 인싸이트 글 분야 1위! 매주 250만 명의 사람들이 읽고 있는 글! 이 책은 페이스 북 〈신준모의 성공연구소-마음을 성형하는 사람들〉에서 많은 사람들의 마음을 움직이고 있는 글을 모아 만든 에세이다. 2011년 11월부터 꾸준하게 올린 매일 한 편의 글들은 사람들에게 위로가 되었고, 때로는 뼈아픈 충고가 되어주었다. 저자의 글들이 입소문을 타기 시작하면서 매주 250만 명의 페이스 북 유저들이 그의 글을 읽고 전파하기 시작했다. 글을 읽고 마음의 변화, 생각의 전환, 행동의 시발점이 됐다고 말하는 사람들이 지금도 그에게 감사의 메시지를 보내오고 있다. 저자는 쉼표 같은 사람이 되기를 원한다. 책은 그런 저자의 마음을 고스란히 담아내었다. [어떤 하루]의 책 속 구성은 마음을 사계절로 나누는 것에서부터 출발했다.",3,국내도서-에세이
41,9788937488351,11365496,강신주의 감정수업,"17,550원",970원,강신주,민음사,대중과의 소통을 소중히 여기는 철학자 강신주 박사는 자아를 잃고 방황하는 현대인에게 지금 시급한 문제는 바로 자기 감정을 회복하는 일이라고 주장한다. 책에는 다년간의 상담 경험을 바탕으로 독자에게 전하고 싶은 어드바이스를 '철학자의 시선'으로 정제하여 담았다. 더불어 타인의 감정을 살피고 나의 감정을 들여다보기 위하여 각 장마다 그림 보는 시간을 할애했다.,1,국내도서-인문
42,9788964808719,8596027,세상에서 가장 행복한 100층 버스,"10,800원",600원,노은정/마이크 스미스,사파리,"여느 때와 똑같은 화요일, 버스 기사 아저씨는 똑같은 생활이 지겨워 처음 가 보는 길로 모험을 떠나기로 했어요. 빨간 2층 버스가 처음 보는 정류장과 처음 보는 마을을 지나는 동안, 함께 모험을 떠나려는 사람들이 계속해서 버스에 타 버스는 3층, 4층, 5층……, 자꾸자꾸 키가 커졌어요. 바다가 가로막아도, 다리에 막혀 지나갈 수 없어도 기발한 방법으로 계속 달리며 결국 100층까지 높아졌지요. 그런데 갑자기 이상한 소리가 나면서 버스가 멈춰 버렸어요.",1,국내도서-유아
43,9788971848722,8586252,나를 찾아줘,"13,320원",740원,길리언 플린,푸른숲,"결혼 5주년이 되던 날, 사랑스러운 에이미가 사라졌다! 아마존, 뉴욕타임스 베스트셀러 1위! 「오프라 매거진」 선정 최고의 소설! 데이비드 핀처 연출 「나를 찾아줘」 원작! ‘2012년 미국에서 가장 주목받은 소설’, ‘놀랄 만큼 치밀한, 도저히 거부할 수 없는 소설’, ‘마지막 페이지까지 독자의 신경을 곤두서게 하는 작품’이라 극찬한 책, 출간 직후 30주 연속 베스트셀러에 오른 책, 리즈 위더스푼과 데이비드 핀처가 주목하며 영화화가 예정된 글로벌 화제작 『나를 찾아줘(Gone Girl)』가 드디어 한국 독자들을 찾아왔다. 스티븐 킹은 이 책을 쓴 길리언 플린에 대해 “‘진짜 물건’이 나타났다”며 “예리하고 날카롭고 강렬한, 그야말로 천재적인 작가”라고 찬사를 보낸 바 있다. 빼어난 미모, 명석한 두뇌, 엄청난 재산까지 가진 에이미는 만인의 알파걸. 어린 시절에는 그녀를 주인공으로 한 동화책 시리즈가 출간됐을 정도다.",2,국내도서-소설/시/희곡
44,9788915102019,1972516,임신 출산 육아 대백과,"16,650원",920원,편집부 저,삼성출판사,"『임신 출산 육아 대백과』 2020년 개정판은 가이드 구성에 충실, 초보엄마들이 궁금해할만한 내용을 사진으로 꼼꼼하게 보여준다. 임신 중 요가, 산후조리, 육아의 기초(신생아 목욕시키기, 옷 입히기 등)의 과정을 사진으로 보여주어 슬라이드를 넘기듯 한눈에 육아의 기초를 알 수 있다. 임신, 출산, 육아의 각 단계를 시간 순서별로 나누어 Step 1부터 Step11로 구분해 필요한 부분을 쉽게 찾아볼 수 있다. 초보엄마들이 실수하기 쉬운 부분, 꼭 알아야 할 부분을 세심한 정보 박스로 정리해 놓치지 않고 볼 수 있게 했다. 귀여운 일러스트 표지를 채택하고 책에 비닐커버를 씌워 활용도를 높였다.",1,국내도서-가정 살림
45,9788901154091,8389451,나는 죽을 때까지 재미있게 살고 싶다,"12,600원",700원,이근후/김선경,갤리온,"죽음의 위기를 몇 차례 넘기고 일곱 가지 병과 더불어 살아가면서도 늘 유쾌한 노(老)학자와 베스트셀러 『서른 살엔 미처 몰랐던 것들』의 저자 김선경이 만나 함께 쓴 나이 듦의 지혜 50년간 정신과 전문의로 환자를 돌보고 학생들을 가르쳐 온 이근후 이화여대 명예교수가 ‘어떻게 살 것인가’를 고민하는 후배들에게 전하는 나이 듦의 지혜. 왼쪽 눈의 시력을 완전히 잃고 일곱 가지 병과 함께 살아가면서도 76세의 나이에 최고령이자 수석으로 사이버 대학을 졸업하고, 삼 대 열세 가족과 한집에서 대가족을 이루어 사는 등 누구보다 즐겁고 재미있는 노년을 보내고 있는 노학자가 80년 인생을 살아오며 배운 인생의 통찰을 전달한다. 이 책을 엮은이는 20만 명 독자의 마음을 사로잡은 『서른 살엔 미처 몰랐던 것들』의 저자 김선경으로, 본격적으로 40대에 접어들어 “나는 어떻게 나이 들어 갈 것인가”를 고민한 끝에 이근후 명예교수와 함께 이 책을 펴냈다.",1,국내도서-에세이
46,9791196045500,5982086,어떻게 원하는 것을 얻는가 밀리언 특별판,"14,400원",800원,스튜어트 다이아몬드/김태훈,8.0(에이트 포인트),"수없이 많은 찬사와 사례로 검증된 전설적 강의록, 20년 연속 와튼스쿨 최고 인기강의 선정 기념! 밀리언 특별판 출간! 2011년 11월 말 국내 출간되어 전국 서점가에 ‘협상’ 바람을 불러일으키고 이듬해인 2012년 ‘올해의 책’으로 선정된 뒤 지금까지도 스테디셀러로 무수한 독자들을 만나온 책, 연간 5만 달러가 넘는 MBA 학비를 내고도 쉽게 들을 수 없는 수업을 단 한 권으로 정리해 놀라움을 산 책, 매년 그 기록을 갱신하며 ‘20년 연속 와튼스쿨 최고 인기강의’라는 명예의 전당에 선 책! 『어떻게 원하는 것을 얻는가』를 꼭 6년 만에 밀리언 특별판으로 다시 선보입니다.",1,국내도서-자기계발
47,9788956056531,8840624,여덟 단어,"13,500원",675원,박웅현,북하우스,"『책은 도끼다』 의 저자이자 대한민국을 대표하는 광고인 박웅현이 인생을 살아가면서 한 번쯤 생각해보면 좋을 여덟 가지 삶의 단어들을 이야기한다. 삶의 기준을 왜 내 안에 둬야 하는지, 고전을 왜 궁금해야 하는지, 지금 이 순간을 충실히 살아야 하는 이유는 무엇인지 등 풍요롭고 행복한 인생을 위한 삶의 지혜가 책 곳곳에 녹아 있다.",1,국내도서-인문
48,9788954610971,3849110,어두운 상점들의 거리,"9,000원",500원,파트릭 모디아노/김화영,문학동네,"잃어버린 시간을 찾아 어두운 기억의 거리를 헤매는 한 남자의 쓸쓸하면서도 아름다운 여정 프랑스 최고 권위의 문학상인 공쿠르상을 수상작이자 프랑스 현대문학의 거장 파트릭 모디아노의 대표작이다. 기억상실증에 걸린 한 퇴역 탐정이 자신의 과거를 추적하는 여정을 그린 소설로, 흥신소의 퇴역 탐정인 작중 화자는 조악한 단서 몇 가지에 의지해 마치 다른 인물의 뒤를 밟듯 낯선 자신의 과거를 추적한다.",1,국내도서-소설/시/희곡
49,9788962606898,15241665,길,"12,420원",690원,대일외국어고등학교 총동문회 편,생각연구소,"내 인생 첫 번째 갈림길, 38인의 멘토에게 묻다 사회 각계에서 활약하고 있는 대일외고 출신 38인이 진학과 진로를 고민하는 모든 청소년들을 위해 같은 길을 걸어 온 선배로서 가장 현실적인 조언을 제시한다. 슬럼프 극복과 자신만의 공부비법, 전공과 진로 선택에 관한 세부적인 가이드, 사회에서 느낀 두려움과 희망에 대한 단상. 그리고, 천직을 찾는 과정에서 발견한 깨달음과 인생의 터닝 포인트… 여전히 꿈을 향해 달리는 젊은 멘토 38인이 꿈 많은 청소년들에게 들려주는 세상과 인생에 관한 이야기들.",1,국내도서-청소년
50,9791156171355,13684423,2015 전한길 한국사 합격생 필기노트,"10,800원",600원,전한길,에스티앤북스(ST&BOOKS),"합격생 필기노트는 공단기 전한길 교수가 개념 강의를 진행하면서 판서한 내용과 수업 중 구두로 강조한 내용을 철저히 받아 적은 것을 책으로 엮은 교재이다. 이 교재는 공단기 전한길 교수 강의 수강생 가운데 9급, 7급에 단기간에 합격한 학생들이 직접 작성한 것으로서, 판서 내용뿐 아니라 구두로 강조한 내용까지를 포함하고 있어 가볍지만 알찬 내용 전개를 자랑하고 있으며, 특히 시험에 합격하기 위하여 필요한 내용을 압축적으로 담고 있다. 이 교재는 개념 강의를 진행하면서 도출된 핵심만을 뽑아놓은 것이어서 기본서로 활용할 수는 없지만, 방대한 기본서의 핵심이 농축된 교재이기 때문에 시험 직전 최종 점검용으로 활용하거나 기본서 복습용으로 활용하기에 더없이 좋다. 특히 전한길 교수의 강의와 2.0 기본서 및 3.0 기출문제집과 병행하여 학습하면 그 효과가 극대화될 수 있다.",3,국내도서-수험서 자격증
51,9788965420354,9235267,해커스 토익 스타트 리딩 (Hackers TOEIC Start Reading),"13,410원",740원,David Cho 저,해커스어학연구소,"초보를 위한 토익 Listening 입문서 TOEIC L/C 입문서. 핵심 포인트를 짚어주고 친절한 해설로 이해를 도와 4주 만에 토익 리스닝의 기본기를 다질 수 있도록 안내한다. 왕초보를 위한 '토익 기초' 코너부터 출발함으로써 기초 청취 능력을 길러주고, 삽화와 음성을 보고 들으며 더욱 쉽고 재미있게 어휘를 익힐 수 있게 했다. 또한 파트별로 실전에서 활용할 수 있는 스텝별 문제 풀이 전략을 알려주고, 해설집에는 끊어듣기별 해석을 담아 문장 구조를 정확하게 파악할 수 있도록 했다. 받아쓰기&쉐도잉 CD가 수록되었고, 온라인 토익 모의고사를 무료로 제공한다.",3,국내도서-국어 외국어 사전
52,9788967351274,14156539,21세기 자본,"29,700원","1,650원",토마 피케티/장경덕,글항아리,"전 세계에 ‘피케티 신드롬’을 불러일으킨 프랑스 파리경제대 토마 피케티 교수의 『21세기 자본』이 드디어 한국에 상륙한다. 지난해 8월에 프랑스, 올해 4월에 미국에서 번역 출간된 이후 경제계는 물론 세계 지성인의 주목을 한 몸에 받아온 『21세기 자본』은 국내에서도 이미 자본주의에 내재한 불평등의 동학에 대한 참신하고 실증적인 분석과 대담하고 파격적인 대안 제시로 인해 논쟁의 중심에 있다.",1,국내도서-사회 정치
53,9791186117019,15119095,우리 아이 괜찮아요,"17,820원",990원,서천석,예담friend,"대한민국 최고의 육아 멘토 소아정신과 의사 서천석의 이 시대 부모들을 위한 단 한 권의 육아 지침서 육아에 지친 부모들에게 들려주는 따뜻한 위로와 해법! 당대 최고의 육아 멘토 소아정신과 의사 서천석. 지금까지 그가 쓴 글은 대한민국 수십만 부모들의 마음 깊숙이 다가갔다. 때로는 부드럽게 어루만지며 부모들의 마음을 편안하게 해주고, 때로는 날카로운 촌철살인으로 부모들의 마음에 경종을 울렸다. 이 책은 아이로 인해 마음 아파하는 부모들의 ‘진짜 사연’ 아래 서천석 특유의 현실적이면서도 따뜻한 해법을 함께 담았다. 이를 통해 아이가 있는 독자라면 누구나 가슴 한구석에 찡하게 와 닿는, 명쾌하면서도 진심 어린 조언을 구할 수 있을 것이다.",1,국내도서-가정 살림
