순위,ISBN,상품번호,상품명,판매가,YES포인트,저자,출판사,설명,출고예상일,관리분류
62,9791188874187,63011067,설민석의 통일 대모험 - 상,"11,700원",650원,설민석 /스토리박스/원프로/태건 역사 연구소,아이휴먼,"한 걸음 앞으로 다가온 한반도 통일 시대, 어린이들의 물음에 설민석 선생님이 대답합니다! 문재인 대통령과 김정은 국방위원장의 정상회담, 연이어 트럼프 미국 대통령과 김정은 국방위원장의 정상회담까지, 우리는 분단 이후 가장 통일에 가까운 시기에 살고 있습니다. 당연히 우리 어린이들은 통일을 직접 목격하고, 통일 한반도의 주역이 될 것입니다. 하지만 지금 대한민국의 어린이들은 북한을 완전히 다른 나라, 다른 민족으로 생각하고 있습니다. 통일을 왜 해야 하는지 알지 못하고, 심지어 통일을 하면 우리가 큰 손해를 볼 것이라고 생각하기도 합니다. 평강과 온달도 크게 다르지 않은데요, 남과 북 두 정상의 역사적인 만남에 크게 감동한 설쌤과 다르게 평강과 온달은 시큰둥하기만 합니다. ‘굳이 통일을 해야 하느냐’고 묻는 평강과 온달에게 큰 충격을 받은 설쌤은 이들에게 통일을 해야 하는 이유에 대해서 역사 여행을 통해 알아보기로 합니다.",1,국내도서-어린이
63,9788954637756,20536907,개인주의자 선언,"12,150원",670원,문유석,문학동네,"『판사유감』을 통해 현직 판사로서 법과 사람 그리고 정의에 대해서 이야기했던 저자가 이번에는 대한민국 사회의 불편한 진실을 이야기한다. 판사 문유석의 일상유감이라는 부제가 붙은 이 책 『개인주의자 선언』은 소년시절부터 현재까지 저자가 보고 겪었던 사회 문제에 대한 생각들이 담겨 있다. 책과 음악만 잔뜩 쌓아놓고 홀로 살아가고 싶다고 생각하며 개인의 행복을 중요한 가치로 삼는다는 저자는 자신을 개인주의자로 명명한다. 그리고 책은 이러한 개인을 불행하게 만드는 굴레인 한국 사회의 불편한 진실을 주제로 삼는다. 인간은 필연적으로 사회를 이루어 살 수밖에 없고, 그것이 개인의 행복 추구에 필수적임을 이해하는 것. 그렇기에 사회에는 공정한 규칙이 필요하고, 자신의 자유가 일정 부분 제약될 수 있음을 수긍하고, 더 나아가 다른 입장의 사람들과 타협할 줄 알며, 개인의 힘만으로는 바꿀 수 없는 문제를 해결하기 위해 타인들과 연대하는 것.",1,국내도서-사회 정치
64,9791161319506,63810972,2019 이동기 핵심문법 100포인트 요약노트,"7,200원",80원,이동기,에스티유니타스,"『핵심문법 100포인트 요약노트』는 시험에 자주 출제되는 문법포인트 100개를 선별하여 핵심적인 내용만을 보기 쉽게 표로 정리한 문법요약집이다. 기본서와 기출 학습 후, 이 책을 통해 빈출 문법포인트를 반복학습하여 효율적으로 문법을 학습할 수 있도록 구성하였다.",3,국내도서-수험서 자격증
65,9791188874088,59382931,설민석의 한국사 대모험 6,"9,450원",520원,스토리박스/설민석 /정현희,아이휴먼,"만나기만 하면 으르렁 으르렁, 설쌤, 황 대감님! 언제까지 싸우실 거예요? 역사를 통해 진정한 라이벌이란 무엇인지 생각하는 시간을 가져보세요! 한때 고구려를 위해 함께 뜻을 모으자고 다짐했었던 설쌤과 황 대감, 하지만 지금은 각각 온달과 공갈을 부마 자리에 앉히기 위해서 서로 경쟁하는 상황입니다. 거기에 둘은 만나기만 하면 서로 트집을 잡아 싸우기에 바쁩니다. 이런 설쌤과 황 대감을 화해시킬 수 있는 방법은 정말 없는 것일까요? 『설민석의 한국사 대모험』 6권에서는 설쌤과 황 대감의 관계 회복을 위한 시간 여행을 통해서 역사 속의 진정한 라이벌을 찾아 나섭니다.",1,국내도서-어린이
66,9788969651143,61778293,2018 하반기 단기합격 해커스 NCS 직업기초능력평가+직무수행능력평가,"17,820원",990원,"김소원,김태형,윤종혁,해커스 취업교육연구소 공저",해커스공기업,"『2018 하반기 해커스 NCS』는 NCS 최신 출제경향을 반영한 2018 하반기 최신판으로 한 권으로 NCS의 모든 것을 대비할 수 있는 통합 기본서다. 자기소개서 작성부터 면접, 인성검사까지 NCS 채용 합격 전략을 모두 담았으며 최근 높아진 난이도와 출제경향에 대비할 수 있는 PSAT 기출문제를 수록하였다.",3,국내도서-수험서 자격증
67,9788934977841,39404092,호모 데우스,"19,800원","1,100원",유발 하라리/김명주,김영사,"“호모 데우스, 이것이 진화의 다음 단계다!” 정치, 종교, 문화 모든 구시대적 신화와 인공지능, 유전공학의 새로운 신이 만나 펼쳐낼 최후의 서사시 전 세계 45개국, 500만 부 초대형 베스트셀러 [사피엔스] 유발 하라리 최신작! [사피엔스]는 우리가 어디에서 왔는지 알려주고, [호모 데우스]는 우리가 어디로 가는지 알려준다. 미국, 영국, 프랑스, 독일, 중국, 일본 등 40개국 출간 확정! 역사의 시간 동안 인류의 가장 큰 과제이던 굶주림, 질병 그리고 전쟁을 밀어내고 그 자리를 차지한 것은 무엇인가? 지구를 평정하고 신이 된 인간은 어떤 운명을 만들 것인가? 인류는 어디에서 와서 어디로 갈 것인가? 100년 뒤 세상은 어떤 모습이고, 앞을 향해 치닫는 과학혁명의 정점은 어디인가. 인간이 만들어갈 유토피아 혹은 악몽에 대한 논쟁적 서사. 인간은 진화를 거듭할 것인가, 쓸모없는 존재가 될 것인가.",1,국내도서-인문
68,2561491823007,61491823,후 Who? special 손흥민,"11,520원",640원,강진희/김광일/안광필,다산어린이,who? special 손흥민을 소개합니다. 축구 본고장에 울려 퍼지는 “Son” 세계를 무대로 새로운 역사를 쓰다! 축구밖에 몰랐던 소년 손흥민은 어릴 때부터 세계 축구 리그를 주름잡는 꿈을 꿨습니다. 아시아인 최초로 영국 무대에서 해트트릭을 달성하며 아시아 프리미어리거 역대 최다 득점자에 오른 손흥민! 그는 세계를 종횡무진 누비며 지금도 진화하고 있습니다.,3,국내도서-어린이
69,9788965422389,57551998,해커스 토익 Reading,"16,920원",940원,데이비드 조,해커스어학연구소,"토익 리딩 베스트셀러 1위 RC 문법, 독해, 어휘부터 실전까지 완벽 대비하는 토익 리딩의 기본서 해커스 토익 Reading과 함께라면, 토익 리딩의 기본기를 탄탄히 다지고 실전까지 대비할 수 있다. 1. 신토익 최신 출제경향 반영한 2018 최신개정판 2. Reading 최신경향에 맞춘 파트별 공략법 제시 3. 한 권으로 기본부터 실전까지 토익 RC 완벽 대비 4. 본 교재 무료 동영상강의 및 해설강의 제공 [추가자료] 1. 본 교재 무료 동영상강의 (Hackers.co.kr) 2. 진단고사 해설강의 (HackersIngang.com) 3. 단어암기장&단어암기 MP3 (HackersIngang.com) 4. 신토익 실전모의고사 4회분(교재 2회+온라인 2회) (Hackers.co.",1,국내도서-국어 외국어 사전
70,9788950975913,61810085,굿 라이프,"15,300원",850원,최인철,21세기북스,"2007년 출간 이래 40만 독자의 사랑을 받으며 심리학의 바이블로 자리매김한 『프레임』의 저자 최인철 서울대학교 심리학과 교수가 행복과 인간 심리에 관한 지난 10여 년간의 연구를 종합해 펴낸 인생론. 전작에서 세상을 바라보는 마음의 창을 ‘프레임’이라는 개념으로 제시했다면, 신작 『굿 라이프』에서는 좋은 프레임으로 세상을 바라볼 때 찾아오는 행복과 삶의 가치를 다룬다. 굿 라이프(The Good Life)란 말 그대로 ‘좋은 삶’이다. 좋은 삶이란 재미와 의미, 성공과 행복, 현재와 미래, 자기 행복과 타인의 행복 사이의 균형을 추구하는 삶을 뜻한다.",1,국내도서-자기계발
71,9788950977405,64469158,Go Go 카카오프렌즈 4,"10,800원",600원,김미영/김정한,아울북,"《마법천자문》으로 학습만화의 시장을 연 아울북과 카카오프렌즈가 만나 탄생시킨 시리즈입니다. 세계를 무대로 자신들의 꿈을 펼칠 아이들을 위해 기획된 세계역사문화체험 학습만화이지요. 처음 세계를 접하는 아이들의 호기심을 자극하면서 세계의 역사, 문화, 사람들에 대해 독자의 궁금증을 해소할 수 있는 주제와 내용을 재미있는 스토리로 풀어내어 세계 여행을 떠나 직접 체험하는 듯한 느낌을 줍니다. 4권에서는 화려하고 강력한 모습의 미국뿐만 아니라 속살 깊이 감춰둔 미국의 진짜 모습까지 카카오프렌즈가 찾아 나섭니다. 카카오프렌즈가 처음 도착한 곳은 아메리카 드림을 꿈꾸는 이민자들이 처음 발을 내딛는 뉴욕입니다. 자유의 여신상을 보고서야 드디어 미국에 왔음을 실감하고, 왜 미국이 자유와 희망의 상징이 되었는지 알게 된 것도 잠시, 아메리카 원주민을 몰아내고 전쟁을 발판삼아 발전하게 된 미국의 이면을 알게 되면서 충격에 빠집니다.",1,국내도서-어린이
72,9791162207505,63012048,썅년의 미학,"13,320원",740원,민서영,위즈덤하우스,"‘클라스가 다른재미’ 저스툰에서 매주 월요일 독점 연재하며 누적 400만 뷰를 돌파한 화제의 웹툰 『썅년의 미학』이 단행본으로 출간됐다. 1년여 간의 연재물 중 20여 편을 엄선하고, 사이다 대사로 유명한 민서영 작가의 칼럼을 정리해 함께 엮었다. 대한민국 여성으로 살면서 누구나 한 번은 겪었을 불편한 순간, 흔하게 자행되어 미처 인식하지 못했던 불쾌한 순간을 콕 집어 촌철살인 한 마디로 통쾌하게 긁어준다.",1,국내도서-에세이
73,9791133487578,64338569,슬램덩크 신장재편판 7,"6,750원",370원,이노우에 타케히코,대원,,1,국내도서-만화/라이트노벨
74,9791157842858,64411335,퇴근길 인문학 수업 : 멈춤,"15,300원",850원,백상경제연구원/최형선/전미경/강안/최은/박준용/안나미/박정호/이용택/이세환/신창호/이창후,한빛비즈,"매일매일 조금씩 나를 바꾸는 퇴근길 30분 인문학 수업 프로젝트 현실의 삶이 버거울수록 인문학에서 삶의 근원과 존재 이유를 찾고자 하는 직장인이 늘고 있다. 이런 시대적 관심을 반영하듯 다양한 삶을 테마로 한 스터디나 인문학 강연을 찾는 사람도 많아졌다. [서울경제신문]의 부설 연구기관인 백상경제연구원이 2013년부터 지금까지 8만여 명의 수강생을 모은 [고전 인문학이 돌아오다(이하 고인돌)]는 이러한 대중의 갈증을 단적으로 보여주는 사례다. 《퇴근길 인문학 수업》 시리즈는 [고인돌]콘텐츠를 바탕으로 1인 저자의 학문적 깊이에 의존하는 대신 믿을 만한 전문가, 검증된 콘텐츠로 집단지성의 시너지를 만드는 데 집중했다. [멈춤] [전환] [전진] 편으로 구성된 시리즈는 수십 명의 전문가 집단과 함께 인간의 근간을 이루는 다양한 분야의 지식을 36개 강의로 나눠 세 권의 책으로 묶었다.",1,국내도서-인문
75,9791133487585,64338571,슬램덩크 신장재편판 8,"6,750원",370원,이노우에 타케히코,대원,,1,국내도서-만화/라이트노벨
76,9791195794799,35111247,설민석의 한국사 대모험 1,"8,820원",490원,설민석,아이휴먼,"단군 신화 속 끈기, 세종대왕의 독서, 신사임당의 교육, 이순신의 초심, 안중근의 정의 『설민석의 한국사 대모험』은 곁에 두고 보는 책입니다. 어린이들이 일상에서 고민할 수 있는 문제들을 역사 속 인물을 통해 같이 생각하고 해결할 수 있습니다.가히 한국사 열풍이라고 할 수 있을 정도로 한국사에 대한 관심이 뜨겁습니다. 그리고 한국사 열풍의 중심에는 쉬운 해설과 감동과 재미가 있는 역사 이야기로 ‘국민 한국사 선생님’으로 불리는 설민석 선생님이 있습니다. 사람들은 설민석 선생님의 책과 강연을 통해 한국사가 이리도 재미있다는 것을 왜 학창시절에는 알지 못했을까 아쉬워했습니다. 그래서 우리 어린이들이 한국사의 재미를 알 수 있도록 하기 위해 설민석 선생님의 어린이 한국사 학습만화를 펴냈습니다. 『설민석의 한국사 대모험 1』은 한국사 지식을 기본적으로 다루고 있습니다.",1,국내도서-어린이
77,9791158318703,35240702,큰별쌤 최태성의 별★별 한국사 한국사능력검정시험 고급(1·2급) 상,"12,150원",670원,최태성 저,이투스북,"시대의 흐름을 한판에 담고자 20년간 판서를 연구해 온 판서의 장인 큰별쌤 최태성이 만들어 낸 아트 판서 수록하고 한국사능력검정시험 빈출 자료(세시 풍속, 유네스코와 유산), 한 눈에 들어오는 한국사 연표 수록하였다.",3,국내도서-수험서 자격증
78,9791133487592,64338573,슬램덩크 신장재편판 9,"6,750원",370원,이노우에 타케히코,대원,,1,국내도서-만화/라이트노벨
79,9791186757093,30548474,자존감 수업,"12,600원",700원,윤홍균,심플라이프,"심리학 책 아무리 읽어도 자존감 그대로인 사람에게 추천하는 책! 정신과 의사 ‘윤답장’ 선생의 자존감 셀프 코칭법 자존감 전문가이자 정신과 의사인 윤홍균 원장이 2년 넘게 심혈을 기울여 쓴 책으로, 자존감이 우리 삶에 미치는 영향을 친절하게 알려주고, 자존감을 끌어올리는 실질적인 방법을 알려주는 책. 높은 자존감을 갖고 싶지만 방법을 모르는 사람, 낮은 자존감 때문에 내면의 불화와 갈등을 겪고 있는 이들이 건강한 자존감을 회복하도록 돕는다.",1,국내도서-자기계발
80,9791133487608,64338575,슬램덩크 신장재편판 10,"6,300원",350원,이노우에 타케히코,대원,,1,국내도서-만화/라이트노벨
