순위,ISBN,상품번호,상품명,판매가,YES포인트,저자,출판사,설명,출고예상일,관리분류
1,9788998274795,35552641,돌이킬 수 없는 약속,"13,500원",750원,야쿠마루 가쿠/김성미,북플라자,"제51회 에드가와란포상 수상 작가 야쿠마루 가쿠의 미스터리 추리 소설. ""내 딸을 살해한 놈들을 15년 후에 죽여주세요. 그 약속을 해주면 내 전 재산을 드리리다."" 주인공이 과거에 저지른 죄, 그리고 15년 전에 했던 어느 노파와의 돌이킬 수 없는 약속을 둘러싸고 벌어지는 미스터리한 사건을 숨이 막히도록 치밀하게 그렸다.",1,국내도서-소설/시/희곡
2,9791196394509,61779464,죽고 싶지만 떡볶이는 먹고 싶어,"12,420원",690원,백세희/댄싱스네일,흔,"기분부전장애(가벼운 우울 증상이 지속되는 상태)를 가진 저자와 정신과 전문의와의 12주간의 대화를 엮었다. 겉보기에는 멀쩡하지만 속은 곪아 있는, 지독히 우울하지도 행복하지도 않은 사람들을 위한 책이며, 타인의 시선으로부터 자유롭지 못하고, 불완전하고, 구질구질한 우리 모두의 이야기다. 우리는 울지 않는 사람이 아니라 울고 싶을 때 울 수 있는 사람이어야 한다.",1,국내도서-에세이
3,9791160560510,61557678,열두 발자국,"15,120원",840원,정재승,어크로스,"창의적인 사람들의 뇌에서는 어떤 일이 벌어지고 있을까, 4차 산업혁명 시대, 새로운 기회를 어떻게 발견할 것인가. 숨 가쁘게 변화하는 시대의 한 가운데에서 늘 질문을 던지고 독자들과 함께 해답을 탐색하는 정재승 교수의 지난 10여 년 간의 강연 중 가장 많은 호응을 받았던 12개의 강연을 선별하여 다시 집필했다. 더 나은 선택과 미래를 위해 고군분투하고 있는 청춘들과 이 땅의 리더들에게 주는 뇌과학의 지혜와 통찰이 가득하다.",1,국내도서-인문
4,9788934982975,63733198,21세기를 위한 21가지 제언,"19,800원","1,100원",유발 하라리/전병근,김영사,"『사피엔스』, 『호모 데우스』에 이은 유발 하라리의 ‘인류 3부작’ 완결편. 인류의 과거와 미래를 탐색한 전작에 이어 『21세기를 위한 21가지 제언』에서는 정보기술과 생명기술의 비약적인 발전이 이끄는 유례없는 혁명기, 새로운 도전과 위협에 직면해 있는 인류의 현재를 살핀다. 인공지능은 인간의 일자리를 빼앗아갈 태세다. 가짜 뉴스의 해악과 테러의 공포는 우리의 판단을 흐리고 있으며, 기후변화와 핵전쟁의 위협은 묵시록적인 예언을 낳고 있다. 민족과 종교, 인종주의에 갇혀 반목하고 있는 인류의 오늘은 어떤 내일을 만들어갈 것인가.",1,국내도서-인문
5,9788971998557,61385099,역사의 역사,"14,400원",800원,유시민,돌베개,"『거꾸로 읽는 세계사』로부터 30년, 작가 유시민 글쓰기의 새로운 시작. 헤로도토스의 『역사』, 투키디데스의 『펠로폰네소스 전쟁사』부터 유발 하라리의 『사피엔스』까지 고대로부터 최근까지 역사를 사로잡은 18권의 역사서들을 9장으로 나누어 훑으며 ‘역사’라는 화두를 전개해간다. 각 역사서의 주요 내용과 시대적인 맥락, 서사의 새로운 초점과 해석, 역사가의 생애 등을 유시민만의 언어로 요약했다. 여기에 역사가의 속마음을 전달하고, 놓치지 말아야 할 부분을 체크해 주거나, 이해하지 못해도 좋다고 위로하고 격려하는 안내자 역할까지 맡았다. 역사에 대한 애정과 역사 공부의 중요성을 몸소 보여주며, 자신의 역사 공부법을 공개하는 셈이다. 역사의 힘과 논리, 역사가의 생각과 감정, 역사 공부의 재미와 깨달음을 함께 나누는 가운데 저마다 '어떻게 살 것인가'라는 질문으로 나아가게 한다.",1,국내도서-역사
6,9788925563350,59070026,"곰돌이 푸, 행복한 일은 매일 있어","10,800원",600원,곰돌이 푸 원작,알에이치코리아(RHK),"나를 지키기 위해 자꾸만 나를 잃어가는 세상 속에서, 나로 살기 위한 곰돌이 푸의 마음을 들여다보는 말. 곰돌이 푸의 긍정적인 기운과 '나의 삶은 나의 방식으로 정한다'라고 말했던 독일의 철학자 니체의 말 중에서 오늘날의 우리에게도 도움이 될 만한 조언들을 모았다. 말하자면 곰돌의 푸의 입으로 전하고 니체가 거드는 셈이다. 행복은 여전히 먼 곳에 있고, 나는 어떤 사람인지, 나는 무엇을 할 때 행복했는지에 대한 기억도 점차 흐려져 오늘도 ‘행복’을 찾는 일이 영 요원하게 느껴질 때, 이 책을 펼치면 어떤 페이지를 열든 푸가 느긋한 미소를 지으며 ‘너무 걱정하지 마. 다 잘 될 거야’라고 말하며 우리를 위로해줄 것이다.",1,국내도서-에세이
7,9791162207178,63797580,저절로 몸에 새겨지는 몰입 영어,"12,420원",690원,황농문,위즈덤하우스,"더 이상 잘못된 영어 공부법에 희생당하지 마라! 전작 『몰입』을 통해 100만 독자가 검증한 최고의 몰입전문가, 황농문 교수의 궁극의 영어 학습법. 뇌세포를 활성화해 학습효과를 상승시키고, 뇌를 흥분시켜 저절로 재미를 느끼게 하는 몰입의 과학적인 효과와 방법, 영어회화 핵심패턴을 소개한다. 몰입 영어를 하면 활성화된 뇌세포, 즉 활성화된 시냅스의 수가 최대가 된다. 활성화의 시냅스의 수가 최대가 되면 암묵기억 회로가 발달해 학습효과는 무한상승하며, 뇌는 흥분상태가 되어 저절로 재미를 느끼게 된다고 한다.",1,국내도서-자기계발
8,9791186560785,62776752,수학이 필요한 순간,"14,220원",790원,김민형,인플루엔셜,"한국인 최초 옥스퍼드 대학 정교수이자 세계적인 수학자 김민형 교수. 그가 인간의 사고 능력과 우주에 대한 탐구를 총 7개의 강의를 통해 풀어냈다. 『수학이 필요한 순간』은 현대 수학의 대가가 복잡하고 어려운 수학의 세계를 누구나 이해할 수 있는 상식적인 언어로 설명한 놀라운 작업이다. 이 책을 통해 우리는 인간이 우주를 이해하는 법도, 윤리적인 판단까지도 수학적 사고를 바탕으로 하고 있음을 깨닫게 된다. 더 깊게 생각하는 데서 오는 짜릿하고 매력적인 희열에 빠지게 될 것이다.",1,국내도서-자연과학
9,9788990982728,63811314,살인의 문 1,"13,320원",740원,히가시노 게이고/이혁재,재인,"히가시노 게이고의 장편 『살인의 문』(전 2권)은 어린 시절부터 친구에게 철저히 인생을 농락당해 온 한 남자의 처절한 자기고백이다. 또한 서서히 침몰해가는 주인공이 불타는 복수심과 살인 충동을 증폭시키는 심리적 과정을 주인공 일인칭 시점의 섬세한 필치로 묘사한 문제작이다. 인간 내면의 어두운 심연, 부조리한 사회의 단면을 날카롭게 묘사해 온 작가 특유의 솜씨가 유감없이 발휘되어 있다는 점에서는 부도덕한 사회를 살아가는 인간 군상의 갖가지 모습과 심리를 파헤친 사회심리 소설에 가깝다고도 할 수 있다.",3,국내도서-소설/시/희곡
10,9788965706908,64340664,초격차,"16,200원",900원,권오현 /김상근,쌤앤파커스,"한국을 넘어 세계를 놀라게 한 경영의 귀재, 삼성전자 권오현 회장의 33년 초격차 조직 경영 전략! 리더, 조직, 전략, 인재라는 4가지 핵심 키워드를 기본으로 기술은 물론 조직, 시스템, 공정, 인재 배치, 문화에 이르기까지. 모든 부문에서 그 누구도 넘볼 수 없는, 격이 다른 최고의 전략들을 밝힌다. 권오현은 1985년 미국 삼성반도체연구소 연구원으로 처음 삼성에 입사해 삼성전자 회장 자리까지 오른 신화적 인물이다. 이 책은 삼성전자의 초격차 전략, 권오현 회장이 조직의 시스템을 만들고 진두지휘하면서 발휘한 리더십의 진면목을 명쾌하게 보여준다. 리더, 조직, 전략, 인재라는 4가지 핵심 키워드를 기본으로 기술은 물론 조직, 시스템, 공정, 인재 배치, 문화에 이르기까지 모든 부문에서 그 누구도 넘볼 수 없는 ‘격(格, level)’을 높이는 최고의 전략들을 밝힌다. 불가능한 것을 가능하게 만드는 집념, 한계를 뛰어넘어 누구도 넘볼 수 없는 ‘격’의 차이",1,국내도서-경제 경영
11,9788968331862,63038113,방구석 미술관,"15,120원",840원,조원재,블랙피쉬,"“미술 문지방? 가볍게 넘는다!” 낄낄 웃다 보면 빠져드는 미술 입덕 교양서 미술 팟캐스트 독보적 1위 「방구석 미술관」 요즘은 유명 화가들의 전시를 어렵지 않게 만날 수 있다. 하지만 막상 미술관을 찾아도, 감상은커녕 동물원 구경하듯 돌다 나오는 게 현실이다. 이참에 미술 좀 배워볼까 싶어 미술책을 꺼내 들면? 쏟아지는 미술 전문용어와 이론들에 흠씬 두들겨 맞고 바로 녹다운! 여기, 높게만 느껴지는 ‘미술 문지방’을 가볍게 넘게 해줄 미술 입덕 교양서 『방구석 미술관』이 출간됐다. 저자 조원재는 미술 분야 팟캐스트 1위 「방구석 미술관」의 기획자이자 진행자로, 특유의 감칠맛 나는 스토리텔링으로 미술 이야기를 유쾌하게 전하고 있다. 저자는 미술을 제대로 즐기기 위해선 화가들의 삶부터 제대로 파헤쳐봐야 한다고 말한다. 그러면서 왠지 이질감 들고 주눅 들게 만드는 미술관 속 미술계 거장들을 ‘방구석’으로 불러내, 그들의 사생활부터 명화의 숨은 뒷얘기까지 탈탈 털어낸다.",1,국내도서-예술
12,9791187119845,33529377,나는 나로 살기로 했다,"12,420원",690원,김수현,마음의숲,"진짜 ‘나’로 살기 위한 뜨거운 조언들. 어른이 처음인 당신을 위한 단단한 위로들. 이 책은 우리가 온전한 ‘나’로 살아가기 위해 무엇이 필요한지 말해준다. 돈 많고 잘나가는 타인의 SNS를 훔쳐보며 비참해질 필요 없고, 스스로에게 변명하고 모두에게 이해받으려 애쓰지 말라고 이야기한다. 불안하다고 무작정 열심히 할 필요 없고, 세상의 정답에 굴복하지 말라고 응원한다. 인생의 지나가는 사람들에게 더 이상 상처받지 말고, 누군가의 말에 흔들리지 말고, 자신만의 문제라고 착각하지 말라고. 우리에게 가장 필요한 말, 나답게 살라고 말한다.",1,국내도서-에세이
13,9791195522125,30387696,언어의 온도,"12,420원",690원,이기주,말글터,"언어에는 나름의 온도가 있다고 생각하는 저자가 일상에서 발견한 의미 있는 말과 글을 한 권의 책에 담았다. 저자는 단어의 어원과 유래, 그런 언어가 지닌 차가움과 따뜻함을 글감 삼아, 하찮아 보이는 것들의 소중함을 예찬한다. 페이지를 넘길 때마다 문장과 문장에 호흡을 불어넣으며 뜨거운 음식을 먹듯 찬찬히 곱씹어 읽다 보면, 독자 스스로 각자의 ‘언어 온도’를 되짚어볼 수 있을지 모른다.",1,국내도서-에세이
14,9788972756194,8157957,나미야 잡화점의 기적,"13,320원",740원,히가시노 게이고/양윤옥,현대문학,"지난 10년간 한국에서 가장 많이 팔린 소설이자 히가시노 게이고의 대표작. 30여 년째 비어 있는 폐가, ‘나미야 잡화점’에 숨어든 삼인조 좀도둑이 뜻밖에도 과거로부터 도착한 고민 상담 편지에 답장을 하면서 겪게 되는 기묘한 하룻밤의 이야기를 그린다. 작가는 시공간을 넘나드는 편지라는 설정을 단순한 판타지가 아닌 추리적인 향기와 깊이가 담긴 소재로 승화시킨다.",1,국내도서-소설/시/희곡
15,9788937473135,32972572,82년생 김지영,"11,700원",650원,조남주,민음사,"문학성과 다양성, 참신성을 기치로 한국문학의 미래를 이끌어 갈 신예들의 작품을 엄선한 「오늘의 젊은 작가」의 열세 번째 작품. 서민들의 일상 속 비극을 사실적이면서 공감대 높은 스토리로 표현하는 데 재능을 보이는 작가 조남주는 이번 작품에서 1982년생 '김지영 씨'의 기억을 바탕으로 한 고백을 한 축으로, 고백을 뒷받침하는 각종 통계자료와 기사들을 또 다른 축으로 삼아 30대를 살고 있는 한국 여성들의 보편적인 일상을 완벽하게 재현한다. 슬하에 딸을 두고 있는 서른네 살 김지영 씨는 어느 날 갑자기 이상 증세를 보인다. 시댁 식구들이 모여 있는 자리에서 친정 엄마로 빙의해 속말을 뱉어 내고, 남편의 결혼 전 애인으로 빙의해 그를 식겁하게 만들기도 한다.",1,국내도서-소설/시/희곡
16,9788990982735,63811317,살인의 문 2,"13,320원",740원,히가시노 게이고/이혁재,재인,"히가시노 게이고의 장편 『살인의 문』(전 2권)은 어린 시절부터 친구에게 철저히 인생을 농락당해 온 한 남자의 처절한 자기고백이다. 또한 서서히 침몰해가는 주인공이 불타는 복수심과 살인 충동을 증폭시키는 심리적 과정을 주인공 일인칭 시점의 섬세한 필치로 묘사한 문제작이다. 인간 내면의 어두운 심연, 부조리한 사회의 단면을 날카롭게 묘사해 온 작가 특유의 솜씨가 유감없이 발휘되어 있다는 점에서는 부도덕한 사회를 살아가는 인간 군상의 갖가지 모습과 심리를 파헤친 사회심리 소설에 가깝다고도 할 수 있다.",1,국내도서-소설/시/희곡
17,9788965746614,62279219,해리 1,"13,050원",720원,공지영,해냄,『높고 푸른 사다리』 이후 5년 만에 발표하는 공지영 작가의 장편소설. 작가는 이 작품의 집필을 위해 약 5년간 사건의 현장 속에 뛰어들어 취재를 했다. 불의한 인간들이 만들어낸 부정의 카르텔을 포착하고 맞서 나가는 약한 자들의 투쟁을 담은 이 소설은 선(善)이라고 믿어 의심치 않았던 사실의 이면에 도사리고 있는 악(惡)의 진실을 다루고 있어 더 충격적이다.,1,국내도서-소설/시/희곡
18,9791162540381,64367255,10년 동안 적금밖에 모르던 39세 김 과장은 어떻게 1년 만에 부동산 천재가 됐을까?,"15,120원",840원,김재수(렘군),비즈니스북스,"“10년 후에도 대한민국에 산다면 부동산 공부는 필수다!” 빠숑, 청울림, 호빵 등 유명 투자자들이 인정한 숨은 고수 렘군이 들려주는 부동산으로 제2, 3의 월급을 만드는 최고의 방법! 『10년 동안 적금밖에 모르던 39세 김 과장은 어떻게 1년 만에 부동산 천재가 됐을까?』는 생계형 외벌이 노동자였던 저자가 부동산 투자를 통해 자산을 100배로 불리고 경제적 자유를 누리게 된 과정과 그 투자전략을 담고 있다. ‘내 집 하나 마련해보리라’는 간절한 마음으로 시작해 유망 아파트 30채를 보유하게 되기까지 7년 동안 부동산 투자를 하면서 깨달은 것, 경험했던 것을 원칙별로 정리해놓았다. 언제 사고 팔아야 좋은지, 유망 지역은 어떻게 알아보는지, 내게 꼭 맞는 투자물건은 어떻게 찾는지 등 혼재와 악재에도 흔들리지 않는 투자 노하우를 이 책에서 만나볼 수 있다.",1,국내도서-경제 경영
19,9791196415228,63038514,운을 부르는 부자의 말투,"12,420원",690원,미야모토 마유미/김지윤,포레스트북스,"운 없이는 절대 부자가 될 수 없고, 무심코 내뱉는 한두 마디 말이 그 운을 좌우한다. 평범한 사람은 일만 하고, 부자는 말투부터 바꾼다. 이 대화법을 배우고 실천한 이에게 ‘반드시 일어날 기적’ 평범한 직장인이었던 저자 미야모토 마유미는 우연히 일본 납세액 랭킹 1위 억만장자 사업가 사이토 히토리를 만나 부자가 되는 방법을 배웠다. 그 뒤 실제로 사업가로 성공해 부자 순위에 이름을 올리는 등 인생역전을 이루었다. 『운을 부르는 부자의 말투』에는 저자가 부자가 될 수 있었던 운을 부르는 말투 비법이 고스란히 담겨 있다. 저자는 평범한 직장인이 단숨에 부자가 되는 일이 결코 자신에게만 일어날 수 있는 기적이 아니며, 부자가 되겠다고 결심한 뒤 이 대화법을 배우고 실천한 사람에게는 반드시 일어날 기적이라고 말한다.",1,국내도서-자기계발
20,9788936476694,63594853,나의 문화유산답사기 : 산사 순례,"16,200원",900원,유홍준,창비,"‘한국의 산사’, 유네스코 세계유산 등재 기념 특별판! 일찍이 산사를 예찬해온 유홍준의 ‘답사기’, 그 절정만 가려뽑은 단 한 권! 1994년 제1권 ‘남도답사 일번지’를 발간한 이래 올해까지 누적 판매부수 400만부를 넘긴 국내 최장수 베스트셀러 시리즈 『나의 문화유산답사기』는 국내편 10권에 걸쳐 우리나라 각지의 ‘산사’를 가장 열심히 공들여 소개한 바 있다. 저자 유홍준 교수는 우리 산사의 가치와 아름다움에 주목하고, 널리 알리고, 예찬해 마지않던 국내 최고의 전문가이기도 하다. 지난 6월 우리 산사 7곳이 유네스코 세계유산에 등재되었으니, 이제 ‘산사’는 우리만의 문화유산이 아니라 세계가 인정하는 자랑스러운 문화유산이 되었다. 유네스코 세계유산 등재를 기념하여 그간 ‘답사기’에 실렸던 남한의 대표적인 산사 20여 곳과, 아직은 가볼 수 없지만 언젠가는 가보게 될 북한의 산사 2곳을 가려뽑았다.",1,국내도서-역사
21,9791186686348,62229749,인생 우화,"14,400원",800원,류시화/블라디미르 루바로프,연금술사,"17세기부터 동유럽에서 구전되어 내려온 짧은 이야기들에서 소재를 빌리거나 영감을 받아, ""내가 몸담고 살아가는 세상의 엉뚱한 진실에 다가가기 위해"" 쓴 류시화 시인의 우화 45편을 수록했다. 독특한 그림과 개성 뚜렷한 주인공들은 물론, 의미 가득한 이야기로 가득한 우화집.",1,국내도서-소설/시/희곡
22,9791196045555,63692398,"결정, 흔들리지 않고 마음먹은 대로","14,400원",800원,애니 듀크/구세희,8.0(에이트 포인트),항상 좋은 결과를 보장받을 수는 없어도 언제나 좋은 결정은 할 수 있다! 어떤 상황에서도 흔들리지 않고 의사결정을 할 수 있는 사고법과 흥미로운 사례가 가득 담긴 새로운 전략서. 세계 최고 의사결정 전문가가 제시하는 미래를 바꾸는 최선의 결정법.,1,국내도서-자기계발
23,9788934972464,23030284,사피엔스,"19,800원","1,100원",유발 하라리/조현욱,김영사,"변방의 유인원 호모 사피엔스는 어떻게 세상의 지배자가 되었는가? 과학은 모든 종교의 미래인가? 인간의 유효기간은 언제까지인가? 멀고먼 인류의 시원부터 인지혁명, 농업혁명, 과학혁명을 거쳐 끊임없이 진화해온 인간의 역사를 다양하고 생생한 시각으로 조명한 전인미답의 문제작. 호모 사피엔스부터 인공지능까지, 역사, 사회, 생물, 종교 등 여러 학문의 경계를 넘나들며 역사의 시간을 종횡무진 써내려간 문명 항해기.",1,국내도서-인문
24,9791161319247,62161111,2019 전한길 한국사 필기노트+빵꾸노트,"18,900원",210원,전한길,에스티유니타스,"『2019 전한길 한국사 합격생 필기노트+빵꾸노트』는 방대한 양의 한국사 내용을 136페이지로 압축한 교재이다. 공무원 한국사 기출문제는 물론 검·인정 교과서의 주요 내용까지 모두 수록하였으며, 서체와 색 그리고 편집을 통해 수험생들이 쉽게 이해할 수 있도록 하였다. 또한, 필기노트의 내용을 빈칸 채우기 형식으로 구성한 ‘빵꾸노트’를 통해 수험생들의 학습에 도움이 될 수 있도록 하였다.",3,국내도서-수험서 자격증
25,9791195906840,63691247,당신이 허락한다면 나는 이 말 하고 싶어요,"14,400원",800원,김제동,나무의마음,"『당신이 허락한다면 나 이 말 하고 싶어요』는 김제동과 함께 읽는 헌법 이야기다. 우리는 보통 ‘법’이라고 하면, 우리를 통제하고 우리가 어떻게 살아야 하는지 테두리 지어놓은 것으로 생각한다. 그런데 김제동이 읽은 헌법은 그렇지 않았다. ‘국민이 국가를 어떻게 사용하는지 적어놓은 ‘국가 사용 설명서’였다. ‘나 이렇게 살아도 괜찮구나’ 그렇게 존엄을 일깨워주고, 억울한 일 당하지 말라고 다정하게 토닥여주는 헌법! 김제동이 읽은 헌법은 할머니 할아버지가 남겨주신 상속 문서이자, 오로지 ‘국민’들에게만 유리하고 국민이 ‘갑’인 계약서이자 연애편지였다. 김제동이 쓴 최초의 헌법 독후감인 이 책은, 딱딱하고 어려울 것 같기만 한 헌법을 김제동 특유의 입담과 재치를 살려 유쾌하고 따뜻하게 풀어내고 있다.",1,국내도서-에세이
26,9788965422631,61811179,해커스 토익 실전 1000제 1 READING 문제집,"10,710원",590원,해커스 어학연구소,해커스어학연구소,토익 최신 출제경향을 분석 반영한 전면개정판. 실전모의고사 10회분으로 토익 실전을 대비하고 실제 시험과 동일한 형태와 구성의 모의고사로 최종 마무리하자. 토익 단기 고득점을 위한 리딩 핵심 대비 전략 수록. 해커스인강에서 온라인 실전 모의고사 및 단어 암기 MP3를 제공한다.,1,국내도서-국어 외국어 사전
27,9791189125264,62652976,하루 5분 엄마의 말습관,"13,320원",740원,임영주,예담friend,엄마의 일상 언어 습관에 주목한 책이다. 저자는 구체적으로 엄마의 어떠한 말습관이 아이의 능력 및 정서 발달에 영향을 끼치는지 실제 상담 사례를 토대로 꼼꼼하게 분석해 솔루션을 제시한다. ‘하루 5분’은 상징적인 시간의 단위다. 적어도 하루에 5분씩만 엄마로서 아이에게 할 말을 의식하면서 사용하다 보면 평소에 하는 말만으로도 아이와 잘 지내면서 아이의 행동은 물론 마음까지 변화시킬 수 있을 것이다.,1,국내도서-가정 살림
28,9788994702346,9440838,부의 추월차선,"13,500원",750원,엠제이 드마코/신소영,토트출판사,"부자의 공식은 통계적 전략이 아니라, 부의 비밀을 파헤치고 지름길로 향하는 문을 여는, 완전히 심리적이고 수학적인 공식이다. 진짜 쓸모 있는 공식은 수학적으로 짜여 있을 뿐만 아니라 모호한 표현도 포함하지 않는다. 정말로 돈을 벌 수 있는 비밀, 수학적인 공식이 존재할까? 물론이다.",1,국내도서-경제 경영
29,9791162202913,58603565,모든 순간이 너였다,"12,420원",690원,하태완,위즈덤하우스,"SNS와 전작 『#너에게』를 통해 50만 명에 이르는 독자들에게 사랑받은 하태완 작가의 두 번째 에세이. 위로받고 싶을 때, 설레고 싶을 때, 사람에 사랑에 상처받았을 때… 삶의 모든 순간에 특별한 위로와 공감을 건넨다. 소중한 모든 순간을 나누고픈 사랑하는 사람에게, 미처 의식하지 못했던 지금 이 빛나는 순간을 조금 더 단단해진 마음으로 맞이하고 싶은 나에게, 선물해주고 싶은 책이다.",1,국내도서-에세이
30,9788925563367,60606247,"곰돌이 푸, 서두르지 않아도 괜찮아","12,420원",690원,곰돌이 푸 원작,알에이치코리아(RHK),"추억의 친구 ‘곰돌이 푸’가 전하는 지치지도, 포기하지도 않고 적당한 속도로 인생을 살아가는 방법. 『곰돌이 푸, 행복한 일은 매일 있어』의 두 번째 이야기이다. 전작에서 추억의 친구인 푸를 다시 만나는 기쁨을 느낄 수 있었다면, 이번 책에서는 인생의 위기들을 여유 있게 웃어넘기는 푸의 모습 속에서 만만치 않은 인생 내공을 느낄 수 있다.",1,국내도서-에세이
31,9788965422617,61811021,해커스 토익 실전 1000제 1 LISTENING 문제집,"10,710원",590원,해커스 어학연구소,해커스어학연구소,"토익 최신 출제경향을 분석 반영한 전면개정판. 실제 시험과 동일한 형태와 구성의 실전모의고사 10회분으로 토익 실전을 완벽하게 대비한다. 토익 단기 고득점을 위한 리스닝 핵심 대비 전략을 수록했으며, 토익 실전에 대비할 수 있는 6가지 버전의 MP3를 제공한다.",1,국내도서-국어 외국어 사전
