순위,ISBN,상품번호,상품명,판매가,YES포인트,저자,출판사,설명,출고예상일,관리분류
32,9791188874149,61329400,설민석의 한국사 대모험 7,"9,450원",520원,스토리박스/설민석 /정현희,아이휴먼,"재미있는 스토리와 다양한 한국사 이야기를 통해 어린이들에게 지식과 감동, 재미를 심어준 『설민석의 한국사 대모험』 시리즈의 일곱 번째 이야기. 평소 한국사를 통해 어린이들에게 반드시 필요한 소양인 지(知)ㆍ덕(德)ㆍ체(體)를 배울 수 있다는 것을 강조했던 설민석 선생님이 조금 더 쉽게 지덕체의 중요함을 이야기합니다. 역사 속 인물을 통해 지덕체를 배우게 된 온달이는 삼족오의 방울을 세 번 울리고 고구려의 영웅이 될 수 있을까요? 유교의 큰 스승이자 배움을 위해서라면 어린 사람에게 묻는 것도 부끄러워하지 않았던 지의 대표 이황을 통해서 지식을 쌓는 것은 물론 쌓은 지식을 사용하는 법도 배워 봅시다.",1,국내도서-어린이
33,9791188874217,64573109,설민석의 한국사 대모험 8,"9,450원",520원,스토리박스/설민석 /정현희,아이휴먼,"재미있는 스토리와 다양한 한국사 이야기를 통해 어린이들에게 지식과 감동, 재미를 심어준 『설민석의 한국사 대모험』 시리즈 여덟 번째 이야기, '위기 극복' 편. 8권에서는 위기에 처한 온달과 평강이의 관계, 북방 민족의 침입으로 위기를 맞은 고구려 등 등장인물들에게 닥친 위기와 위기를 극복하기 위해 노력하는 온달이의 모습을 다루고 있습니다.",1,국내도서-어린이
34,9788965746621,62279223,해리 2,"13,050원",720원,공지영,해냄,예리한 통찰력으로 부조리를 파헤치는 작가 공지영 소설. 해리성 인격장애를 앓는 이해리와 그와 함께 장애인 보호시설을 운영하는 '진보적' 신부 백진우. 안개의 도시 무진을 배경으로 불의한 인간들이 만들어낸 부정의 카르텔을 포착하고 맞선 약한 자들의 투쟁을 그렸다.,1,국내도서-소설/시/희곡
35,9791161319728,64391971,2019 선재국어 기출실록,"38,700원",430원,이선재,에스티유니타스,"똑같은 역사적 사실이라도 그 사실의 가치를 평가하고 서술하는 사관의 역량에 따라 그 의미는 다르게 기록된다. 『기출실록』은, 똑같은 기출문제라도 이를 수험에 적합한 방식으로 분류하고 가장 정확하고 이해하기 쉬우며 효율적인 해설을 더해 다른 기출문제집과 차별화된 책을 만들어 보자는 고민과 의도가 가장 잘 반영된 제목으로, 약점 체크용, 이론 정리 회독용으로 활용할 수 있는 기출문제집이다. 새로운 분류법을 사용하여 최신 기출 경향을 한눈에 파악할 수 있고, 문제와 해설을 분리하여 문제 편은 실전용 문제집으로, 해설 편은 이론 요약서로 활용하여 2회독의 효과를 누릴 수 있다. 『2019 선재국어 기출실록』과 함께 여러분의 꿈이 하루빨리 실현될 수 있기를 바란다.",3,국내도서-수험서 자격증
36,9791129489159,64444214,뼈 있는 아무 말 대잔치,"14,220원",790원,신영준/고영성,로크미디어,"#뼈아대 #신영준 #고영성 #성장_에세이 당신의 성장을 위한 에세이 뼈 있는 아무 말 대잔치는 『완벽한 공부법』, 『일취월장』의 두 저자가 쓴 성장 에세이다. 소셜 미디어에서 관찰한 수천 개의 게시물 중 행복, 후회, 자기 계발, 나쁜 상사, 꿈, 갑질, 차별, 아침에 일어나기, 미움, 조직 생활, 오해, 부모, 결혼, 관계, 노력, 실패 등 꼭 이야기해 주고 싶었던 주제를 뽑아 두 저자가 ‘뼈를 넣어’ 풀어 썼다. 앞선 『완벽한 공부법』과 『일취월장』이 각각 공부와 일을 통해 무언가 성취를 하는 데 초점을 맞추었다면 이번 『뼈 있는 아무 말 대잔치』는 성장에 초점을 맞췄다. 우리의 성장을 막는 고정관념이나, 사회에 만연해 있는 오해 등 오랜 기간 우리를 짓눌러온 것들에 대해 이야기한다. “잘하는 게 없어요”나, “좋아하는 일을 하는 게 당연하다.",1,국내도서-에세이
37,9791162207031,63830635,놓지 마 과학! 8,"8,820원",490원,신태훈/나승훈,위즈덤하우스,"부모와 아이가 손꼽아 기다리는 학습 만화 초등 과학의 기초를 잡아 주는 『놓지 마 과학!』 “정신이 덕분에 과학이 제일 쉬워졌어요~!” 『놓지 마 과학!』 8권 출간! 인기 절정의 웹툰 『놓지 마 정신줄!』의 작가들이 만든 과학 학습 만화 『놓지 마 과학!』 8권이 출간되었습니다. 1차분 1~5권에 이어 2차분 6~10권의 세 번째 권인 8권이 출간된 것이지요. 『놓지 마 과학!』 시리즈는 1권이 2016년 8월에 출간된 이후, 매번 새 책이 나올 때마다 학습 만화 베스트셀러로 자리 잡으며 판매 부수를 더하고 있어요. 그래서 다른 책은 몰라도 이 책만은 꼭 본다는 어린이 독자들의, 새 책의 출간 시기를 묻는 문의 전화가 잇따른다고 하지요. 2009년 8월 연재를 시작해 현재까지 10년째 이어 오며 조회 수 18억 뷰가 넘는 초인기 웹툰 『놓지 마 정신줄!』은 아이들의 사랑을 바탕으로 방송 애니메이션으로 만들어지기도 했어요.",1,국내도서-어린이
38,9788925564470,63592525,서울이 아니어도 오를 곳은 오른다,"16,200원",900원,김학렬,알에이치코리아(RHK),서울에서 기회를 놓쳤다면 이제 지방이다! 최고의 입지 전문가 빠숑의 대한민국 부동산 투자 시리즈 3부작 완결편. 수도권부터 지방 핵심도시와 급부상하는 강소도시까지. 국내 유일 전국 시군구 입지별 분석 및 투자가치 NO.1 전국 부동산과 투자 공략법을 공개한다.,1,국내도서-경제 경영
39,9788972758990,64088558,매스커레이드 나이트,"13,320원",740원,히가시노 게이고/양윤옥,현대문학,"경시청 수사 1과의 엘리트 형사 닛타 고스케 X 외유내강의 프로 호텔리어 나오미의 귀환 절대 속지 마라, 범인도 가면을 쓰고 있다 [매스커레이드 시리즈]는 시리즈를 좀처럼 내지 않는 작가가 유가와 교수, 가가 형사를 잇는 새로운 주인공 닛타 고스케 형사를 등장시킨 대형 추리물로, 첫 발표 당시부터 큰 화제를 모았다. 이 시리즈는 또한 독특하게도 최상의 서비스를 상징하는 일류 호텔을 무대로 사건이 펼쳐지는데, 작가는 ‘호텔’ 그 자체가 주역인 소설이 될 수 있도록 사건을 장치하는 동시에 ‘닛타 형사’와 더불어 ‘호텔리어 나오미’라는, 서로 다른 투철한 직업의식을 가진 캐릭터를 탄생시키게 됐다고 한다. 『매스커레이드 나이트』는 『매스커레이드 호텔』, 『매스커레이드 이브』에 이어 3년 만에 선보인 [매스커레이드 시리즈] 세 번째 작품이다.",1,국내도서-소설/시/희곡
40,9788965421832,27552436,해커스 토익 기출 보카,"11,610원",640원,David Cho,해커스어학연구소,"핵심 단어들의 최신 출제경향을 한 눈에 파악하는 “최신출제포인트” 및 시험에 자주 출제되는 빈출 어구, 혼동하기 쉬운 단어, 관련된 문법 포인트, Part 7의 동의어 문제 등 ‘단어와 관련된 모든 출제 패턴' 수록 뿐 아니라 빈출 단어를 신토익 유형의 예문과 함께 수록해 실전 감각을 향상시킨다.",3,국내도서-국어 외국어 사전
41,9791161980331,62089310,2018 위포트 NCS 직업기초능력평가+직무수행능력평가,"20,610원","1,140원",위포트 연구소 저,위포트,"2018 하반기 주요 공기업/공사공단 NCS 필기 전형에 대비하여 공기업 취업 입문자를 위해 NCS 모듈 분석 및 엄선 문제와 NCS 필기 최신 출제 경향이 반영된 적중 예상 문제를 수록하였다. 이 외에도 NCS 기반 채용 전형에 반드시 필요한 공기업 취업 대비 필수 상식 자료집과 인성검사 출제 경향 및 모의 테스트를 수록하였다. 또한, 위포트 NCS 교재 구매자만을 위한 공기업 합격 8종 혜택을 제공한다.",3,국내도서-수험서 자격증
42,9788901223032,60208514,하마터면 열심히 살 뻔했다,"13,500원",750원,하완,웅진지식하우스,"노력이 배신하고, 인생에 사사건건 고나리질하는 현실 열심히 ‘내’ 인생을 살기 위해 더 이상 열심히 살지 않기로 결심했다! 한 남자의 인생을 건 본격 야매 득도 에세이 우리는 태어난 이상 열심히 살아야 한다. 좋은 대학에 가야 하고, 좋은 직장에 가야 하고, 좋은 사람을 만나서 결혼하고 아이를 낳아야 비로소 진정한 어른이 된다. 보험과 저축, 적금, 집, 차 등도 이 나이가 되면 이 정도는 챙겨야 한다. 과연 이런 인생 매뉴얼은 누가, 언제 만들었을까? 이 매뉴얼대로 살지 않는다면 그건 실패한 인생인 걸까? 매뉴얼에 가까워지도록 정말 열심히 살았는데도? 그럼 누구를 원망해야 할까? 누구나 한 번쯤은 이런 원망과 고민에 휩싸일 것이다. 이 책의 저자 역시 참으로 오랜 시간 세상을 원망하고 미래를 고민했다. 그러다 불현듯 깨달음처럼 의문이 찾아왔다. ‘나는 어디를 향해 이렇게 열심히 달리고 있는 걸까?’ 어디를 향해 달려가는지 알 수 없어 멈춰 섰다.",1,국내도서-에세이
43,9788969651167,62223556,2018 하반기 해커스 GSAT 삼성직무적성검사 최신기출유형,"19,710원","1,090원",해커스 취업교육연구소 저,챔프스터디,"2018 하반기 삼성 GSAT 대비 교재로 2018 상반기 GSAT 기출유형 및 출제경향을 완벽 반영하였다. GSAT 최신기출유형 공략부터 실전까지 5일만에 완성할 수 있도록 구성하였다. 체계적인 4단계 학습 시스템으로 구성되어 있고, 개인별 약점 극복을 위한 '취약 유형 극복 프로그램'을 제공한다. 전 영역 필수이론과 삼성 시사이슈를 완벽 요약한 「GSAT 핵심 정리 핸드북」을 수록하였다.",3,국내도서-수험서 자격증
44,9791161316697,62611211,2019 선재국어 세트,"46,800원",520원,이선재,에스티유니타스,"강력한 이론에 풍부한 문제 풀이를 더한 『2019 선재국어』는 7 · 9급 공무원 시험을 준비하는 수험생들을 대상으로 한 국어 기본서로, 전 4권과 워크북으로 구성되어 있다. 1권은 「국어 문법 · 국어 규범」, 2권은 「말과 글 · 독해」, 3권은 「현대 문학 · 고전 문학」,4권은 「어휘 · 한자」로, 영역별로 분권화되어 있어 편리하다. 또한 워크북인 「공무원 합격으로 가는 선재국어 W」에는 체계적으로 정리된 단순 암기 자료와 독해력과 문학 분석력을 높일 수 있는 훈련지가 수록되어 있어 지식형 문제와 수능형(지문 분석형) 문제 모두를 대비할 수 있다.",3,국내도서-수험서 자격증
45,9788917228854,57464390,ETS TOEIC 토익 정기시험 기출문제집 RC 리딩,"11,250원",620원,ETS,YBM(와이비엠),"토익 출제기관인 ETS의 정기시험 최신 기출문제 5세트를 수록했다. 실제 출제됐던 토익 문제로 실전 감각을 제대로 키울 수 있다. 정확하고 체계적인 문항 분석, 상세하고 이해하기 쉬운 해설도 제공한다. 해설집을 책속의 책 형태로 제작해서, 해설집을 별매해야 하는 다른 교재보다 경제적이다.",1,국내도서-국어 외국어 사전
46,9788934982555,63748762,"나의 가족, 사랑하나요?","11,700원",650원,전이수,주니어김영사,"자연을 보면서 배운다 『나의 가족 사랑하나요』에서 전이수는 ‘자연을 보면서, 동물들을 보면서 많은 것을 배운다.’고 했어요. 고개를 숙이고 아주 천천히 움직이며 발 한쪽을 떼는 두루미를 보면서 움직이는 자신의 몸을 바라본 적이 없다고 했지요. 두루미를 보고 어떻게 자신의 몸을 생각해 봤는지 놀라울 따름이에요. 또 오름에 올라서 바라본 풍경들, 여름이 가고 난 뒤에도 바다가 깨끗하기를 바라는 마음, 회색빛 도시 속에 집을 지은 새들을 보고 설레는 마음까지 전이수의 곁에는 늘 자연이 있고, 자신의 마음을 가득 채우고 있답니다. 전이수에게 자연은 자신의 삶을 가꾸어 가는 소중하고 고마운 존재예요.",1,국내도서-어린이
47,9788969651198,63312795,2018 하반기 해커스 GSAT 삼성직무적성검사 실전모의고사,"18,810원","1,040원",해커스 취업교육연구소,챔프스터디,『2018 하반기 해커스 GSAT 삼성직무적성검사 실전모의고사』는 삼성그룹 2018년 하반기 채용 대비 도서로 2018 상반기 GSAT 기출유형 및 출제경향을 전부 반영하였다. 5일 이면 충분한 ‘GSAT 최종 마무리 학습플랜’을 수록하였으며 실제 시험과 동일한 형태 및 난이도의 GSAT 실전모의고사 5회분이 담겨있다.,3,국내도서-수험서 자격증
48,9788917228847,57464267,ETS TOEIC 토익 정기시험 기출문제집 LC 리스닝,"11,250원",620원,ETS,YBM(와이비엠),"ETS 토익 정기시험 기출문제집으로 공부해야 하는 이유는? 2018 토익 고득점 학습 트렌드가 바뀐다! 출제문제 그대로 RC 기출학습, 출제음성 그대로 LC 기출학습이 가능하다. ETS 토익 정기시험 기출문제집(LC, RC)은 출제기관 ETS의 실제 토익 기출문제를 접할 수 있는 유일한 토익 교재로 토익 학습에 적합하고 효율적이다. 정기시험의 유형과 난이도를 직접 체험하여 실전 감각을 최대치로 끌어올릴 수 있으며, 정기시험과 동일한 성우 음성으로 실제 시험장과 같은 분위기에서 학습이 가능하다.",1,국내도서-국어 외국어 사전
49,9791157523399,18116912,영어회화 100일의 기적,"12,150원",670원,문성현,넥서스,"평생 영어 초보, 영어 포기자를 위한 D-100 말문트기 프로젝트. 책과 강의, 그리고 스피킹 훈련으로 보고 듣고 말하는 3D 입체 학습을 제공한다. 원어민이 직접 녹음한 생생한 대화문으로 원어민의 뉘앙스와 주요 표현을 익히고, 국내파 영어연수 전문가 문코치의 해설 강의로 탄탄하게 실력을 다진다.",1,국내도서-국어 외국어 사전
50,9791189320034,64499437,만화 과호흡 박스 세트,"24,120원","1,340원",뿡빵뀨,디앤씨미디어(D&C미디어),"국내 최초 1인 제작 BL 애니메이션이 단행본으로 재탄생! ‘18살의 짝사랑, 27살의 재회. 엇갈린 사랑의 방향은?’ 명이는 동창회에서 첫사랑의 상대, 선호와 재회한다. 술자리에 어울리지 못하고, 조금은 변한 선호를 눈에 새기다 자리를 뜨려 하는데… “너는 담배 말곤 변한 게 없네.” 돌아가려는 명이를 따라나선 선호가 건넨 말의 의미는? 엇갈렸던 두 사람은 서로의 마음을 확인할 수 있을까. 아련한 첫사랑의 기억과 다시 만난 그들의 이야기, .",1,국내도서-만화/라이트노벨
51,9788965132288,8491738,어떻게 살 것인가,"13,500원",750원,유시민,생각의길,"대중적 글쓰기로 많은 독자들의 사랑을 받았던 유시민이 스스로 가장 자기답다고 생각하는 모습으로 돌아왔다. 정치인 유시민에 가려져 있었던 자연인 유시민, 지식인 유시민의 사람과 자연, 사회와 역사에 대한 생각을 온전하게 보여준다. 이 책을 쓰는 작업은 그에게 자신의 미래를 새롭게 고민하고 설계하는 과정이었으며, 그는 책의 결론에 부합하는 결정을 내렸다. 자기다운 삶, 자신이 원하는 인생을 살기로 한 것이다.",1,국내도서-인문
52,9788957369364,57817824,무례한 사람에게 웃으며 대처하는 법,"12,420원",690원,정문정,가나출판사,"사람들과 만나 수많은 이야기를 하고 온 날, 마음이 헛헛할 때가 있다. 나는 왜 그렇게 말했을까? 그 사람은 내게 왜 그렇게 무례했을까? 그들은 내게 상처를 주고 당혹감을 안기며, 기껏 붙잡고 사느라 힘든 자존감을 뒤흔들어 놓는다. 어떤 인간관계는 유지하는 그 자체만으로 지나치게 에너지가 들 때가 있다. 내 속마음을 말하고 싶지만, 오해받을까 봐, 이기적인 사람처럼 보일까 봐, 하고 싶은 말을 속으로만 삭이게 된다. 그런 이들에게 감정의 동요 없이 “금 밟으셨어요” 하고 알려줄 방법은 없을까? 당연히 있다. 다만 그 방법을 실제로 사용하려면 연습이 좀 필요하다. 책에는 작가가 지금까지 시도한 훈련법 중 가장 효과적이었던 방법과 그 과정에서 깨달은 것들을 담았다. 앞으로 무례한 사람을 만나도 절대 기죽지 말자.",1,국내도서-에세이
53,9788932919126,60896840,고양이 1,"11,520원",640원,베르나르 베르베르/전미연,열린책들,"인간이 상상하기 어려운 타자의 시각을 도입하여, 인간 중심주의를 해체하고 이 지구에서 인간이 차지해야 할 적절한 위치를 끊임없이 고민해 온 베르나르 베르베르가 『개미』에 이어 『고양이』에서는 좀 더 성숙하고 발전된 문제 의식을 보여준다. 파리에서 살고 있는 암고양이 바스테트의 시각에서 바라본 인간의 문명을 그린 장편 소설.",1,국내도서-소설/시/희곡
54,9791159496875,59592751,에듀윌 한국사능력검정시험 2주끝장 고급 개정판 3.0,"18,900원","1,050원",한국사기출연구회 편저,에듀윌,"대다수의 수험생들이 한국사능력검정시험을 준비하는 기간은 2주! 시험 준비 기간이 길면 누구나 합격하겠지만 수험생들은 늘 시간이 부족하다. 2주 만에 한국사능력검정시험 고급에 합격하기 위해서는 전략이 필요하다. 이를 위해서 최근 3년간 출제된 600문항의 기출문제의 모든 것을 분석하고 정리했다. 600개의 출제주제, 600개의 자료, 600개의 정답 선택지와 2400개의 오답 선택지를 모조리 추출하였고, 추출한 내용을 같은 주제별로 재배열하여 ‘기출리포트’에 담았다. 그리고 이를 바탕으로 불필요하고 지엽적인 내용을 제외한 뒤 합격할 수 있는 핵심이론을 72주제로 정리했다.",3,국내도서-수험서 자격증
55,9791161319513,63810993,2019 이동기 4주완성 핵심문법 700제 단원별 정리+실전문제,"17,100원",190원,이동기,에스티유니타스,"『4주완성 핵심문법 700제 단원별 정리+실전문제』는 영어 문법의 이론을 문제에 적용하여 익히고, 직관적으로 문제를 풀 수 있도록 4주 28일간 학습할 수 있는 분량으로 구성된 교재이다. 우선 첫째 주(DAY 01~07)에 수록된 O, X 문제를 통해 문장을 분석하는 능력을 기르는 동시에 앞서 학습한 영문법 이론을 단원별로 체계적으로 정리할 수 있다. 둘째 주(DAY 08~14)에서는 선별된 O, X 문제를 통해 문장 속에서 시험에 출제될만한 중요한 문법 포인트를 파악하는 연습을 집중적으로 할 수 있다. 셋째 주와 넷째 주(DAY 15~28)에서는 앞에서 학습한 문장의 문법포인트 파악 훈련을 기반으로 빈칸 문제, 밑줄 문제, 영작 문제 등 실제 시험과 가장 유사한 유형과 난이도의 문제를 직접 풀어 실전 감각을 기르고 실전 문제풀이 능력을 향상시켜 흔들리지 않는 문법점수를 확보할 수 있을 것이다.",3,국내도서-수험서 자격증
56,9788933870693,29433467,설민석의 조선왕조실록,"19,800원","1,100원",설민석,세계사,"대한민국 대표 한국사 강사 설민석이 27명의 조선의 왕들을 한 권으로 불러 모아 핵심적인 주요 사건들을 풀어썼다. 설민석 특유의 흡입력 있는 간결함과 재치 있는 말투를 그대로 책에 녹여냈고, 책 중간중간의 질의응답 구성을 통해 바로 앞에서 강연을 듣고 있다는 느낌을 준다.",1,국내도서-역사
57,9788932919133,60896871,고양이 2,"11,520원",640원,베르나르 베르베르/전미연,열린책들,"인간이 상상하기 어려운 타자의 시각을 도입하여, 인간 중심주의를 해체하고 이 지구에서 인간이 차지해야 할 적절한 위치를 끊임없이 고민해 온 베르나르 베르베르가 『개미』에 이어 『고양이』에서는 좀 더 성숙하고 발전된 문제 의식을 보여준다. 파리에서 살고 있는 암고양이 바스테트의 시각에서 바라본 인간의 문명을 그린 장편 소설.",1,국내도서-소설/시/희곡
58,9788925564289,62161493,나는 오늘도 경제적 자유를 꿈꾼다,"15,120원",840원,청울림(유대열),알에이치코리아(RHK),"일하지 않아도 매달 월급이 꼬박꼬박 입금된다면? 월급으로 풍요롭게 살아가고 있는데 내 자산은 저절로 불어나고 있다면? 평생 돈 걱정 없이 여유롭게 살아갈 수 있을 것이다. 그거야말로 진정한 경제적 자유다! 『나는 오늘도 경제적 자유를 꿈꾼다』는 평범한 직장인이던 저자가 퇴사 3년 만에 월세 1,000만 원 시스템을 만들기까지의 치열한 과정, 실제로 분석하고 체득한 실전 투자 전략, 투자 원칙 등 모든 것을 담았다. 저자 청울림(필명)은 3년 만에 돈이 저절로 불어나는 시스템을 갖추고 나자 단순히 돈 걱정에서 자유로워진 것뿐 아니라, 세상을 보는 눈, 삶의 목적 등 모든 것이 바뀌었다고 말한다. 그는 평범한 사람도 부자가 되는 길을 찾고, 치열하게 노력하면 단기간에 경제적 자유를 누릴 수 있다고, 그 길로 가볼 것을 독려한다. 특히 이 책에는 부자가 되기 위해 필요한 마인드부터 다루고 있어 누구나 경제적 자유의 가능성을 발견하고 위대한 첫발을 뗄 수 있을 것이다.",1,국내도서-경제 경영
59,9791162205808,60545355,완벽하게 사랑하는 너에게,"11,700원",650원,그림에다,위즈덤하우스,"SNS 20만 팔로워의 마음을 다독여 준 공감 가족 에세이. 저자 그림에다는 아이의 마음을 섬세하게 바라보고, 아내만의 시간을 만들어 주고, 아내의 이야기에 귀를 기울인다. 육아의 정신 없음이나 고단함 대신에 가족을 이해하고, 서로 다독여 주고, 사랑하는 방법을 배워가는 과정을 아빠의 따뜻한 시선으로 담았다.",1,국내도서-에세이
60,9791187310129,64431496,하버드 협상 강의,"14,220원",790원,하버드 공개 수업 연구회/송은진,북아지트,"“비즈니스도, 일상생활도 매 순간이 협상의 장이다” 더 나은 인생을 살게하는 나만의 협상력을 갖춰라! 인생에서 발생하는 자잘한 충돌이나 관계를 얼마나 잘 처리하느냐가 우리 인생의 성공 여부를 결정하고, 나아가 원하는 삶을 살 가능성을 높여준다. 그 중심에는 바로 ‘얼마나 잘 협상할 줄 아는가’가 있다. 비즈니스에서 더 좋은 성과를 만들어내는 것은 물론이고, 심지어 가족들과 저녁 메뉴를 고를 때조차 말 한마디만 잘해도 그 과정과 결과를 더 나아지게 만들지 않는가. 협상만으로도 돈이 없어도 돈을 벌게 하고, 평생의 비즈니스 동반자를 얻고, 감정 싸움 없는 근사한 하루를 보낼 수 있다. 이 책을 통해 협상의 무한한 매력을 하나씩 찾아갈 수 있을 것이다.",1,국내도서-자기계발
61,9791161980409,63694221,2018 하반기 위포트 GSAT 삼성직무적성검사 통합편,"20,520원","1,140원",위포트 연구소 저,위포트,"『2018 하반기 위포트 GSAT 삼성직무적성검사 통합편』은 2018 상반기 삼성 GSAT 최신 출제 경향을 완벽 반영하였으며, GSAT 입문자를 위해 28개 세부 유형 분석 및 고득점 전략을 수록하였다. 3단계 난이도별 문제를 통해 기초 학습부터 심화 학습까지 가능하며, 실전 모의고사를 통해 학습을 완벽히 마무리할 수 있다. 또한, 경쟁자 대비 실력을 확인할 수 있는 모의고사 결과 분석표와 최종 점검을 위한 GSAT 핵심 자료집을 포함한 8종 혜택을 무료로 제공한다.",3,국내도서-수험서 자격증
